what is the highest point in florida ?	_answer ( NV , _highest ( V0 , ( _place ( V0 ) , _loc ( V0 , NV ) , _const ( V0 , _stateid ( florida ) ) ) ) )
what are the high points of states surrounding mississippi ?	_answer ( NV , ( _high_point ( NV , V1 ) , _loc ( V1 , V0 ) , _state ( V0 ) , _next_to ( V0 , NV ) , _const ( V0 , _stateid ( mississippi ) ) ) )
what state has the shortest river ?	_answer ( NV , ( _state ( V0 ) , _loc ( NV , V1 ) , _shortest ( V0 , _river ( V0 ) ) ) )
what is the tallest mountain in the united states ?	_answer ( NV , _highest ( V0 , ( _mountain ( V0 ) , _loc ( V0 , NV ) , _const ( V0 , _countryid ( usa ) ) ) ) )
what is the capital of maine ?	_answer ( NV , ( _capital ( V0 ) , _loc ( V0 , NV ) , _const ( V0 , _stateid ( maine ) ) ) )
what are the populations of states through which the mississippi river run ?	_answer ( NV , ( _population ( NV , V1 ) , _state ( V0 ) , _const ( NV , _riverid ( mississippi ) ) , _river ( V0 ) , _traverse ( V0 , V1 ) ) )
name all the lakes of us ?	_answer ( NV , ( _lake ( V0 ) , _loc ( V0 , NV ) , _const ( V0 , _countryid ( usa ) ) ) )
which states border states through which the mississippi traverses ?	_answer ( NV , ( _state ( V0 ) , _next_to ( V0 , NV ) , _state ( V0 ) , _const ( NV , _riverid ( mississippi ) ) , _traverse ( V0 , V1 ) ) )
what is the highest mountain in alaska ?	_answer ( NV , _highest ( V0 , ( _mountain ( V0 ) , _loc ( V0 , NV ) , _const ( V0 , _stateid ( alaska ) ) ) ) )
what is the population of illinois ?	_answer ( NV , ( _population ( NV , V1 ) , _const ( V0 , _stateid ( illinois ) ) ) )
name all the rivers in colorado ?	_answer ( NV , ( _river ( V0 ) , _loc ( V0 , NV ) , _const ( V0 , _stateid ( colorado ) ) ) )
in which state does the highest point in usa exist ?	_answer ( NV , ( _loc ( NV , V1 ) , _state ( V1 ) , _highest ( V0 , ( _place ( V0 ) , _loc ( V0 , NV ) , _const ( V0 , _countryid ( usa ) ) ) ) ) )
which state is the city denver located in ?	_answer ( NV , ( _state ( V0 ) , _city ( NV ) , _const ( V0 , _cityid ( denver , _ ) ) , _loc ( V0 , V1 ) ) )
what is the lowest point in texas ?	_answer ( NV , _lowest ( V0 , ( _place ( V0 ) , _loc ( V0 , NV ) , _const ( V0 , _stateid ( texas ) ) ) ) )
how many states have a city called rochester ?	_answer ( NV , _count ( NV , ( _state ( V0 ) , _loc ( NV , V1 ) , _const ( V0 , _cityid ( rochester , _ ) ) ) , V2 ) )
which capitals are in the states that border texas ?	_answer ( NV , ( _capital ( V0 ) , _loc ( V0 , NV ) , _state ( V0 ) , _next_to ( V0 , NV ) , _const ( V0 , _stateid ( texas ) ) ) )
how many people live in austin ?	_answer ( NV , ( _population ( NV , V1 ) , _const ( V0 , _cityid ( austin , _ ) ) ) )
what states have rivers named colorado ?	_answer ( NV , ( _state ( V0 ) , _loc ( NV , V1 ) , _const ( V0 , _riverid ( colorado ) ) ) )
what is the size of texas ?	_answer ( NV , ( _size ( NV , V1 ) , _const ( V0 , _stateid ( texas ) ) ) )
what is the shortest river in the usa ?	_answer ( NV , _shortest ( V0 , ( _river ( V0 ) , _loc ( V0 , NV ) , _const ( V0 , _countryid ( usa ) ) ) ) )
what are the major cities of the us ?	_answer ( NV , ( _major ( V0 ) , _city ( V0 ) , _loc ( V0 , NV ) , _const ( V0 , _countryid ( usa ) ) ) )
which state border kentucky ?	_answer ( NV , ( _state ( V0 ) , _next_to ( V0 , NV ) , _const ( V0 , _stateid ( kentucky ) ) ) )
what is the population of oregon ?	_answer ( NV , ( _population ( NV , V1 ) , _const ( V0 , _stateid ( oregon ) ) ) )
what states have a city named austin ?	_answer ( NV , ( _state ( V0 ) , _loc ( NV , V1 ) , _const ( V0 , _cityid ( austin , _ ) ) ) )
what is the highest elevation in south carolina ?	_answer ( NV , _highest ( V0 , ( _place ( V0 ) , _loc ( V0 , NV ) , _const ( V0 , _stateid ( ' south carolina ' ) ) ) ) )
how many people live in austin texas ?	_answer ( NV , ( _population ( NV , V1 ) , _const ( V0 , _cityid ( austin , tx ) ) ) )
what are the rivers in the state of texas ?	_answer ( NV , ( _river ( V0 ) , _loc ( V0 , NV ) , _state ( V0 ) , _const ( V0 , _stateid ( texas ) ) ) )
what is the lowest point of colorado ?	_answer ( NV , _lowest ( V0 , ( _place ( V0 ) , _loc ( V0 , NV ) , _const ( V0 , _stateid ( colorado ) ) ) ) )
what is the population of atlanta ?	_answer ( NV , ( _population ( NV , V1 ) , _const ( V0 , _cityid ( atlanta , _ ) ) ) )
what rivers are in utah ?	_answer ( NV , ( _river ( V0 ) , _loc ( V0 , NV ) , _const ( V0 , _stateid ( utah ) ) ) )
what river runs through the most states ?	_answer ( NV , _most ( V0 , NV , ( _river ( V1 ) , _traverse ( V1 , V0 ) , _state ( V0 ) ) ) )
what is the population of sacramento ?	_answer ( NV , ( _population ( NV , V1 ) , _const ( V0 , _cityid ( sacramento , _ ) ) ) )
could you tell me what is the highest point in the state of oregon ?	_answer ( NV , _highest ( V0 , ( _place ( V0 ) , _loc ( V0 , NV ) , _state ( V0 ) , _const ( V0 , _stateid ( oregon ) ) ) ) )
which states does the mississippi river run through ?	_answer ( NV , ( _state ( V0 ) , _const ( NV , _riverid ( mississippi ) ) , _river ( V0 ) , _traverse ( V0 , V1 ) ) )
what are the major cities in the smallest state in the us ?	_answer ( NV , ( _major ( V0 ) , _city ( V0 ) , _loc ( V0 , NV ) , _smallest ( V0 , ( _state ( V0 ) , _loc ( V0 , NV ) , _const ( V0 , _countryid ( usa ) ) ) ) ) )
how high is guadalupe peak ?	_answer ( NV , ( _elevation ( NV , V1 ) , _const ( V0 , _placeid ( ' guadalupe peak ' ) ) ) )
what river runs through illinois ?	_answer ( NV , ( _river ( V0 ) , _traverse ( V0 , NV ) , _const ( V0 , _stateid ( illinois ) ) ) )
how long is the mississippi river ?	_answer ( NV , ( _len ( NV , V1 ) , _const ( V0 , _riverid ( mississippi ) ) , _river ( V0 ) ) )
how high is the highest point in the largest state ?	_answer ( NV , ( _elevation ( NV , V1 ) , _highest ( V0 , ( _place ( V0 ) , _loc ( V0 , NV ) , _largest ( V0 , _state ( V0 ) ) ) ) ) )
what is the area of south carolina ?	_answer ( NV , ( _area ( NV , V1 ) , _const ( V0 , _stateid ( ' south carolina ' ) ) ) )
what are the states through which the longest river runs ?	_answer ( NV , ( _state ( V0 ) , _longest ( NV , ( _river ( V0 ) , _traverse ( V0 , V1 ) ) ) ) )
where is new orleans ?	_answer ( NV , ( _loc ( NV , V1 ) , _const ( V0 , _cityid ( ' new orleans ' , _ ) ) ) )
in what state is mount mckinley ?	_answer ( NV , ( _loc ( NV , V1 ) , _state ( V1 ) , _const ( V0 , _placeid ( ' mount mckinley ' ) ) ) )
what state has highest elevation ?	_answer ( NV , ( _state ( V0 ) , _loc ( NV , V1 ) , _highest ( V0 , _place ( V0 ) ) ) )
what is the size of california ?	_answer ( NV , ( _size ( NV , V1 ) , _const ( V0 , _stateid ( california ) ) ) )
what is the smallest state that borders texas ?	_answer ( NV , _smallest ( V0 , ( _state ( V0 ) , _next_to ( V0 , NV ) , _const ( V0 , _stateid ( texas ) ) ) ) )
how many citizens in alabama ?	_answer ( NV , ( _population ( NV , V1 ) , _const ( V0 , _stateid ( alabama ) ) ) )
in which state is rochester ?	_answer ( NV , ( _loc ( NV , V1 ) , _state ( V1 ) , _const ( V0 , _cityid ( rochester , _ ) ) ) )
how many states in the us does the shortest river run through ?	_answer ( NV , _count ( NV , ( _state ( V0 ) , _loc ( V0 , NV ) , _const ( V0 , _countryid ( usa ) ) , _shortest ( NV , _river ( V0 ) ) , _traverse ( V0 , V2 ) ) , V3 ) )
what is the biggest state in continental us ?	_answer ( NV , _largest ( V0 , ( _state ( V0 ) , _loc ( V0 , NV ) , _const ( V0 , _countryid ( usa ) ) ) ) )
what is the area of the largest state ?	_answer ( NV , ( _area ( NV , V1 ) , _largest ( V0 , _state ( V0 ) ) ) )
where is mount whitney ?	_answer ( NV , ( _loc ( NV , V1 ) , _const ( V0 , _placeid ( ' mount whitney ' ) ) ) )
how many states does iowa border ?	_answer ( NV , _count ( NV , ( _state ( V0 ) , _const ( NV , _stateid ( iowa ) ) , _next_to ( V0 , V1 ) ) , V2 ) )
which states does the longest river cross ?	_answer ( NV , ( _state ( V0 ) , _longest ( NV , _river ( V0 ) ) , _traverse ( V0 , V1 ) ) )
what river flows through kansas ?	_answer ( NV , ( _river ( V0 ) , _traverse ( V0 , NV ) , _const ( V0 , _stateid ( kansas ) ) ) )
what is the population of austin texas ?	_answer ( NV , ( _population ( NV , V1 ) , _const ( V0 , _cityid ( austin , tx ) ) ) )
what is the capital of vermont ?	_answer ( NV , ( _capital ( V0 ) , _loc ( V0 , NV ) , _const ( V0 , _stateid ( vermont ) ) ) )
which states border colorado ?	_answer ( NV , ( _state ( V0 ) , _next_to ( V0 , NV ) , _const ( V0 , _stateid ( colorado ) ) ) )
how long is the mississippi ?	_answer ( NV , ( _len ( NV , V1 ) , _const ( V0 , _riverid ( mississippi ) ) ) )
what state has the largest population density ?	_answer ( NV , _largest ( NV , ( _state ( V1 ) , _density ( V1 , V0 ) ) ) )
what states border georgia ?	_answer ( NV , ( _state ( V0 ) , _next_to ( V0 , NV ) , _const ( V0 , _stateid ( georgia ) ) ) )
what is the capital of pennsylvania ?	_answer ( NV , ( _capital ( V0 ) , _loc ( V0 , NV ) , _const ( V0 , _stateid ( pennsylvania ) ) ) )
what are the biggest rivers in texas ?	_answer ( NV , _longest ( V0 , ( _river ( V0 ) , _loc ( V0 , NV ) , _const ( V0 , _stateid ( texas ) ) ) ) )
what is the longest river in the united states ?	_answer ( NV , _longest ( V0 , ( _river ( V0 ) , _loc ( V0 , NV ) , _const ( V0 , _countryid ( usa ) ) ) ) )
what is the capital of utah ?	_answer ( NV , ( _capital ( V0 ) , _loc ( V0 , NV ) , _const ( V0 , _stateid ( utah ) ) ) )
what state has the smallest population density ?	_answer ( NV , _smallest ( NV , ( _state ( V1 ) , _density ( V1 , V0 ) ) ) )
which capitals are not major cities ?	_answer ( NV , ( _capital ( V0 ) , \+ ( _major ( V0 ) , _city ( V0 ) ) ) )
what is the biggest city in nebraska ?	_answer ( NV , _largest ( V0 , ( _city ( V0 ) , _loc ( V0 , NV ) , _const ( V0 , _stateid ( nebraska ) ) ) ) )
what is the population of texas ?	_answer ( NV , ( _population ( NV , V1 ) , _const ( V0 , _stateid ( texas ) ) ) )
what is the shortest river in the united states ?	_answer ( NV , _shortest ( V0 , ( _river ( V0 ) , _loc ( V0 , NV ) , _const ( V0 , _countryid ( usa ) ) ) ) )
what is the population of rhode island ?	_answer ( NV , ( _population ( NV , V1 ) , _const ( V0 , _stateid ( ' rhode island ' ) ) ) )
what is the state with the lowest point ?	_answer ( NV , ( _state ( V0 ) , _loc ( NV , V1 ) , _lowest ( V0 , _place ( V0 ) ) ) )
what is the longest river in new york ?	_answer ( NV , _longest ( V0 , ( _river ( V0 ) , _loc ( V0 , NV ) , _const ( V0 , _stateid ( ' new york ' ) ) ) ) )
what is the longest river that runs through a state that borders tennessee ?	_answer ( NV , _longest ( V0 , ( _river ( V0 ) , _traverse ( V0 , NV ) , _state ( V0 ) , _next_to ( V0 , NV ) , _const ( V0 , _stateid ( tennessee ) ) ) ) )
how many major cities are in arizona ?	_answer ( NV , _count ( NV , ( _major ( V0 ) , _city ( V0 ) , _loc ( V0 , NV ) , _const ( V0 , _stateid ( arizona ) ) ) , V2 ) )
what are the neighboring states for michigan ?	_answer ( NV , ( _next_to ( V0 , NV ) , _state ( V1 ) , _const ( V0 , _stateid ( michigan ) ) ) )
what state that borders texas is the largest ?	_answer ( NV , _largest ( V0 , ( _state ( V0 ) , _next_to ( V0 , NV ) , _const ( V0 , _stateid ( texas ) ) ) ) )
what is the shortest river ?	_answer ( NV , _shortest ( V0 , _river ( V0 ) ) )
how many states border the state that borders the most states ?	_answer ( NV , _count ( NV , ( _state ( V0 ) , _next_to ( V0 , NV ) , _most ( V0 , NV , ( _state ( V1 ) , _next_to ( V1 , V0 ) , _state ( V0 ) ) ) ) , V3 ) )
which state is the largest city in montana in ?	_answer ( NV , ( _state ( V0 ) , _largest ( NV , ( _city ( V0 ) , _loc ( V0 , NV ) , _const ( V0 , _stateid ( montana ) ) ) ) , _loc ( V1 , V2 ) ) )
what is the population of washington dc ?	_answer ( NV , ( _population ( NV , V1 ) , _const ( V0 , _cityid ( washington , dc ) ) ) )
what is the most populous city in texas ?	_answer ( NV , _largest ( NV , ( _population ( V1 , V0 ) , _city ( V1 ) , _loc ( V1 , NV ) , _const ( V0 , _stateid ( texas ) ) ) ) )
what is the capital of hawaii ?	_answer ( NV , ( _capital ( V0 ) , _loc ( V0 , NV ) , _const ( V0 , _stateid ( hawaii ) ) ) )
what is capital of iowa ?	_answer ( NV , ( _capital ( V0 ) , _loc ( V0 , NV ) , _const ( V0 , _stateid ( iowa ) ) ) )
where is san diego ?	_answer ( NV , ( _loc ( NV , V1 ) , _const ( V0 , _cityid ( ' san diego ' , _ ) ) ) )
what are the major cities in delaware ?	_answer ( NV , ( _major ( V0 ) , _city ( V0 ) , _loc ( V0 , NV ) , _const ( V0 , _stateid ( delaware ) ) ) )
what is the lowest point in louisiana ?	_answer ( NV , _lowest ( V0 , ( _place ( V0 ) , _loc ( V0 , NV ) , _const ( V0 , _stateid ( louisiana ) ) ) ) )
which state has the highest peak in the country ?	_answer ( NV , _highest ( NV , ( _state ( V1 ) , _loc ( V0 , V1 ) , _mountain ( V0 ) ) ) )
what texas city has the largest population ?	_answer ( NV , _largest ( NV , ( _const ( NV , _stateid ( texas ) ) , _city ( V2 ) , _loc ( V2 , V0 ) , _population ( V2 , V1 ) ) ) )
what capital is the largest in the us ?	_answer ( NV , _largest ( V0 , ( _capital ( V0 ) , _loc ( V0 , NV ) , _const ( V0 , _countryid ( usa ) ) ) ) )
what is the population of new york ?	_answer ( NV , ( _population ( NV , V1 ) , _const ( V0 , _stateid ( ' new york ' ) ) ) )
what is the population of the capital of the smallest state ?	_answer ( NV , ( _population ( NV , V1 ) , _capital ( V0 ) , _loc ( V0 , NV ) , _smallest ( V0 , _state ( V0 ) ) ) )
what is the area of alaska ?	_answer ( NV , ( _area ( NV , V1 ) , _const ( V0 , _stateid ( alaska ) ) ) )
what is the population of california ?	_answer ( NV , ( _population ( NV , V1 ) , _const ( V0 , _stateid ( california ) ) ) )
which state has the longest river ?	_answer ( NV , _longest ( NV , ( _state ( V1 ) , _loc ( V0 , V1 ) , _river ( V0 ) ) ) )
what is the capital of texas ?	_answer ( NV , ( _capital ( V0 ) , _loc ( V0 , NV ) , _const ( V0 , _stateid ( texas ) ) ) )
give me the cities which are in texas ?	_answer ( NV , ( _city ( V0 ) , _loc ( V0 , NV ) , _const ( V0 , _stateid ( texas ) ) ) )
what states border kentucky ?	_answer ( NV , ( _state ( V0 ) , _next_to ( V0 , NV ) , _const ( V0 , _stateid ( kentucky ) ) ) )
how high is the highest point of florida ?	_answer ( NV , ( _elevation ( NV , V1 ) , _highest ( V0 , ( _place ( V0 ) , _loc ( V0 , NV ) , _const ( V0 , _stateid ( florida ) ) ) ) ) )
what are the major cities in north carolina ?	_answer ( NV , ( _major ( V0 ) , _city ( V0 ) , _loc ( V0 , NV ) , _const ( V0 , _stateid ( ' north carolina ' ) ) ) )
what is the highest point in the state with capital des moines ?	_answer ( NV , _highest ( V0 , ( _place ( V0 ) , _loc ( V0 , NV ) , _state ( V0 ) , _loc ( NV , V1 ) , _capital ( V0 ) , _const ( V0 , _cityid ( ' des moines ' , _ ) ) ) ) )
what is the lowest point in california ?	_answer ( NV , _lowest ( V0 , ( _place ( V0 ) , _loc ( V0 , NV ) , _const ( V0 , _stateid ( california ) ) ) ) )
what is the biggest city in wyoming ?	_answer ( NV , _largest ( V0 , ( _city ( V0 ) , _loc ( V0 , NV ) , _const ( V0 , _stateid ( wyoming ) ) ) ) )
what is the largest state bordering texas ?	_answer ( NV , _largest ( V0 , ( _state ( V0 ) , _next_to ( V0 , NV ) , _const ( V0 , _stateid ( texas ) ) ) ) )
what is the smallest city in hawaii ?	_answer ( NV , _smallest ( V0 , ( _city ( V0 ) , _loc ( V0 , NV ) , _const ( V0 , _stateid ( hawaii ) ) ) ) )
what is the area of the states ?	_answer ( NV , ( _area ( NV , V1 ) , _state ( V0 ) ) )
what is the area of idaho ?	_answer ( NV , ( _area ( NV , V1 ) , _const ( V0 , _stateid ( idaho ) ) ) )
what state has the most rivers running through it ?	_answer ( NV , _most ( V0 , NV , ( _state ( V1 ) , _loc ( V0 , V1 ) , _river ( V0 ) , _traverse ( V0 , V1 ) ) ) )
what is the population of springfield missouri ?	_answer ( NV , ( _population ( NV , V1 ) , _const ( V0 , _cityid ( springfield , mo ) ) ) )
what is the most populated state bordering oklahoma ?	_answer ( NV , _largest ( NV , ( _population ( V1 , V0 ) , _state ( V1 ) , _next_to ( V1 , NV ) , _const ( V0 , _stateid ( oklahoma ) ) ) ) )
what is the number of neighboring states for kentucky ?	_answer ( NV , _count ( NV , ( _state ( V0 ) , _next_to ( V0 , NV ) , _const ( V0 , _stateid ( kentucky ) ) ) , V2 ) )
what is the average population per square km in pennsylvania ?	_answer ( NV , ( _density ( NV , V1 ) , _const ( V0 , _stateid ( pennsylvania ) ) ) )
what state has the highest population density ?	_answer ( NV , _largest ( NV , ( _state ( V1 ) , _density ( V1 , V0 ) ) ) )
what is the tallest mountain in america ?	_answer ( NV , _highest ( V0 , ( _mountain ( V0 ) , _loc ( V0 , NV ) , _const ( V0 , _countryid ( usa ) ) ) ) )
what is the highest point of the state with the largest area ?	_answer ( NV , _highest ( V0 , ( _place ( V0 ) , _loc ( V0 , NV ) , _largest ( NV , ( _state ( V1 ) , _area ( V1 , V0 ) ) ) ) ) )
what are the states ?	_answer ( NV , _state ( V0 ) )
how many rivers in washington ?	_answer ( NV , _count ( NV , ( _river ( V0 ) , _loc ( V0 , NV ) , _const ( V0 , _stateid ( washington ) ) ) , V2 ) )
what are the populations of the states through which the mississippi river run ?	_answer ( NV , ( _population ( NV , V1 ) , _state ( V0 ) , _const ( NV , _riverid ( mississippi ) ) , _river ( V0 ) , _traverse ( V0 , V1 ) ) )
what is the biggest river in illinois ?	_answer ( NV , _largest ( V0 , ( _river ( V0 ) , _loc ( V0 , NV ) , _const ( V0 , _stateid ( illinois ) ) ) ) )
what is the capital of michigan ?	_answer ( NV , ( _capital ( V0 ) , _loc ( V0 , NV ) , _const ( V0 , _stateid ( michigan ) ) ) )
what is the total population of the states that border texas ?	_answer ( NV , _sum ( NV , ( _state ( V0 ) , _next_to ( NV , V1 ) , _const ( V0 , _stateid ( texas ) ) ) , _population ( V1 ) , V2 ) )
what states border rhode island ?	_answer ( NV , ( _state ( V0 ) , _next_to ( V0 , NV ) , _const ( V0 , _stateid ( ' rhode island ' ) ) ) )
what is the biggest city in oregon ?	_answer ( NV , _largest ( V0 , ( _city ( V0 ) , _loc ( V0 , NV ) , _const ( V0 , _stateid ( oregon ) ) ) ) )
what is the lowest point in wisconsin ?	_answer ( NV , _lowest ( V0 , ( _place ( V0 ) , _loc ( V0 , NV ) , _const ( V0 , _stateid ( wisconsin ) ) ) ) )
what are the rivers in the state of indiana ?	_answer ( NV , ( _river ( V0 ) , _loc ( V0 , NV ) , _state ( V0 ) , _const ( V0 , _stateid ( indiana ) ) ) )
what is the population of austin ?	_answer ( NV , ( _population ( NV , V1 ) , _const ( V0 , _cityid ( austin , _ ) ) ) )
what is the smallest city in arkansas ?	_answer ( NV , _smallest ( V0 , ( _city ( V0 ) , _loc ( V0 , NV ) , _const ( V0 , _stateid ( arkansas ) ) ) ) )
give me the longest river that passes through the us ?	_answer ( NV , _longest ( V0 , ( _river ( V0 ) , _traverse ( V0 , NV ) , _const ( V0 , _countryid ( usa ) ) ) ) )
how long is the missouri river ?	_answer ( NV , ( _len ( NV , V1 ) , _const ( V0 , _riverid ( missouri ) ) , _river ( V0 ) ) )
which state has the largest city ?	_answer ( NV , _largest ( NV , ( _state ( V1 ) , _loc ( V0 , V1 ) , _city ( V0 ) ) ) )
what is the lowest elevation in pennsylvania ?	_answer ( NV , _lowest ( V0 , ( _place ( V0 ) , _loc ( V0 , NV ) , _const ( V0 , _stateid ( pennsylvania ) ) ) ) )
what is the longest river in the state with the highest point ?	_answer ( NV , _longest ( V0 , ( _river ( V0 ) , _loc ( V0 , NV ) , _state ( V0 ) , _loc ( NV , V1 ) , _highest ( V0 , _place ( V0 ) ) ) ) )
what states does the colorado river run through ?	_answer ( NV , ( _state ( V0 ) , _const ( NV , _riverid ( colorado ) ) , _river ( V0 ) , _traverse ( V0 , V1 ) ) )
what are the states that the potomac run through ?	_answer ( NV , ( _state ( V0 ) , _const ( NV , _riverid ( potomac ) ) , _traverse ( V0 , V1 ) ) )
what is the biggest city in the usa ?	_answer ( NV , _largest ( V0 , ( _city ( V0 ) , _loc ( V0 , NV ) , _const ( V0 , _countryid ( usa ) ) ) ) )
what state has no rivers ?	_answer ( NV , ( _state ( V0 ) , \+ ( _loc ( NV , V1 ) , _river ( V0 ) ) ) )
what is the highest point in rhode island ?	_answer ( NV , _highest ( V0 , ( _place ( V0 ) , _loc ( V0 , NV ) , _const ( V0 , _stateid ( ' rhode island ' ) ) ) ) )
name the states which have no surrounding states ?	_answer ( NV , ( _state ( V0 ) , \+ ( _next_to ( V0 , NV ) , _state ( V0 ) ) ) )
what is the population of atlanta ga ?	_answer ( NV , ( _population ( NV , V1 ) , _const ( V0 , _cityid ( atlanta , _ ) ) ) )
how many square kilometers in the us ?	_answer ( NV , ( _area ( NV , V1 ) , _const ( V0 , _countryid ( usa ) ) ) )
what is the population of idaho ?	_answer ( NV , ( _population ( NV , V1 ) , _const ( V0 , _stateid ( idaho ) ) ) )
what is the adjacent state of california ?	_answer ( NV , ( _next_to ( V0 , NV ) , _state ( V1 ) , _const ( V0 , _stateid ( california ) ) ) )
what is the smallest state through which the longest river runs ?	_answer ( NV , _smallest ( V0 , ( _state ( V0 ) , _longest ( NV , _river ( V0 ) ) , _traverse ( V0 , V1 ) ) ) )
what are the names of the major cities in illinois ?	_answer ( NV , ( _major ( V0 ) , _city ( V0 ) , _loc ( V0 , NV ) , _const ( V0 , _stateid ( illinois ) ) ) )
how many states does the colorado river run through ?	_answer ( NV , _count ( NV , ( _state ( V0 ) , _const ( NV , _riverid ( colorado ) ) , _river ( V0 ) , _traverse ( V0 , V1 ) ) , V2 ) )
how many states does the colorado river flow through ?	_answer ( NV , _count ( NV , ( _state ( V0 ) , _const ( NV , _riverid ( colorado ) ) , _river ( V0 ) , _traverse ( V0 , V1 ) ) , V2 ) )
what are the major cities in kansas ?	_answer ( NV , ( _major ( V0 ) , _city ( V0 ) , _loc ( V0 , NV ) , _const ( V0 , _stateid ( kansas ) ) ) )
which states border texas ?	_answer ( NV , ( _state ( V0 ) , _next_to ( V0 , NV ) , _const ( V0 , _stateid ( texas ) ) ) )
how many people live in new york ?	_answer ( NV , ( _population ( NV , V1 ) , _const ( V0 , _stateid ( ' new york ' ) ) ) )
what are the largest cities in the states that border the largest state ?	_answer ( NV , _largest ( V0 , ( _city ( V0 ) , _loc ( V0 , NV ) , _state ( V0 ) , _next_to ( V0 , NV ) , _largest ( V0 , _state ( V0 ) ) ) ) )
which states have points that are higher than the highest point in texas ?	_answer ( NV , ( _state ( V0 ) , _place ( NV ) , _loc ( V0 , V1 ) , _higher ( V0 , NV ) , _highest ( V0 , ( _place ( V0 ) , _loc ( V0 , NV ) , _const ( V0 , _stateid ( texas ) ) ) ) ) )
what is the river that cross over ohio ?	_answer ( NV , ( _river ( V0 ) , _traverse ( V0 , NV ) , _const ( V0 , _stateid ( ohio ) ) ) )
what is the largest city in michigan ?	_answer ( NV , _largest ( V0 , ( _city ( V0 ) , _loc ( V0 , NV ) , _const ( V0 , _stateid ( michigan ) ) ) ) )
how many rivers are in the state with the highest point ?	_answer ( NV , _count ( NV , ( _river ( V0 ) , _loc ( V0 , NV ) , _state ( V0 ) , _loc ( NV , V1 ) , _highest ( V0 , _place ( V0 ) ) ) , V3 ) )
what cities are located in pennsylvania ?	_answer ( NV , ( _city ( V0 ) , _loc ( V0 , NV ) , _const ( V0 , _stateid ( pennsylvania ) ) ) )
what is the state with the lowest population ?	_answer ( NV , _smallest ( NV , ( _state ( V1 ) , _population ( V1 , V0 ) ) ) )
what is the highest point in each state whose lowest point is sea level ?	_answer ( NV , ( _high_point ( NV , V1 ) , _state ( V0 ) , _low_point ( V0 , NV ) , _elevation ( V0 , 0.0 ) ) )
give me the cities in usa ?	_answer ( NV , ( _city ( V0 ) , _loc ( V0 , NV ) , _const ( V0 , _countryid ( usa ) ) ) )
how many states does the missouri river run through ?	_answer ( NV , _count ( NV , ( _state ( V0 ) , _const ( NV , _riverid ( missouri ) ) , _river ( V0 ) , _traverse ( V0 , V1 ) ) , V2 ) )
what state has the city with the largest population ?	_answer ( NV , ( _state ( V0 ) , _loc ( NV , V1 ) , _largest ( NV , ( _city ( V1 ) , _population ( V1 , V0 ) ) ) ) )
which is the shortest river ?	_answer ( NV , _shortest ( V0 , _river ( V0 ) ) )
how many states border alaska ?	_answer ( NV , _count ( NV , ( _state ( V0 ) , _next_to ( V0 , NV ) , _const ( V0 , _stateid ( alaska ) ) ) , V2 ) )
what is the population of dallas ?	_answer ( NV , ( _population ( NV , V1 ) , _const ( V0 , _cityid ( dallas , _ ) ) ) )
where is san jose ?	_answer ( NV , ( _loc ( NV , V1 ) , _const ( V0 , _cityid ( ' san jose ' , _ ) ) ) )
what states border states that border colorado ?	_answer ( NV , ( _state ( V0 ) , _next_to ( V0 , NV ) , _state ( V0 ) , _next_to ( V0 , NV ) , _const ( V0 , _stateid ( colorado ) ) ) )
what rivers flow through the state with the largest population ?	_answer ( NV , ( _river ( V0 ) , _traverse ( V0 , NV ) , _largest ( NV , ( _state ( V1 ) , _population ( V1 , V0 ) ) ) ) )
whats the largest city ?	_answer ( NV , _largest ( V0 , _city ( V0 ) ) )
what is the capital of the alabama state ?	_answer ( NV , ( _capital ( V0 ) , _loc ( V0 , NV ) , _const ( V0 , _stateid ( alabama ) ) , _state ( V0 ) ) )
what states border arkansas ?	_answer ( NV , ( _state ( V0 ) , _next_to ( V0 , NV ) , _const ( V0 , _stateid ( arkansas ) ) ) )
what is the population of denver ?	_answer ( NV , ( _population ( NV , V1 ) , _const ( V0 , _cityid ( denver , _ ) ) ) )
what is the longest river in america ?	_answer ( NV , _longest ( V0 , ( _river ( V0 ) , _loc ( V0 , NV ) , _const ( V0 , _countryid ( usa ) ) ) ) )
where is massachusetts ?	_answer ( NV , ( _loc ( NV , V1 ) , _const ( V0 , _stateid ( massachusetts ) ) ) )
what state has the smallest area ?	_answer ( NV , _smallest ( NV , ( _state ( V1 ) , _area ( V1 , V0 ) ) ) )
what major rivers run through illinois ?	_answer ( NV , ( _major ( V0 ) , _river ( V0 ) , _traverse ( V0 , NV ) , _const ( V0 , _stateid ( illinois ) ) ) )
how many cities does the usa have ?	_answer ( NV , _count ( NV , ( _city ( V0 ) , _const ( NV , _countryid ( usa ) ) , _loc ( V1 , V0 ) ) , V2 ) )
how many people live in california ?	_answer ( NV , ( _population ( NV , V1 ) , _const ( V0 , _stateid ( california ) ) ) )
