how many states border pennsylvania ?	_answer ( NV , _count ( NV , ( _state ( V0 ) , _next_to ( V0 , NV ) , _const ( V0 , _stateid ( pennsylvania ) ) ) , V2 ) )
which state is chicago in ?	_answer ( NV , ( _state ( V0 ) , _const ( NV , _cityid ( chicago , _ ) ) , _loc ( V0 , V1 ) ) )
what are the biggest rivers in florida ?	_answer ( NV , _longest ( V0 , ( _river ( V0 ) , _loc ( V0 , NV ) , _const ( V0 , _stateid ( florida ) ) ) ) )
which states adjoin vermont ?	_answer ( NV , ( _state ( V0 ) , _next_to ( V0 , NV ) , _const ( V0 , _stateid ( vermont ) ) ) )
how many people stay in oregon ?	_answer ( NV , ( _population ( NV , V1 ) , _const ( V0 , _stateid ( oregon ) ) ) )
what are the populations of the states through which the ohio river run ?	_answer ( NV , ( _population ( NV , V1 ) , _state ( V0 ) , _const ( NV , _riverid ( ohio ) ) , _traverse ( V0 , V1 ) ) )
what cities are located in south dakota ?	_answer ( NV , ( _city ( V0 ) , _loc ( V0 , NV ) , _const ( V0 , _stateid ( ' south dakota ' ) ) ) )
what is the largest state traversed by the mississippi ?	_answer ( NV , _largest ( V0 , ( _state ( V0 ) , _traverse ( NV , V1 ) , _const ( V0 , _riverid ( mississippi ) ) ) ) )
what is the density of hawaii ?	_answer ( NV , ( _density ( NV , V1 ) , _const ( V0 , _stateid ( hawaii ) ) ) )
what is the highest mountain in massachusetts ?	_answer ( NV , _highest ( V0 , ( _mountain ( V0 ) , _loc ( V0 , NV ) , _const ( V0 , _stateid ( massachusetts ) ) ) ) )
what cities are located in michigan ?	_answer ( NV , ( _city ( V0 ) , _loc ( V0 , NV ) , _const ( V0 , _stateid ( michigan ) ) ) )
where is mount mckinley ?	_answer ( NV , ( _loc ( NV , V1 ) , _const ( V0 , _placeid ( ' mount mckinley ' ) ) ) )
what state borders kansas ?	_answer ( NV , ( _state ( V0 ) , _next_to ( V0 , NV ) , _const ( V0 , _stateid ( kansas ) ) ) )
states bordering ohio ?	_answer ( NV , ( _state ( V0 ) , _next_to ( V0 , NV ) , _const ( V0 , _stateid ( ohio ) ) ) )
what rivers run through vermont ?	_answer ( NV , ( _river ( V0 ) , _traverse ( V0 , NV ) , _const ( V0 , _stateid ( vermont ) ) ) )
in which state is boston ?	_answer ( NV , ( _loc ( NV , V1 ) , _state ( V1 ) , _const ( V0 , _cityid ( boston , _ ) ) ) )
which state has the mississippi river ?	_answer ( NV , ( _state ( V0 ) , _loc ( NV , V1 ) , _const ( V0 , _riverid ( mississippi ) ) , _river ( V0 ) ) )
what cities in alabama have the highest number of citizens ?	_answer ( NV , _largest ( NV , ( _city ( V1 ) , _loc ( V1 , NV ) , _const ( V0 , _stateid ( alabama ) ) , _population ( V2 , V1 ) ) ) )
where is the lowest spot in nebraska ?	_answer ( NV , _lowest ( V0 , ( _place ( V0 ) , _loc ( V0 , NV ) , _const ( V0 , _stateid ( nebraska ) ) ) ) )
how many big cities are in louisiana ?	_answer ( NV , _count ( NV , ( _major ( V0 ) , _city ( V0 ) , _loc ( V0 , NV ) , _const ( V0 , _stateid ( louisiana ) ) ) , V2 ) )
how many states does the rio grande river flow through ?	_answer ( NV , _count ( NV , ( _state ( V0 ) , _const ( NV , _riverid ( ' rio grande ' ) ) , _river ( V0 ) , _traverse ( V0 , V1 ) ) , V2 ) )
how high is the highest point in georgia ?	_answer ( NV , ( _elevation ( NV , V1 ) , _highest ( V0 , ( _place ( V0 ) , _loc ( V0 , NV ) , _const ( V0 , _stateid ( georgia ) ) ) ) ) )
what is the average population per square km in arizona ?	_answer ( NV , ( _density ( NV , V1 ) , _const ( V0 , _stateid ( arizona ) ) ) )
how many states does the rio grande river run through ?	_answer ( NV , _count ( NV , ( _state ( V0 ) , _const ( NV , _riverid ( ' rio grande ' ) ) , _traverse ( V0 , V1 ) ) , V2 ) )
what is the area of michigan ?	_answer ( NV , ( _area ( NV , V1 ) , _const ( V0 , _stateid ( michigan ) ) ) )
what are the capitals of the states that border arkansas ?	_answer ( NV , ( _capital ( V0 ) , _loc ( V0 , NV ) , _state ( V0 ) , _next_to ( V0 , NV ) , _const ( V0 , _stateid ( arkansas ) ) ) )
show major cities in alaska ?	_answer ( NV , ( _major ( V0 ) , _city ( V0 ) , _loc ( V0 , NV ) , _const ( V0 , _stateid ( alaska ) ) ) )
how long is the colorado river in miles ?	_answer ( NV , ( _len ( NV , V1 ) , _const ( V0 , _riverid ( colorado ) ) , _river ( V0 ) ) )
what rivers do not run through virginia ?	_answer ( NV , ( _river ( V0 ) , \+ ( _traverse ( V0 , NV ) , _const ( V0 , _stateid ( virginia ) ) ) ) )
what is the longest river that runs through a state that borders wisconsin ?	_answer ( NV , _longest ( V0 , ( _river ( V0 ) , _traverse ( V0 , NV ) , _state ( V0 ) , _next_to ( V0 , NV ) , _const ( V0 , _stateid ( wisconsin ) ) ) ) )
name the rivers in illinois ?	_answer ( NV , ( _river ( V0 ) , _loc ( V0 , NV ) , _const ( V0 , _stateid ( illinois ) ) ) )
which states adjoin south carolina ?	_answer ( NV , ( _state ( V0 ) , _next_to ( V0 , NV ) , _const ( V0 , _stateid ( ' south carolina ' ) ) ) )
what are the high points of states surrounding new mexico ?	_answer ( NV , ( _high_point ( NV , V1 ) , _loc ( V1 , V0 ) , _state ( V0 ) , _next_to ( V0 , NV ) , _const ( V0 , _stateid ( ' new mexico ' ) ) ) )
where is the lowest spot in michigan ?	_answer ( NV , _lowest ( V0 , ( _place ( V0 ) , _loc ( V0 , NV ) , _const ( V0 , _stateid ( michigan ) ) ) ) )
how many rivers are found in washington ?	_answer ( NV , _count ( NV , ( _river ( V0 ) , _loc ( V0 , NV ) , _const ( V0 , _stateid ( washington ) ) ) , V2 ) )
what cities in delaware have the highest number of citizens ?	_answer ( NV , _largest ( NV , ( _city ( V1 ) , _loc ( V1 , NV ) , _const ( V0 , _stateid ( delaware ) ) , _population ( V2 , V1 ) ) ) )
which rivers flow through wyoming ?	_answer ( NV , ( _river ( V0 ) , _traverse ( V0 , NV ) , _const ( V0 , _stateid ( wyoming ) ) ) )
people in salem ?	_answer ( NV , ( _population ( NV , V1 ) , _const ( V0 , _cityid ( salem , _ ) ) ) )
what are major rivers in iowa ?	_answer ( NV , ( _major ( V0 ) , _river ( V0 ) , _loc ( V0 , NV ) , _const ( V0 , _stateid ( iowa ) ) ) )
what rivers flow through states that illinois borders ?	_answer ( NV , ( _river ( V0 ) , _traverse ( V0 , NV ) , _state ( V0 ) , _const ( NV , _stateid ( illinois ) ) , _next_to ( V0 , V1 ) ) )
what is the capital of the texas state ?	_answer ( NV , ( _capital ( V0 ) , _loc ( V0 , NV ) , _const ( V0 , _stateid ( texas ) ) , _state ( V0 ) ) )
what states in the united states have a city of des moines ?	_answer ( NV , ( _state ( V0 ) , _loc ( V0 , NV ) , _const ( V0 , _countryid ( usa ) ) , _loc ( NV , V2 ) , _const ( V0 , _cityid ( ' des moines ' , _ ) ) ) )
where is mount mckinley located ?	_answer ( NV , ( _loc ( NV , V1 ) , _const ( V0 , _placeid ( ' mount mckinley ' ) ) ) )
how many cities does new mexico have ?	_answer ( NV , _count ( NV , ( _city ( V0 ) , _const ( NV , _stateid ( ' new mexico ' ) ) , _loc ( V1 , V0 ) ) , V2 ) )
what is the area of south dakota in square kilometers ?	_answer ( NV , ( _area ( NV , V1 ) , _const ( V0 , _stateid ( ' south dakota ' ) ) ) )
what is the largest of the state that the mississippi river runs through ?	_answer ( NV , _largest ( V0 , ( _state ( V0 ) , _const ( NV , _riverid ( mississippi ) ) , _traverse ( V0 , V1 ) ) ) )
how many people live in the capital of pennsylvania ?	_answer ( NV , ( _population ( NV , V1 ) , _capital ( V0 ) , _loc ( V0 , NV ) , _const ( V0 , _stateid ( pennsylvania ) ) ) )
what is the density of pennsylvania ?	_answer ( NV , ( _density ( NV , V1 ) , _const ( V0 , _stateid ( pennsylvania ) ) ) )
what cities are located in colorado ?	_answer ( NV , ( _city ( V0 ) , _loc ( V0 , NV ) , _const ( V0 , _stateid ( colorado ) ) ) )
what states are next to the massachusetts ?	_answer ( NV , ( _state ( V0 ) , _next_to ( V0 , NV ) , _const ( V0 , _stateid ( massachusetts ) ) ) )
what is the largest city in a state that borders oklahoma ?	_answer ( NV , _largest ( V0 , ( _city ( V0 ) , _loc ( V0 , NV ) , _state ( V0 ) , _next_to ( V0 , NV ) , _const ( V0 , _stateid ( oklahoma ) ) ) ) )
what is the city in vermont with the largest population ?	_answer ( NV , _largest ( NV , ( _city ( V1 ) , _loc ( V1 , NV ) , _const ( V0 , _stateid ( vermont ) ) , _population ( V2 , V1 ) ) ) )
what is the most populous city in virginia ?	_answer ( NV , _largest ( NV , ( _population ( V1 , V0 ) , _city ( V1 ) , _loc ( V1 , NV ) , _const ( V0 , _stateid ( virginia ) ) ) ) )
which state is houston in ?	_answer ( NV , ( _state ( V0 ) , _const ( NV , _cityid ( houston , _ ) ) , _loc ( V0 , V1 ) ) )
what mountains are in minnesota ?	_answer ( NV , ( _mountain ( V0 ) , _loc ( V0 , NV ) , _const ( V0 , _stateid ( minnesota ) ) ) )
of the states washed by the ohio river which has the lowest point ?	_answer ( NV , _lowest ( NV , ( _state ( V1 ) , _traverse ( NV , V2 ) , _const ( V0 , _riverid ( ohio ) ) , _loc ( V1 , V2 ) , _place ( V1 ) ) ) )
how many cities are in idaho ?	_answer ( NV , _count ( NV , ( _city ( V0 ) , _loc ( V0 , NV ) , _const ( V0 , _stateid ( idaho ) ) ) , V2 ) )
what states border states that the missouri river runs through ?	_answer ( NV , ( _state ( V0 ) , _next_to ( V0 , NV ) , _state ( V0 ) , _const ( NV , _riverid ( missouri ) ) , _traverse ( V0 , V1 ) ) )
what is the highest point in the state with the capital flint ?	_answer ( NV , _highest ( V0 , ( _place ( V0 ) , _loc ( V0 , NV ) , _state ( V0 ) , _loc ( NV , V1 ) , _capital ( V0 ) , _const ( V0 , _cityid ( flint , _ ) ) ) ) )
what is the capital of the state that borders the state that borders hawaii ?	_answer ( NV , ( _capital ( V0 ) , _loc ( V0 , NV ) , _state ( V0 ) , _next_to ( V0 , NV ) , _state ( V0 ) , _next_to ( V0 , NV ) , _const ( V0 , _stateid ( hawaii ) ) ) )
what state is pittsburgh the capital of ?	_answer ( NV , ( _state ( V0 ) , _const ( NV , _cityid ( pittsburgh , _ ) ) , _capital ( V0 ) , _loc ( V0 , V1 ) ) )
what are the populations of the states through which the missouri river runs ?	_answer ( NV , ( _population ( NV , V1 ) , _state ( V0 ) , _const ( NV , _riverid ( missouri ) ) , _traverse ( V0 , V1 ) ) )
how many cities named atlanta are there in the usa ?	_answer ( NV , _count ( NV , ( _city ( V0 ) , _const ( V0 , _cityid ( atlanta , _ ) ) , _loc ( V0 , NV ) , _const ( V0 , _countryid ( usa ) ) ) , V2 ) )
how high is mount whitney ?	_answer ( NV , ( _elevation ( NV , V1 ) , _const ( V0 , _placeid ( ' mount whitney ' ) ) ) )
what states border states that border states that border states that border north dakota ?	_answer ( NV , ( _state ( V0 ) , _next_to ( V0 , NV ) , _state ( V0 ) , _next_to ( V0 , NV ) , _state ( V0 ) , _next_to ( V0 , NV ) , _state ( V0 ) , _next_to ( V0 , NV ) , _const ( V0 , _stateid ( ' north dakota ' ) ) ) )
what is the lowest point in virginia ?	_answer ( NV , _lowest ( V0 , ( _place ( V0 ) , _loc ( V0 , NV ) , _const ( V0 , _stateid ( virginia ) ) ) ) )
through which states does the rio grande river flow ?	_answer ( NV , ( _state ( V0 ) , _const ( NV , _riverid ( ' rio grande ' ) ) , _traverse ( V0 , V1 ) ) )
what is the largest state that borders nevada ?	_answer ( NV , _largest ( V0 , ( _state ( V0 ) , _next_to ( V0 , NV ) , _const ( V0 , _stateid ( nevada ) ) ) ) )
how large is the largest city in maine ?	_answer ( NV , ( _size ( NV , V1 ) , _largest ( V0 , ( _city ( V0 ) , _loc ( V0 , NV ) , _const ( V0 , _stateid ( maine ) ) ) ) ) )
what is the population of the largest state that borders california ?	_answer ( NV , ( _population ( NV , V1 ) , _largest ( V0 , ( _state ( V0 ) , _next_to ( V0 , NV ) , _const ( V0 , _stateid ( california ) ) ) ) ) )
give me the cities in utah ?	_answer ( NV , ( _city ( V0 ) , _loc ( V0 , NV ) , _const ( V0 , _stateid ( utah ) ) ) )
how many rivers are called colorado river ?	_answer ( NV , _count ( NV , ( _river ( V0 ) , _const ( V0 , _riverid ( colorado ) ) ) , V1 ) )
how many states does the mississippi run through ?	_answer ( NV , _count ( NV , ( _state ( V0 ) , _const ( NV , _riverid ( mississippi ) ) , _river ( V0 ) , _traverse ( V0 , V1 ) ) , V2 ) )
what states border the red ?	_answer ( NV , ( _state ( V0 ) , _next_to ( V0 , NV ) , _const ( V0 , _riverid ( red ) ) , _river ( V0 ) ) )
what are the neighboring states for alabama ?	_answer ( NV , ( _next_to ( V0 , NV ) , _state ( V1 ) , _const ( V0 , _stateid ( alabama ) ) ) )
what state that borders wisconsin has the highest population ?	_answer ( NV , _largest ( NV , ( _state ( V1 ) , _next_to ( V1 , NV ) , _const ( V0 , _stateid ( wisconsin ) ) , _population ( V2 , V1 ) ) ) )
what states border states that border states that border states that border massachusetts ?	_answer ( NV , ( _state ( V0 ) , _next_to ( V0 , NV ) , _state ( V0 ) , _next_to ( V0 , NV ) , _state ( V0 ) , _next_to ( V0 , NV ) , _state ( V0 ) , _next_to ( V0 , NV ) , _const ( V0 , _stateid ( massachusetts ) ) ) )
what state which the ohio river runs through has the largest population ?	_answer ( NV , _largest ( NV , ( _state ( V1 ) , _const ( NV , _riverid ( ohio ) ) , _traverse ( V0 , V2 ) , _population ( V2 , V1 ) ) ) )
how many rivers are there in west virginia ?	_answer ( NV , _count ( NV , ( _river ( V0 ) , _loc ( V0 , NV ) , _const ( V0 , _stateid ( ' west virginia ' ) ) ) , V2 ) )
what is the population of the largest state that borders alaska ?	_answer ( NV , ( _population ( NV , V1 ) , _largest ( V0 , ( _state ( V0 ) , _next_to ( V0 , NV ) , _const ( V0 , _stateid ( alaska ) ) ) ) ) )
what is the area of the state with the capital fort wayne ?	_answer ( NV , ( _area ( NV , V1 ) , _state ( V0 ) , _loc ( NV , V1 ) , _capital ( V0 ) , _const ( V0 , _cityid ( ' fort wayne ' , _ ) ) ) )
how many citizens in baton rouge ?	_answer ( NV , ( _population ( NV , V1 ) , _const ( V0 , _cityid ( ' baton rouge ' , _ ) ) ) )
what major rivers run through georgia ?	_answer ( NV , ( _major ( V0 ) , _river ( V0 ) , _traverse ( V0 , NV ) , _const ( V0 , _stateid ( georgia ) ) ) )
what is the size of the capital of new hampshire ?	_answer ( NV , ( _size ( NV , V1 ) , _capital ( V0 ) , _loc ( V0 , NV ) , _const ( V0 , _stateid ( ' new hampshire ' ) ) ) )
what is the smallest state bordering nevada ?	_answer ( NV , _smallest ( V0 , ( _state ( V0 ) , _next_to ( V0 , NV ) , _const ( V0 , _stateid ( nevada ) ) ) ) )
how many rivers are in kentucky ?	_answer ( NV , _count ( NV , ( _river ( V0 ) , _loc ( V0 , NV ) , _const ( V0 , _stateid ( kentucky ) ) ) , V2 ) )
what state that borders alabama has the highest population ?	_answer ( NV , _largest ( NV , ( _state ( V1 ) , _next_to ( V1 , NV ) , _const ( V0 , _stateid ( alabama ) ) , _population ( V2 , V1 ) ) ) )
what is the largest city in states that border west virginia ?	_answer ( NV , _largest ( V0 , ( _city ( V0 ) , _loc ( V0 , NV ) , _state ( V0 ) , _next_to ( V0 , NV ) , _const ( V0 , _stateid ( ' west virginia ' ) ) ) ) )
what states does the potomac run through ?	_answer ( NV , ( _state ( V0 ) , _const ( NV , _riverid ( potomac ) ) , _river ( V0 ) , _traverse ( V0 , V1 ) ) )
which states have points that are higher than the highest point in missouri ?	_answer ( NV , ( _state ( V0 ) , _place ( NV ) , _loc ( V0 , V1 ) , _higher ( V0 , NV ) , _highest ( V0 , ( _place ( V0 ) , _loc ( V0 , NV ) , _const ( V0 , _stateid ( missouri ) ) ) ) ) )
what is the capital of the state that borders the state that borders minnesota ?	_answer ( NV , ( _capital ( V0 ) , _loc ( V0 , NV ) , _state ( V0 ) , _next_to ( V0 , NV ) , _state ( V0 ) , _next_to ( V0 , NV ) , _const ( V0 , _stateid ( minnesota ) ) ) )
what rivers run through kansas ?	_answer ( NV , ( _river ( V0 ) , _traverse ( V0 , NV ) , _const ( V0 , _stateid ( kansas ) ) ) )
which states does not border kentucky ?	_answer ( NV , ( _state ( V0 ) , \+ ( _next_to ( V0 , NV ) , _const ( V0 , _stateid ( kentucky ) ) ) ) )
how long is the potomac ?	_answer ( NV , ( _len ( NV , V1 ) , _const ( V0 , _riverid ( potomac ) ) ) )
how many big cities are in north dakota ?	_answer ( NV , _count ( NV , ( _major ( V0 ) , _city ( V0 ) , _loc ( V0 , NV ) , _const ( V0 , _stateid ( ' north dakota ' ) ) ) , V2 ) )
how many states does the potomac flow through ?	_answer ( NV , _count ( NV , ( _state ( V0 ) , _const ( NV , _riverid ( potomac ) ) , _river ( V0 ) , _traverse ( V0 , V1 ) ) , V2 ) )
what is the smallest state bordering mississippi ?	_answer ( NV , _smallest ( V0 , ( _state ( V0 ) , _next_to ( V0 , NV ) , _const ( V0 , _stateid ( mississippi ) ) ) ) )
what is the largest city in a state that borders vermont ?	_answer ( NV , _largest ( V0 , ( _city ( V0 ) , _loc ( V0 , NV ) , _state ( V0 ) , _next_to ( V0 , NV ) , _const ( V0 , _stateid ( vermont ) ) ) ) )
what is the population of flint ga ?	_answer ( NV , ( _population ( NV , V1 ) , _const ( V0 , _cityid ( flint , _ ) ) ) )
which state is fort wayne in ?	_answer ( NV , ( _state ( V0 ) , _const ( NV , _cityid ( ' fort wayne ' , _ ) ) , _loc ( V0 , V1 ) ) )
what state that borders virginia is the largest ?	_answer ( NV , _largest ( V0 , ( _state ( V0 ) , _next_to ( V0 , NV ) , _const ( V0 , _stateid ( virginia ) ) ) ) )
what are the populations of states through which the mississippi run ?	_answer ( NV , ( _population ( NV , V1 ) , _state ( V0 ) , _const ( NV , _riverid ( mississippi ) ) , _river ( V0 ) , _traverse ( V0 , V1 ) ) )
what are the populations of all the major cities in colorado ?	_answer ( NV , ( _population ( NV , V1 ) , _major ( V0 ) , _city ( V0 ) , _loc ( V0 , NV ) , _const ( V0 , _stateid ( colorado ) ) ) )
how many states have a city called des moines ?	_answer ( NV , _count ( NV , ( _state ( V0 ) , _loc ( NV , V1 ) , _const ( V0 , _cityid ( ' des moines ' , _ ) ) ) , V2 ) )
what are the capital cities of the states which border rhode island ?	_answer ( NV , ( _capital ( V0 ) , _city ( V0 ) , _loc ( V0 , NV ) , _state ( V0 ) , _next_to ( V0 , NV ) , _const ( V0 , _stateid ( ' rhode island ' ) ) ) )
how many major cities are there in california ?	_answer ( NV , _count ( NV , ( _major ( V0 ) , _city ( V0 ) , _loc ( V0 , NV ) , _const ( V0 , _stateid ( california ) ) ) , V2 ) )
how many cities are in oklahoma ?	_answer ( NV , _count ( NV , ( _city ( V0 ) , _loc ( V0 , NV ) , _const ( V0 , _stateid ( oklahoma ) ) ) , V2 ) )
what are the major cities in north dakota ?	_answer ( NV , ( _major ( V0 ) , _city ( V0 ) , _loc ( V0 , NV ) , _const ( V0 , _stateid ( ' north dakota ' ) ) ) )
what is the population of the major cities in pennsylvania ?	_answer ( NV , ( _population ( NV , V1 ) , _major ( V0 ) , _city ( V0 ) , _loc ( V0 , NV ) , _const ( V0 , _stateid ( pennsylvania ) ) ) )
what is the population of the largest state that borders arkansas ?	_answer ( NV , ( _population ( NV , V1 ) , _largest ( V0 , ( _state ( V0 ) , _next_to ( V0 , NV ) , _const ( V0 , _stateid ( arkansas ) ) ) ) ) )
what is the longest river in alabama ?	_answer ( NV , _longest ( V0 , ( _river ( V0 ) , _loc ( V0 , NV ) , _const ( V0 , _stateid ( alabama ) ) ) ) )
what is the shortest river in mississippi ?	_answer ( NV , _shortest ( V0 , ( _river ( V0 ) , _loc ( V0 , NV ) , _const ( V0 , _stateid ( mississippi ) ) ) ) )
what are the rivers in the state of pennsylvania ?	_answer ( NV , ( _river ( V0 ) , _loc ( V0 , NV ) , _state ( V0 ) , _const ( V0 , _stateid ( pennsylvania ) ) ) )
what states border states which the potomac runs through ?	_answer ( NV , ( _state ( V0 ) , _next_to ( V0 , NV ) , _state ( V0 ) , _const ( NV , _riverid ( potomac ) ) , _traverse ( V0 , V1 ) ) )
what is the capital of the state nevada ?	_answer ( NV , ( _capital ( V0 ) , _loc ( V0 , NV ) , _state ( V0 ) , _const ( V0 , _stateid ( nevada ) ) ) )
what is the longest river that runs through a state that borders new mexico ?	_answer ( NV , _longest ( V0 , ( _river ( V0 ) , _traverse ( V0 , NV ) , _state ( V0 ) , _next_to ( V0 , NV ) , _const ( V0 , _stateid ( ' new mexico ' ) ) ) ) )
what state borders massachusetts ?	_answer ( NV , ( _state ( V0 ) , _next_to ( V0 , NV ) , _const ( V0 , _stateid ( massachusetts ) ) ) )
which states do colorado flow through ?	_answer ( NV , ( _state ( V0 ) , _const ( NV , _riverid ( colorado ) ) , _river ( V0 ) , _traverse ( V0 , V1 ) ) )
what are the populations of the states through which the red runs ?	_answer ( NV , ( _population ( NV , V1 ) , _state ( V0 ) , _const ( NV , _riverid ( red ) ) , _traverse ( V0 , V1 ) ) )
what are the populations of the states through which the red river run ?	_answer ( NV , ( _population ( NV , V1 ) , _state ( V0 ) , _const ( NV , _riverid ( red ) ) , _traverse ( V0 , V1 ) ) )
how long is the mississippi river ?	_answer ( NV , ( _len ( NV , V1 ) , _const ( V0 , _riverid ( mississippi ) ) ) )
could you tell me what is the highest point in the state of arizona ?	_answer ( NV , _highest ( V0 , ( _place ( V0 ) , _loc ( V0 , NV ) , _state ( V0 ) , _const ( V0 , _stateid ( arizona ) ) ) ) )
what is the largest of the state that the mississippi river runs through ?	_answer ( NV , _largest ( V0 , ( _state ( V0 ) , _const ( NV , _riverid ( mississippi ) ) , _traverse ( V0 , V1 ) ) ) )
what is the largest city in a state that borders delaware ?	_answer ( NV , _largest ( V0 , ( _city ( V0 ) , _loc ( V0 , NV ) , _state ( V0 ) , _next_to ( V0 , NV ) , _const ( V0 , _stateid ( delaware ) ) ) ) )
what is the highest elevation in colorado ?	_answer ( NV , _highest ( V0 , ( _place ( V0 ) , _loc ( V0 , NV ) , _const ( V0 , _stateid ( colorado ) ) ) ) )
what is the longest river that flows through delaware ?	_answer ( NV , _longest ( V0 , ( _river ( V0 ) , _traverse ( V0 , NV ) , _const ( V0 , _stateid ( delaware ) ) ) ) )
what are the major cities in kentucky ?	_answer ( NV , ( _major ( V0 ) , _city ( V0 ) , _loc ( V0 , NV ) , _const ( V0 , _stateid ( kentucky ) ) ) )
how many people are in the state of north carolina ?	_answer ( NV , ( _population ( NV , V1 ) , _const ( V0 , _stateid ( ' north carolina ' ) ) ) )
what state is san jose located in ?	_answer ( NV , ( _state ( V0 ) , _const ( NV , _cityid ( ' san jose ' , _ ) ) , _loc ( V0 , V1 ) ) )
where is the lowest spot in pennsylvania ?	_answer ( NV , _lowest ( V0 , ( _place ( V0 ) , _loc ( V0 , NV ) , _const ( V0 , _stateid ( pennsylvania ) ) ) ) )
states bordering utah ?	_answer ( NV , ( _state ( V0 ) , _next_to ( V0 , NV ) , _const ( V0 , _stateid ( utah ) ) ) )
which states border states through which the potomac traverses ?	_answer ( NV , ( _state ( V0 ) , _next_to ( V0 , NV ) , _state ( V0 ) , _const ( NV , _riverid ( potomac ) ) , _traverse ( V0 , V1 ) ) )
how many rivers in alaska ?	_answer ( NV , _count ( NV , ( _river ( V0 ) , _loc ( V0 , NV ) , _const ( V0 , _stateid ( alaska ) ) ) , V2 ) )
what is the height of guadalupe peak ?	_answer ( NV , ( _elevation ( NV , V1 ) , _const ( V0 , _placeid ( ' guadalupe peak ' ) ) ) )
what is the shortest river in oregon ?	_answer ( NV , _shortest ( V0 , ( _river ( V0 ) , _loc ( V0 , NV ) , _const ( V0 , _stateid ( oregon ) ) ) ) )
population of albany ?	_answer ( NV , ( _population ( NV , V1 ) , _const ( V0 , _cityid ( albany , _ ) ) ) )
which states does the colorado river pass through ?	_answer ( NV , ( _state ( V0 ) , _const ( NV , _riverid ( colorado ) ) , _traverse ( V0 , V1 ) ) )
how high is death valley ?	_answer ( NV , ( _elevation ( NV , V1 ) , _const ( V0 , _placeid ( ' death valley ' ) ) ) )
how many rivers are found in oklahoma ?	_answer ( NV , _count ( NV , ( _river ( V0 ) , _loc ( V0 , NV ) , _const ( V0 , _stateid ( oklahoma ) ) ) , V2 ) )
how many rivers run through the states bordering kansas ?	_answer ( NV , _count ( NV , ( _river ( V0 ) , _traverse ( V0 , NV ) , _state ( V0 ) , _next_to ( V0 , NV ) , _const ( V0 , _stateid ( kansas ) ) ) , V3 ) )
what are the rivers in the state of wisconsin ?	_answer ( NV , ( _river ( V0 ) , _loc ( V0 , NV ) , _state ( V0 ) , _const ( V0 , _stateid ( wisconsin ) ) ) )
how many states border on the state whose capital is san francisco ?	_answer ( NV , _count ( NV , ( _state ( V0 ) , _next_to ( V0 , NV ) , _state ( V0 ) , _loc ( NV , V1 ) , _capital ( V0 ) , _const ( V0 , _cityid ( ' san francisco ' , _ ) ) ) , V3 ) )
name the rivers in north dakota ?	_answer ( NV , ( _river ( V0 ) , _loc ( V0 , NV ) , _const ( V0 , _stateid ( ' north dakota ' ) ) ) )
what states border states that border states that border massachusetts ?	_answer ( NV , ( _state ( V0 ) , _next_to ( V0 , NV ) , _state ( V0 ) , _next_to ( V0 , NV ) , _state ( V0 ) , _next_to ( V0 , NV ) , _const ( V0 , _stateid ( massachusetts ) ) ) )
in what state is guadalupe peak ?	_answer ( NV , ( _loc ( NV , V1 ) , _state ( V1 ) , _const ( V0 , _placeid ( ' guadalupe peak ' ) ) ) )
which is the lowest point of the states that the ohio river runs through ?	_answer ( NV , _lowest ( V0 , ( _place ( V0 ) , _loc ( V0 , NV ) , _state ( V0 ) , _const ( NV , _riverid ( ohio ) ) , _traverse ( V0 , V1 ) ) ) )
which state is the city austin located in ?	_answer ( NV , ( _state ( V0 ) , _city ( NV ) , _const ( V0 , _cityid ( austin , _ ) ) , _loc ( V0 , V1 ) ) )
how long is red river ?	_answer ( NV , ( _len ( NV , V1 ) , _const ( V0 , _riverid ( red ) ) ) )
what are the populations of the states through which the red runs ?	_answer ( NV , ( _population ( NV , V1 ) , _state ( V0 ) , _const ( NV , _riverid ( red ) ) , _river ( V0 ) , _traverse ( V0 , V1 ) ) )
what is the lowest point in rhode island ?	_answer ( NV , _lowest ( V0 , ( _place ( V0 ) , _loc ( V0 , NV ) , _const ( V0 , _stateid ( ' rhode island ' ) ) ) ) )
what state is scotts valley located in ?	_answer ( NV , ( _state ( V0 ) , _const ( NV , _cityid ( ' scotts valley ' , _ ) ) , _loc ( V0 , V1 ) ) )
what iowa city has the largest population ?	_answer ( NV , _largest ( NV , ( _const ( NV , _stateid ( iowa ) ) , _city ( V2 ) , _loc ( V2 , V0 ) , _population ( V2 , V1 ) ) ) )
how many rivers are found in wisconsin ?	_answer ( NV , _count ( NV , ( _river ( V0 ) , _loc ( V0 , NV ) , _const ( V0 , _stateid ( wisconsin ) ) ) , V2 ) )
what is the capital of the state north dakota ?	_answer ( NV , ( _capital ( V0 ) , _loc ( V0 , NV ) , _state ( V0 ) , _const ( V0 , _stateid ( ' north dakota ' ) ) ) )
