what states border states that border states that border states that border louisiana ?	_answer ( NV , ( _state ( V0 ) , _next_to ( V0 , NV ) , _state ( V0 ) , _next_to ( V0 , NV ) , _state ( V0 ) , _next_to ( V0 , NV ) , _state ( V0 ) , _next_to ( V0 , NV ) , _const ( V0 , _stateid ( louisiana ) ) ) )
how many major rivers cross hawaii ?	_answer ( NV , _count ( NV , ( _major ( V0 ) , _river ( V0 ) , _traverse ( V0 , NV ) , _const ( V0 , _stateid ( hawaii ) ) ) , V2 ) )
can you tell me the capital of oklahoma ?	_answer ( NV , ( _capital ( V0 ) , _loc ( V0 , NV ) , _const ( V0 , _stateid ( oklahoma ) ) ) )
what is the lowest point of nebraska ?	_answer ( NV , _lowest ( V0 , ( _place ( V0 ) , _loc ( V0 , NV ) , _const ( V0 , _stateid ( nebraska ) ) ) ) )
what state borders kentucky ?	_answer ( NV , ( _state ( V0 ) , _next_to ( V0 , NV ) , _const ( V0 , _stateid ( kentucky ) ) ) )
what is the shortest river in tennessee ?	_answer ( NV , _shortest ( V0 , ( _river ( V0 ) , _loc ( V0 , NV ) , _const ( V0 , _stateid ( tennessee ) ) ) ) )
how high is the highest point in louisiana ?	_answer ( NV , ( _elevation ( NV , V1 ) , _highest ( V0 , ( _place ( V0 ) , _loc ( V0 , NV ) , _const ( V0 , _stateid ( louisiana ) ) ) ) ) )
how long is the potomac ?	_answer ( NV , ( _len ( NV , V1 ) , _const ( V0 , _riverid ( potomac ) ) , _river ( V0 ) ) )
what state borders the least states excluding montana and excluding indiana ?	_answer ( NV , _fewest ( V0 , NV , ( _state ( V1 ) , _next_to ( V1 , V0 ) , _state ( V0 ) , \+ _const ( V1 , _stateid ( montana ) ) , \+ _const ( V1 , _stateid ( indiana ) ) ) ) )
how long is the rio grande river ?	_answer ( NV , ( _len ( NV , V1 ) , _const ( V0 , _riverid ( ' rio grande ' ) ) ) )
what cities in georgia ?	_answer ( NV , ( _city ( V0 ) , _loc ( V0 , NV ) , _const ( V0 , _stateid ( georgia ) ) ) )
states bordering louisiana ?	_answer ( NV , ( _state ( V0 ) , _next_to ( V0 , NV ) , _const ( V0 , _stateid ( louisiana ) ) ) )
which state borders pennsylvania ?	_answer ( NV , ( _state ( V0 ) , _next_to ( V0 , NV ) , _const ( V0 , _stateid ( pennsylvania ) ) ) )
what cities in alabama have the highest number of citizens ?	_answer ( NV , _largest ( NV , ( _city ( V1 ) , _loc ( V1 , NV ) , _const ( V0 , _stateid ( alabama ) ) , _population ( V2 , V1 ) ) ) )
how many rivers are called rio grande ?	_answer ( NV , _count ( NV , ( _river ( V0 ) , _const ( V0 , _riverid ( ' rio grande ' ) ) ) , V1 ) )
how many people are in the state of minnesota ?	_answer ( NV , ( _population ( NV , V1 ) , _const ( V0 , _stateid ( minnesota ) ) ) )
where is the lowest spot in maine ?	_answer ( NV , _lowest ( V0 , ( _place ( V0 ) , _loc ( V0 , NV ) , _const ( V0 , _stateid ( maine ) ) ) ) )
how big is maryland ?	_answer ( NV , ( _size ( NV , V1 ) , _const ( V0 , _stateid ( maryland ) ) ) )
what is the area of the state with the capital boulder ?	_answer ( NV , ( _area ( NV , V1 ) , _state ( V0 ) , _loc ( NV , V1 ) , _capital ( V0 ) , _const ( V0 , _cityid ( boulder , _ ) ) ) )
how many rivers are called red ?	_answer ( NV , _count ( NV , ( _river ( V0 ) , _const ( V0 , _riverid ( red ) ) ) , V1 ) )
how many states have a city called springfield ?	_answer ( NV , _count ( NV , ( _state ( V0 ) , _loc ( NV , V1 ) , _const ( V0 , _cityid ( springfield , _ ) ) ) , V2 ) )
what is the largest city in maine by population ?	_answer ( NV , _largest ( NV , ( _city ( V1 ) , _loc ( V1 , NV ) , _const ( V0 , _stateid ( maine ) ) , _population ( V2 , V1 ) ) ) )
how many citizens in rochester ?	_answer ( NV , ( _population ( NV , V1 ) , _const ( V0 , _cityid ( rochester , _ ) ) ) )
population of new york ?	_answer ( NV , ( _population ( NV , V1 ) , _const ( V0 , _cityid ( ' new york ' , _ ) ) ) )
how many people in atlanta ?	_answer ( NV , ( _population ( NV , V1 ) , _const ( V0 , _cityid ( atlanta , _ ) ) ) )
people in columbus ?	_answer ( NV , ( _population ( NV , V1 ) , _const ( V0 , _cityid ( columbus , _ ) ) ) )
what are the major cities in the states through which the major river in arkansas runs ?	_answer ( NV , ( _major ( V0 ) , _city ( V0 ) , _loc ( V0 , NV ) , _state ( V0 ) , _river ( NV ) , _loc ( V0 , NV ) , _const ( V0 , _stateid ( arkansas ) ) , _traverse ( V1 , V2 ) ) )
what are the populations of states through which the red run ?	_answer ( NV , ( _population ( NV , V1 ) , _state ( V0 ) , _const ( NV , _riverid ( red ) ) , _traverse ( V0 , V1 ) ) )
what are the populations of states through which the colorado river run ?	_answer ( NV , ( _population ( NV , V1 ) , _state ( V0 ) , _const ( NV , _riverid ( colorado ) ) , _river ( V0 ) , _traverse ( V0 , V1 ) ) )
how many people live in south carolina ?	_answer ( NV , ( _population ( NV , V1 ) , _const ( V0 , _stateid ( ' south carolina ' ) ) ) )
which states border nebraska ?	_answer ( NV , ( _state ( V0 ) , _next_to ( V0 , NV ) , _const ( V0 , _stateid ( nebraska ) ) ) )
what states does the rio grande run through ?	_answer ( NV , ( _state ( V0 ) , _const ( NV , _riverid ( ' rio grande ' ) ) , _traverse ( V0 , V1 ) ) )
what is the size of the capital of iowa ?	_answer ( NV , ( _size ( NV , V1 ) , _capital ( V0 ) , _loc ( V0 , NV ) , _const ( V0 , _stateid ( iowa ) ) ) )
what rivers flow through alabama ?	_answer ( NV , ( _river ( V0 ) , _traverse ( V0 , NV ) , _const ( V0 , _stateid ( alabama ) ) ) )
what are the high points of states surrounding georgia ?	_answer ( NV , ( _high_point ( NV , V1 ) , _loc ( V1 , V0 ) , _state ( V0 ) , _next_to ( V0 , NV ) , _const ( V0 , _stateid ( georgia ) ) ) )
what is the largest city in vermont ?	_answer ( NV , _largest ( V0 , ( _city ( V0 ) , _loc ( V0 , NV ) , _const ( V0 , _stateid ( vermont ) ) ) ) )
what state which the mississippi river runs through has the largest population ?	_answer ( NV , _largest ( NV , ( _state ( V1 ) , _const ( NV , _riverid ( mississippi ) ) , _traverse ( V0 , V2 ) , _population ( V2 , V1 ) ) ) )
can you tell me the capital of arizona ?	_answer ( NV , ( _capital ( V0 ) , _loc ( V0 , NV ) , _const ( V0 , _stateid ( arizona ) ) ) )
how high is the highest point of minnesota ?	_answer ( NV , ( _elevation ( NV , V1 ) , _highest ( V0 , ( _place ( V0 ) , _loc ( V0 , NV ) , _const ( V0 , _stateid ( minnesota ) ) ) ) ) )
what is the smallest state bordering north dakota ?	_answer ( NV , _smallest ( V0 , ( _state ( V0 ) , _next_to ( V0 , NV ) , _const ( V0 , _stateid ( ' north dakota ' ) ) ) ) )
how long is missouri river ?	_answer ( NV , ( _len ( NV , V1 ) , _const ( V0 , _riverid ( missouri ) ) ) )
what can you tell me about the population of utah ?	_answer ( NV , ( _population ( NV , V1 ) , _const ( V0 , _stateid ( utah ) ) ) )
what states border the colorado ?	_answer ( NV , ( _state ( V0 ) , _next_to ( V0 , NV ) , _const ( V0 , _riverid ( colorado ) ) , _river ( V0 ) ) )
what are the populations of the states through which the red river runs ?	_answer ( NV , ( _population ( NV , V1 ) , _state ( V0 ) , _const ( NV , _riverid ( red ) ) , _river ( V0 ) , _traverse ( V0 , V1 ) ) )
what state borders washington ?	_answer ( NV , ( _state ( V0 ) , _next_to ( V0 , NV ) , _const ( V0 , _stateid ( washington ) ) ) )
what rivers do not run through arizona ?	_answer ( NV , ( _river ( V0 ) , \+ ( _traverse ( V0 , NV ) , _const ( V0 , _stateid ( arizona ) ) ) ) )
what rivers run through the states that border the state with the capital des moines ?	_answer ( NV , ( _river ( V0 ) , _traverse ( V0 , NV ) , _state ( V0 ) , _next_to ( V0 , NV ) , _state ( V0 ) , _loc ( NV , V1 ) , _capital ( V0 ) , _const ( V0 , _cityid ( ' des moines ' , _ ) ) ) )
what are the biggest rivers in iowa ?	_answer ( NV , _longest ( V0 , ( _river ( V0 ) , _loc ( V0 , NV ) , _const ( V0 , _stateid ( iowa ) ) ) ) )
what is the major cities in florida ?	_answer ( NV , ( _major ( V0 ) , _city ( V0 ) , _loc ( V0 , NV ) , _const ( V0 , _stateid ( florida ) ) ) )
what is the number of neighboring states for alaska ?	_answer ( NV , _count ( NV , ( _state ( V0 ) , _next_to ( V0 , NV ) , _const ( V0 , _stateid ( alaska ) ) ) , V2 ) )
what states have rivers named mississippi river ?	_answer ( NV , ( _state ( V0 ) , _loc ( NV , V1 ) , _const ( V0 , _riverid ( mississippi ) ) ) )
give me the cities which are in alaska ?	_answer ( NV , ( _city ( V0 ) , _loc ( V0 , NV ) , _const ( V0 , _stateid ( alaska ) ) ) )
what rivers flow through nevada ?	_answer ( NV , ( _river ( V0 ) , _traverse ( V0 , NV ) , _const ( V0 , _stateid ( nevada ) ) ) )
how high is death valley ?	_answer ( NV , ( _elevation ( NV , V1 ) , _const ( V0 , _placeid ( ' death valley ' ) ) ) )
what is the river that cross over oklahoma ?	_answer ( NV , ( _river ( V0 ) , _traverse ( V0 , NV ) , _const ( V0 , _stateid ( oklahoma ) ) ) )
what rivers run through the states that border the state with the capital riverside ?	_answer ( NV , ( _river ( V0 ) , _traverse ( V0 , NV ) , _state ( V0 ) , _next_to ( V0 , NV ) , _state ( V0 ) , _loc ( NV , V1 ) , _capital ( V0 ) , _const ( V0 , _cityid ( riverside , _ ) ) ) )
which state has the colorado river ?	_answer ( NV , ( _state ( V0 ) , _loc ( NV , V1 ) , _const ( V0 , _riverid ( colorado ) ) , _river ( V0 ) ) )
what is the population density in the state with capital pittsburgh ?	_answer ( NV , ( _density ( NV , V1 ) , _state ( V0 ) , _loc ( NV , V1 ) , _capital ( V0 ) , _const ( V0 , _cityid ( pittsburgh , _ ) ) ) )
what are the major cities of alabama ?	_answer ( NV , ( _major ( V0 ) , _city ( V0 ) , _loc ( V0 , NV ) , _const ( V0 , _stateid ( alabama ) ) ) )
what rivers run through the states that border the state with the capital new york ?	_answer ( NV , ( _river ( V0 ) , _traverse ( V0 , NV ) , _state ( V0 ) , _next_to ( V0 , NV ) , _state ( V0 ) , _loc ( NV , V1 ) , _capital ( V0 ) , _const ( V0 , _cityid ( ' new york ' , _ ) ) ) )
where is the lowest spot in alabama ?	_answer ( NV , _lowest ( V0 , ( _place ( V0 ) , _loc ( V0 , NV ) , _const ( V0 , _stateid ( alabama ) ) ) ) )
how many states does the colorado river run through ?	_answer ( NV , _count ( NV , ( _state ( V0 ) , _const ( NV , _riverid ( colorado ) ) , _traverse ( V0 , V1 ) ) , V2 ) )
how many big cities are in south dakota ?	_answer ( NV , _count ( NV , ( _major ( V0 ) , _city ( V0 ) , _loc ( V0 , NV ) , _const ( V0 , _stateid ( ' south dakota ' ) ) ) , V2 ) )
what is the density of delaware ?	_answer ( NV , ( _density ( NV , V1 ) , _const ( V0 , _stateid ( delaware ) ) ) )
what are the high points of states surrounding delaware ?	_answer ( NV , ( _high_point ( NV , V1 ) , _loc ( V1 , V0 ) , _state ( V0 ) , _next_to ( V0 , NV ) , _const ( V0 , _stateid ( delaware ) ) ) )
what states does the colorado run through ?	_answer ( NV , ( _state ( V0 ) , _const ( NV , _riverid ( colorado ) ) , _traverse ( V0 , V1 ) ) )
what states does the ohio river run through ?	_answer ( NV , ( _state ( V0 ) , _const ( NV , _riverid ( ohio ) ) , _river ( V0 ) , _traverse ( V0 , V1 ) ) )
what can you tell me about the population of massachusetts ?	_answer ( NV , ( _population ( NV , V1 ) , _const ( V0 , _stateid ( massachusetts ) ) ) )
how many states border on the state whose capital is baton rouge ?	_answer ( NV , _count ( NV , ( _state ( V0 ) , _next_to ( V0 , NV ) , _state ( V0 ) , _loc ( NV , V1 ) , _capital ( V0 ) , _const ( V0 , _cityid ( ' baton rouge ' , _ ) ) ) , V3 ) )
what is the largest city in virginia ?	_answer ( NV , _largest ( V0 , ( _city ( V0 ) , _loc ( V0 , NV ) , _const ( V0 , _stateid ( virginia ) ) ) ) )
what are the rivers of vermont ?	_answer ( NV , ( _river ( V0 ) , _loc ( V0 , NV ) , _const ( V0 , _stateid ( vermont ) ) ) )
what is capital of maine ?	_answer ( NV , ( _capital ( V0 ) , _loc ( V0 , NV ) , _const ( V0 , _stateid ( maine ) ) ) )
what is the lowest point in mississippi ?	_answer ( NV , _lowest ( V0 , ( _place ( V0 ) , _loc ( V0 , NV ) , _const ( V0 , _stateid ( mississippi ) ) ) ) )
what state has the city boston ?	_answer ( NV , ( _state ( V0 ) , _loc ( NV , V1 ) , _city ( V0 ) , _const ( V0 , _cityid ( boston , _ ) ) ) )
what rivers flow through states that maryland borders ?	_answer ( NV , ( _river ( V0 ) , _traverse ( V0 , NV ) , _state ( V0 ) , _const ( NV , _stateid ( maryland ) ) , _next_to ( V0 , V1 ) ) )
what is the biggest river in arkansas ?	_answer ( NV , _largest ( V0 , ( _river ( V0 ) , _loc ( V0 , NV ) , _const ( V0 , _stateid ( arkansas ) ) ) ) )
how many people live in the capital of louisiana ?	_answer ( NV , ( _population ( NV , V1 ) , _capital ( V0 ) , _loc ( V0 , NV ) , _const ( V0 , _stateid ( louisiana ) ) ) )
what is the capital of the state that borders the state that borders kansas ?	_answer ( NV , ( _capital ( V0 ) , _loc ( V0 , NV ) , _state ( V0 ) , _next_to ( V0 , NV ) , _state ( V0 ) , _next_to ( V0 , NV ) , _const ( V0 , _stateid ( kansas ) ) ) )
what states capital is salem ?	_answer ( NV , ( _state ( V0 ) , _capital ( V0 , NV ) , _const ( V0 , _cityid ( salem , _ ) ) ) )
what states does the red go through ?	_answer ( NV , ( _state ( V0 ) , _const ( NV , _riverid ( red ) ) , _river ( V0 ) , _traverse ( V0 , V1 ) ) )
what states does the mississippi river run through ?	_answer ( NV , ( _state ( V0 ) , _const ( NV , _riverid ( mississippi ) ) , _traverse ( V0 , V1 ) ) )
which state has the smallest area that borders kentucky ?	_answer ( NV , _smallest ( NV , ( _state ( V1 ) , _area ( V1 , V0 ) , _next_to ( V1 , NV ) , _const ( V0 , _stateid ( kentucky ) ) ) ) )
what states border states which the red river runs through ?	_answer ( NV , ( _state ( V0 ) , _next_to ( V0 , NV ) , _state ( V0 ) , _const ( NV , _riverid ( red ) ) , _traverse ( V0 , V1 ) ) )
how many states have cities named flint ?	_answer ( NV , _count ( NV , ( _state ( V0 ) , _loc ( NV , V1 ) , _city ( V0 ) , _const ( V0 , _cityid ( flint , _ ) ) ) , V2 ) )
what is the capital of the state florida ?	_answer ( NV , ( _capital ( V0 ) , _loc ( V0 , NV ) , _state ( V0 ) , _const ( V0 , _stateid ( florida ) ) ) )
what is the length of the red in louisiana ?	_answer ( NV , ( _len ( NV , V1 ) , _const ( V0 , _riverid ( red ) ) , _river ( V0 ) , _loc ( V0 , NV ) , _const ( V0 , _stateid ( louisiana ) ) ) )
what are the populations of states through which the potomac run ?	_answer ( NV , ( _population ( NV , V1 ) , _state ( V0 ) , _const ( NV , _riverid ( potomac ) ) , _river ( V0 ) , _traverse ( V0 , V1 ) ) )
what is the elevation of mount whitney ?	_answer ( NV , ( _elevation ( NV , V1 ) , _const ( V0 , _placeid ( ' mount whitney ' ) ) ) )
what is the longest river that runs through a state that borders idaho ?	_answer ( NV , _longest ( V0 , ( _river ( V0 ) , _traverse ( V0 , NV ) , _state ( V0 ) , _next_to ( V0 , NV ) , _const ( V0 , _stateid ( idaho ) ) ) ) )
what cities are located in wisconsin ?	_answer ( NV , ( _city ( V0 ) , _loc ( V0 , NV ) , _const ( V0 , _stateid ( wisconsin ) ) ) )
how many states does the colorado run through ?	_answer ( NV , _count ( NV , ( _state ( V0 ) , _const ( NV , _riverid ( colorado ) ) , _traverse ( V0 , V1 ) ) , V2 ) )
what is the smallest city in idaho ?	_answer ( NV , _smallest ( V0 , ( _city ( V0 ) , _loc ( V0 , NV ) , _const ( V0 , _stateid ( idaho ) ) ) ) )
how many people live in the capital of vermont ?	_answer ( NV , ( _population ( NV , V1 ) , _capital ( V0 ) , _loc ( V0 , NV ) , _const ( V0 , _stateid ( vermont ) ) ) )
what is the area of montana in square kilometers ?	_answer ( NV , ( _area ( NV , V1 ) , _const ( V0 , _stateid ( montana ) ) ) )
what states does the mississippi run through ?	_answer ( NV , ( _state ( V0 ) , _const ( NV , _riverid ( mississippi ) ) , _river ( V0 ) , _traverse ( V0 , V1 ) ) )
what is the longest river that does not run through north dakota ?	_answer ( NV , _longest ( V0 , ( _river ( V0 ) , \+ ( _traverse ( V0 , NV ) , _const ( V0 , _stateid ( ' north dakota ' ) ) ) ) ) )
which state has the rio grande ?	_answer ( NV , ( _state ( V0 ) , _loc ( NV , V1 ) , _const ( V0 , _riverid ( ' rio grande ' ) ) , _river ( V0 ) ) )
name the major lakes in new hampshire ?	_answer ( NV , ( _major ( V0 ) , _lake ( V0 ) , _loc ( V0 , NV ) , _const ( V0 , _stateid ( ' new hampshire ' ) ) ) )
what is the population of new hampshire ?	_answer ( NV , ( _population ( NV , V1 ) , _const ( V0 , _stateid ( ' new hampshire ' ) ) ) )
how many rivers run through north carolina ?	_answer ( NV , _count ( NV , ( _river ( V0 ) , _traverse ( V0 , NV ) , _const ( V0 , _stateid ( ' north carolina ' ) ) ) , V2 ) )
what state that borders indiana is the largest ?	_answer ( NV , _largest ( V0 , ( _state ( V0 ) , _next_to ( V0 , NV ) , _const ( V0 , _stateid ( indiana ) ) ) ) )
what states are next to new york ?	_answer ( NV , ( _state ( V0 ) , _next_to ( V0 , NV ) , _const ( V0 , _stateid ( ' new york ' ) ) ) )
what are the highest points of states surrounding nevada ?	_answer ( NV , _highest ( V0 , ( _place ( V0 ) , _loc ( V0 , NV ) , _state ( V0 ) , _next_to ( V0 , NV ) , _const ( V0 , _stateid ( nevada ) ) ) ) )
what is the capital of louisiana ?	_answer ( NV , ( _capital ( V0 ) , _loc ( V0 , NV ) , _const ( V0 , _stateid ( louisiana ) ) ) )
how many states have a city called atlanta ?	_answer ( NV , _count ( NV , ( _state ( V0 ) , _loc ( NV , V1 ) , _const ( V0 , _cityid ( atlanta , _ ) ) ) , V2 ) )
what is the population of the largest state that borders arizona ?	_answer ( NV , ( _population ( NV , V1 ) , _largest ( V0 , ( _state ( V0 ) , _next_to ( V0 , NV ) , _const ( V0 , _stateid ( arizona ) ) ) ) ) )
how many rivers are in illinois ?	_answer ( NV , _count ( NV , ( _river ( V0 ) , _loc ( V0 , NV ) , _const ( V0 , _stateid ( illinois ) ) ) , V2 ) )
which state has the potomac ?	_answer ( NV , ( _state ( V0 ) , _loc ( NV , V1 ) , _const ( V0 , _riverid ( potomac ) ) , _river ( V0 ) ) )
what rivers flow through states that michigan borders ?	_answer ( NV , ( _river ( V0 ) , _traverse ( V0 , NV ) , _state ( V0 ) , _const ( NV , _stateid ( michigan ) ) , _next_to ( V0 , V1 ) ) )
what is the capital of the state iowa ?	_answer ( NV , ( _capital ( V0 ) , _loc ( V0 , NV ) , _state ( V0 ) , _const ( V0 , _stateid ( iowa ) ) ) )
what rivers run through the states that border the state with the capital boston ?	_answer ( NV , ( _river ( V0 ) , _traverse ( V0 , NV ) , _state ( V0 ) , _next_to ( V0 , NV ) , _state ( V0 ) , _loc ( NV , V1 ) , _capital ( V0 ) , _const ( V0 , _cityid ( boston , _ ) ) ) )
how many people live in des moines ?	_answer ( NV , ( _population ( NV , V1 ) , _const ( V0 , _cityid ( ' des moines ' , _ ) ) ) )
how many states border maine ?	_answer ( NV , _count ( NV , ( _state ( V0 ) , _next_to ( V0 , NV ) , _const ( V0 , _stateid ( maine ) ) ) , V2 ) )
what are major rivers in west virginia ?	_answer ( NV , ( _major ( V0 ) , _river ( V0 ) , _loc ( V0 , NV ) , _const ( V0 , _stateid ( ' west virginia ' ) ) ) )
which states does the red river pass through ?	_answer ( NV , ( _state ( V0 ) , _const ( NV , _riverid ( red ) ) , _traverse ( V0 , V1 ) ) )
what are the major cities of new york ?	_answer ( NV , ( _major ( V0 ) , _city ( V0 ) , _loc ( V0 , NV ) , _const ( V0 , _stateid ( ' new york ' ) ) ) )
what is the capital of the state ohio ?	_answer ( NV , ( _capital ( V0 ) , _loc ( V0 , NV ) , _state ( V0 ) , _const ( V0 , _stateid ( ohio ) ) ) )
people in salem ?	_answer ( NV , ( _population ( NV , V1 ) , _const ( V0 , _cityid ( salem , _ ) ) ) )
what is the size of oklahoma ?	_answer ( NV , ( _size ( NV , V1 ) , _const ( V0 , _stateid ( oklahoma ) ) ) )
what is the elevation of guadalupe peak ?	_answer ( NV , ( _elevation ( NV , V1 ) , _const ( V0 , _placeid ( ' guadalupe peak ' ) ) ) )
what are the states that the red river run through ?	_answer ( NV , ( _state ( V0 ) , _const ( NV , _riverid ( red ) ) , _traverse ( V0 , V1 ) ) )
what are the neighboring states for california ?	_answer ( NV , ( _next_to ( V0 , NV ) , _state ( V1 ) , _const ( V0 , _stateid ( california ) ) ) )
what is the smallest state that borders north dakota ?	_answer ( NV , _smallest ( V0 , ( _state ( V0 ) , _next_to ( V0 , NV ) , _const ( V0 , _stateid ( ' north dakota ' ) ) ) ) )
what is the longest river in alaska ?	_answer ( NV , _longest ( V0 , ( _river ( V0 ) , _loc ( V0 , NV ) , _const ( V0 , _stateid ( alaska ) ) ) ) )
what is the size of the capital of vermont ?	_answer ( NV , ( _size ( NV , V1 ) , _capital ( V0 ) , _loc ( V0 , NV ) , _const ( V0 , _stateid ( vermont ) ) ) )
what are the high points of states surrounding michigan ?	_answer ( NV , ( _high_point ( NV , V1 ) , _loc ( V1 , V0 ) , _state ( V0 ) , _next_to ( V0 , NV ) , _const ( V0 , _stateid ( michigan ) ) ) )
which states does not border alaska ?	_answer ( NV , ( _state ( V0 ) , \+ ( _next_to ( V0 , NV ) , _const ( V0 , _stateid ( alaska ) ) ) ) )
how many rivers in louisiana ?	_answer ( NV , _count ( NV , ( _river ( V0 ) , _loc ( V0 , NV ) , _const ( V0 , _stateid ( louisiana ) ) ) , V2 ) )
what are major rivers in florida ?	_answer ( NV , ( _major ( V0 ) , _river ( V0 ) , _loc ( V0 , NV ) , _const ( V0 , _stateid ( florida ) ) ) )
give me the lakes in michigan ?	_answer ( NV , ( _lake ( V0 ) , _loc ( V0 , NV ) , _const ( V0 , _stateid ( michigan ) ) ) )
what is the most populated state bordering idaho ?	_answer ( NV , _largest ( NV , ( _population ( V1 , V0 ) , _state ( V1 ) , _next_to ( V1 , NV ) , _const ( V0 , _stateid ( idaho ) ) ) ) )
how many states border on the state whose capital is seattle ?	_answer ( NV , _count ( NV , ( _state ( V0 ) , _next_to ( V0 , NV ) , _state ( V0 ) , _loc ( NV , V1 ) , _capital ( V0 ) , _const ( V0 , _cityid ( seattle , _ ) ) ) , V3 ) )
what is the smallest city in new hampshire ?	_answer ( NV , _smallest ( V0 , ( _city ( V0 ) , _loc ( V0 , NV ) , _const ( V0 , _stateid ( ' new hampshire ' ) ) ) ) )
what states capital is dallas ?	_answer ( NV , ( _state ( V0 ) , _capital ( V0 , NV ) , _const ( V0 , _cityid ( dallas , _ ) ) ) )
give me the cities which are in oklahoma ?	_answer ( NV , ( _city ( V0 ) , _loc ( V0 , NV ) , _const ( V0 , _stateid ( oklahoma ) ) ) )
what states high point are higher than that of ohio ?	_answer ( NV , ( _state ( V0 ) , _high_point ( V0 , NV ) , _higher ( V0 , NV ) , _high_point ( NV , V1 ) , _const ( V0 , _stateid ( ohio ) ) ) )
can you tell me the capital of california ?	_answer ( NV , ( _capital ( V0 ) , _loc ( V0 , NV ) , _const ( V0 , _stateid ( california ) ) ) )
how many people in pittsburgh ?	_answer ( NV , ( _population ( NV , V1 ) , _const ( V0 , _cityid ( pittsburgh , _ ) ) ) )
what rivers are in virginia ?	_answer ( NV , ( _river ( V0 ) , _loc ( V0 , NV ) , _const ( V0 , _stateid ( virginia ) ) ) )
what is the longest river flowing through texas ?	_answer ( NV , _longest ( V0 , ( _river ( V0 ) , _traverse ( V0 , NV ) , _const ( V0 , _stateid ( texas ) ) ) ) )
what are the cities in alaska ?	_answer ( NV , ( _city ( V0 ) , _loc ( V0 , NV ) , _const ( V0 , _stateid ( alaska ) ) ) )
what rivers flow through new york ?	_answer ( NV , ( _river ( V0 ) , _traverse ( V0 , NV ) , _const ( V0 , _stateid ( ' new york ' ) ) ) )
how big is washington ?	_answer ( NV , ( _size ( NV , V1 ) , _const ( V0 , _stateid ( washington ) ) ) )
what cities in iowa have the highest populations ?	_answer ( NV , _largest ( NV , ( _city ( V1 ) , _loc ( V1 , NV ) , _const ( V0 , _stateid ( iowa ) ) , _population ( V2 , V1 ) ) ) )
what state that borders idaho has the highest population ?	_answer ( NV , _largest ( NV , ( _state ( V1 ) , _next_to ( V1 , NV ) , _const ( V0 , _stateid ( idaho ) ) , _population ( V2 , V1 ) ) ) )
where is riverside ?	_answer ( NV , ( _loc ( NV , V1 ) , _const ( V0 , _cityid ( riverside , _ ) ) ) )
how many states does the rio grande river run through ?	_answer ( NV , _count ( NV , ( _state ( V0 ) , _const ( NV , _riverid ( ' rio grande ' ) ) , _traverse ( V0 , V1 ) ) , V2 ) )
what is the largest of the state that the mississippi river runs through ?	_answer ( NV , _largest ( V0 , ( _state ( V0 ) , _const ( NV , _riverid ( mississippi ) ) , _traverse ( V0 , V1 ) ) ) )
what is the population of alabama ?	_answer ( NV , ( _population ( NV , V1 ) , _const ( V0 , _stateid ( alabama ) ) ) )
through which states does the ohio river flow ?	_answer ( NV , ( _state ( V0 ) , _const ( NV , _riverid ( ohio ) ) , _traverse ( V0 , V1 ) ) )
which state is the largest city in georgia in ?	_answer ( NV , ( _state ( V0 ) , _largest ( NV , ( _city ( V0 ) , _loc ( V0 , NV ) , _const ( V0 , _stateid ( georgia ) ) ) ) , _loc ( V1 , V2 ) ) )
how high is death valley ?	_answer ( NV , ( _elevation ( NV , V1 ) , _const ( V0 , _placeid ( ' death valley ' ) ) ) )
what are the populations of all the major cities in arizona ?	_answer ( NV , ( _population ( NV , V1 ) , _major ( V0 ) , _city ( V0 ) , _loc ( V0 , NV ) , _const ( V0 , _stateid ( arizona ) ) ) )
what cities are located in hawaii ?	_answer ( NV , ( _city ( V0 ) , _loc ( V0 , NV ) , _const ( V0 , _stateid ( hawaii ) ) ) )
what is the density of michigan ?	_answer ( NV , ( _density ( NV , V1 ) , _const ( V0 , _stateid ( michigan ) ) ) )
what is the population of indiana ?	_answer ( NV , ( _population ( NV , V1 ) , _const ( V0 , _stateid ( indiana ) ) ) )
through which states does the colorado river run ?	_answer ( NV , ( _state ( V0 ) , _const ( NV , _riverid ( colorado ) ) , _traverse ( V0 , V1 ) ) )
which states does the potomac run through ?	_answer ( NV , ( _state ( V0 ) , _const ( NV , _riverid ( potomac ) ) , _river ( V0 ) , _traverse ( V0 , V1 ) ) )
where is the highest point in michigan ?	_answer ( NV , _highest ( V0 , ( _place ( V0 ) , _loc ( V0 , NV ) , _const ( V0 , _stateid ( michigan ) ) ) ) )
what is the highest elevation in iowa ?	_answer ( NV , _highest ( V0 , ( _place ( V0 ) , _loc ( V0 , NV ) , _const ( V0 , _stateid ( iowa ) ) ) ) )
how long is the red ?	_answer ( NV , ( _len ( NV , V1 ) , _const ( V0 , _riverid ( red ) ) , _river ( V0 ) ) )
what states border states that the ohio river runs through ?	_answer ( NV , ( _state ( V0 ) , _next_to ( V0 , NV ) , _state ( V0 ) , _const ( NV , _riverid ( ohio ) ) , _traverse ( V0 , V1 ) ) )
