how many major cities are in minnesota ?	_answer ( NV , _count ( NV , ( _major ( V0 ) , _city ( V0 ) , _loc ( V0 , NV ) , _const ( V0 , _stateid ( minnesota ) ) ) , V2 ) )
what rivers are in maryland ?	_answer ( NV , ( _river ( V0 ) , _loc ( V0 , NV ) , _const ( V0 , _stateid ( maryland ) ) ) )
what is the population of columbus ga ?	_answer ( NV , ( _population ( NV , V1 ) , _const ( V0 , _cityid ( columbus , _ ) ) ) )
what are the neighboring states for wisconsin ?	_answer ( NV , ( _next_to ( V0 , NV ) , _state ( V1 ) , _const ( V0 , _stateid ( wisconsin ) ) ) )
which state is baton rouge in ?	_answer ( NV , ( _state ( V0 ) , _const ( NV , _cityid ( ' baton rouge ' , _ ) ) , _loc ( V0 , V1 ) ) )
what state borders the least states excluding california and excluding ohio ?	_answer ( NV , _fewest ( V0 , NV , ( _state ( V1 ) , _next_to ( V1 , V0 ) , _state ( V0 ) , \+ _const ( V1 , _stateid ( california ) ) , \+ _const ( V1 , _stateid ( ohio ) ) ) ) )
what river runs through rhode island ?	_answer ( NV , ( _river ( V0 ) , _traverse ( V0 , NV ) , _const ( V0 , _stateid ( ' rhode island ' ) ) ) )
how many states have a city named scotts valley ?	_answer ( NV , _count ( NV , ( _state ( V0 ) , _loc ( NV , V1 ) , _const ( V0 , _cityid ( ' scotts valley ' , _ ) ) ) , V2 ) )
what states border north carolina ?	_answer ( NV , ( _state ( V0 ) , _next_to ( V0 , NV ) , _const ( V0 , _stateid ( ' north carolina ' ) ) ) )
what is the length of the potomac in south carolina ?	_answer ( NV , ( _len ( NV , V1 ) , _const ( V0 , _riverid ( potomac ) ) , _river ( V0 ) , _loc ( V0 , NV ) , _const ( V0 , _stateid ( ' south carolina ' ) ) ) )
what states have rivers named rio grande ?	_answer ( NV , ( _state ( V0 ) , _loc ( NV , V1 ) , _const ( V0 , _riverid ( ' rio grande ' ) ) ) )
what is the adjacent state of maine ?	_answer ( NV , ( _next_to ( V0 , NV ) , _state ( V1 ) , _const ( V0 , _stateid ( maine ) ) ) )
what is the area of pittsburgh ?	_answer ( NV , ( _area ( NV , V1 ) , _const ( V0 , _cityid ( pittsburgh , _ ) ) ) )
which state is the largest city in colorado in ?	_answer ( NV , ( _state ( V0 ) , _largest ( NV , ( _city ( V0 ) , _loc ( V0 , NV ) , _const ( V0 , _stateid ( colorado ) ) ) ) , _loc ( V1 , V2 ) ) )
of the states washed by the missouri river which has the lowest point ?	_answer ( NV , _lowest ( NV , ( _state ( V1 ) , _traverse ( NV , V2 ) , _const ( V0 , _riverid ( missouri ) ) , _loc ( V1 , V2 ) , _place ( V1 ) ) ) )
how many rivers do not traverse the state with the capital flint ?	_answer ( NV , _count ( NV , ( _river ( V0 ) , \+ ( _traverse ( V0 , NV ) , _state ( V0 ) , _loc ( NV , V1 ) , _capital ( V0 ) , _const ( V0 , _cityid ( flint , _ ) ) ) ) , V3 ) )
austin is the capital of which state ?	_answer ( NV , ( _const ( NV , _cityid ( austin , _ ) ) , _capital ( V0 ) , _loc ( V0 , V1 ) , _state ( V1 ) ) )
what are the neighboring states for washington ?	_answer ( NV , ( _next_to ( V0 , NV ) , _state ( V1 ) , _const ( V0 , _stateid ( washington ) ) ) )
what states have towns named kalamazoo ?	_answer ( NV , ( _state ( V0 ) , _loc ( NV , V1 ) , _const ( V0 , _cityid ( kalamazoo , _ ) ) ) )
how many people are in the state of texas ?	_answer ( NV , ( _population ( NV , V1 ) , _const ( V0 , _stateid ( texas ) ) ) )
what are the major cities in louisiana ?	_answer ( NV , ( _major ( V0 ) , _city ( V0 ) , _loc ( V0 , NV ) , _const ( V0 , _stateid ( louisiana ) ) ) )
which state border new hampshire ?	_answer ( NV , ( _state ( V0 ) , _next_to ( V0 , NV ) , _const ( V0 , _stateid ( ' new hampshire ' ) ) ) )
what cities in michigan ?	_answer ( NV , ( _city ( V0 ) , _loc ( V0 , NV ) , _const ( V0 , _stateid ( michigan ) ) ) )
what is the elevation of mount mckinley ?	_answer ( NV , ( _elevation ( NV , V1 ) , _const ( V0 , _placeid ( ' mount mckinley ' ) ) ) )
what are major rivers in alaska ?	_answer ( NV , ( _major ( V0 ) , _river ( V0 ) , _loc ( V0 , NV ) , _const ( V0 , _stateid ( alaska ) ) ) )
what mountains are in washington ?	_answer ( NV , ( _mountain ( V0 ) , _loc ( V0 , NV ) , _const ( V0 , _stateid ( washington ) ) ) )
which states do red flow through ?	_answer ( NV , ( _state ( V0 ) , _const ( NV , _riverid ( red ) ) , _river ( V0 ) , _traverse ( V0 , V1 ) ) )
how many rivers does arizona have ?	_answer ( NV , _count ( NV , ( _river ( V0 ) , _const ( NV , _stateid ( arizona ) ) , _loc ( V1 , V0 ) ) , V2 ) )
what is the smallest city in kansas ?	_answer ( NV , _smallest ( V0 , ( _city ( V0 ) , _loc ( V0 , NV ) , _const ( V0 , _stateid ( kansas ) ) ) ) )
what states high point are higher than that of california ?	_answer ( NV , ( _state ( V0 ) , _high_point ( V0 , NV ) , _higher ( V0 , NV ) , _high_point ( NV , V1 ) , _const ( V0 , _stateid ( california ) ) ) )
what is the largest state traversed by the red ?	_answer ( NV , _largest ( V0 , ( _state ( V0 ) , _traverse ( NV , V1 ) , _const ( V0 , _riverid ( red ) ) ) ) )
what is the shortest river in kentucky ?	_answer ( NV , _shortest ( V0 , ( _river ( V0 ) , _loc ( V0 , NV ) , _const ( V0 , _stateid ( kentucky ) ) ) ) )
what is the city in oregon with the largest population ?	_answer ( NV , _largest ( NV , ( _city ( V1 ) , _loc ( V1 , NV ) , _const ( V0 , _stateid ( oregon ) ) , _population ( V2 , V1 ) ) ) )
how high is mount whitney ?	_answer ( NV , ( _elevation ( NV , V1 ) , _const ( V0 , _placeid ( ' mount whitney ' ) ) ) )
which states does the rio grande river run through ?	_answer ( NV , ( _state ( V0 ) , _const ( NV , _riverid ( ' rio grande ' ) ) , _traverse ( V0 , V1 ) ) )
what are the states that the colorado river run through ?	_answer ( NV , ( _state ( V0 ) , _const ( NV , _riverid ( colorado ) ) , _traverse ( V0 , V1 ) ) )
what states border states which the colorado runs through ?	_answer ( NV , ( _state ( V0 ) , _next_to ( V0 , NV ) , _state ( V0 ) , _const ( NV , _riverid ( colorado ) ) , _traverse ( V0 , V1 ) ) )
where is guadalupe peak ?	_answer ( NV , ( _loc ( NV , V1 ) , _const ( V0 , _placeid ( ' guadalupe peak ' ) ) ) )
what state borders west virginia ?	_answer ( NV , ( _state ( V0 ) , _next_to ( V0 , NV ) , _const ( V0 , _stateid ( ' west virginia ' ) ) ) )
what is the highest mountain in florida ?	_answer ( NV , _highest ( V0 , ( _mountain ( V0 ) , _loc ( V0 , NV ) , _const ( V0 , _stateid ( florida ) ) ) ) )
what states does the mississippi run through ?	_answer ( NV , ( _state ( V0 ) , _const ( NV , _riverid ( mississippi ) ) , _river ( V0 ) , _traverse ( V0 , V1 ) ) )
what is the most populous city in nevada ?	_answer ( NV , _largest ( NV , ( _population ( V1 , V0 ) , _city ( V1 ) , _loc ( V1 , NV ) , _const ( V0 , _stateid ( nevada ) ) ) ) )
what states border the ohio river ?	_answer ( NV , ( _state ( V0 ) , _next_to ( V0 , NV ) , _const ( V0 , _riverid ( ohio ) ) , _river ( V0 ) ) )
what is the capital of the montana state ?	_answer ( NV , ( _capital ( V0 ) , _loc ( V0 , NV ) , _const ( V0 , _stateid ( montana ) ) , _state ( V0 ) ) )
what state that borders oklahoma has the highest population ?	_answer ( NV , _largest ( NV , ( _state ( V1 ) , _next_to ( V1 , NV ) , _const ( V0 , _stateid ( oklahoma ) ) , _population ( V2 , V1 ) ) ) )
give me the lakes in alabama ?	_answer ( NV , ( _lake ( V0 ) , _loc ( V0 , NV ) , _const ( V0 , _stateid ( alabama ) ) ) )
how many states have cities named denver ?	_answer ( NV , _count ( NV , ( _state ( V0 ) , _loc ( NV , V1 ) , _city ( V0 ) , _const ( V0 , _cityid ( denver , _ ) ) ) , V2 ) )
what states does the rio grande run through ?	_answer ( NV , ( _state ( V0 ) , _const ( NV , _riverid ( ' rio grande ' ) ) , _river ( V0 ) , _traverse ( V0 , V1 ) ) )
where is the highest point in hawaii ?	_answer ( NV , _highest ( V0 , ( _place ( V0 ) , _loc ( V0 , NV ) , _const ( V0 , _stateid ( hawaii ) ) ) ) )
what states have rivers named red ?	_answer ( NV , ( _state ( V0 ) , _loc ( NV , V1 ) , _const ( V0 , _riverid ( red ) ) ) )
what are the rivers in the state of north carolina ?	_answer ( NV , ( _river ( V0 ) , _loc ( V0 , NV ) , _state ( V0 ) , _const ( V0 , _stateid ( ' north carolina ' ) ) ) )
what is the smallest state that borders ohio ?	_answer ( NV , _smallest ( V0 , ( _state ( V0 ) , _next_to ( V0 , NV ) , _const ( V0 , _stateid ( ohio ) ) ) ) )
what state borders utah ?	_answer ( NV , ( _state ( V0 ) , _next_to ( V0 , NV ) , _const ( V0 , _stateid ( utah ) ) ) )
name the rivers in hawaii ?	_answer ( NV , ( _river ( V0 ) , _loc ( V0 , NV ) , _const ( V0 , _stateid ( hawaii ) ) ) )
states bordering texas ?	_answer ( NV , ( _state ( V0 ) , _next_to ( V0 , NV ) , _const ( V0 , _stateid ( texas ) ) ) )
which states adjoin arizona ?	_answer ( NV , ( _state ( V0 ) , _next_to ( V0 , NV ) , _const ( V0 , _stateid ( arizona ) ) ) )
how many states does the mississippi run through ?	_answer ( NV , _count ( NV , ( _state ( V0 ) , _const ( NV , _riverid ( mississippi ) ) , _river ( V0 ) , _traverse ( V0 , V1 ) ) , V2 ) )
how many states border new york and border hawaii ?	_answer ( NV , _count ( NV , ( _state ( V0 ) , _next_to ( V0 , NV ) , _const ( V0 , _stateid ( ' new york ' ) ) , _next_to ( V1 , NV ) , _const ( V0 , _stateid ( hawaii ) ) ) , V3 ) )
what states have towns named boulder ?	_answer ( NV , ( _state ( V0 ) , _loc ( NV , V1 ) , _const ( V0 , _cityid ( boulder , _ ) ) ) )
through which states does the colorado river run ?	_answer ( NV , ( _state ( V0 ) , _const ( NV , _riverid ( colorado ) ) , _traverse ( V0 , V1 ) ) )
what rivers flow through nebraska ?	_answer ( NV , ( _river ( V0 ) , _traverse ( V0 , NV ) , _const ( V0 , _stateid ( nebraska ) ) ) )
which state has the smallest area that borders vermont ?	_answer ( NV , _smallest ( NV , ( _state ( V1 ) , _area ( V1 , V0 ) , _next_to ( V1 , NV ) , _const ( V0 , _stateid ( vermont ) ) ) ) )
what is the smallest state bordering maryland ?	_answer ( NV , _smallest ( V0 , ( _state ( V0 ) , _next_to ( V0 , NV ) , _const ( V0 , _stateid ( maryland ) ) ) ) )
what state borders oklahoma ?	_answer ( NV , ( _state ( V0 ) , _next_to ( V0 , NV ) , _const ( V0 , _stateid ( oklahoma ) ) ) )
what are the high points of states surrounding rhode island ?	_answer ( NV , ( _high_point ( NV , V1 ) , _loc ( V1 , V0 ) , _state ( V0 ) , _next_to ( V0 , NV ) , _const ( V0 , _stateid ( ' rhode island ' ) ) ) )
what is the population of scotts valley ga ?	_answer ( NV , ( _population ( NV , V1 ) , _const ( V0 , _cityid ( ' scotts valley ' , _ ) ) ) )
what is the longest river that flows through kentucky ?	_answer ( NV , _longest ( V0 , ( _river ( V0 ) , _traverse ( V0 , NV ) , _const ( V0 , _stateid ( kentucky ) ) ) ) )
how many states does the potomac flow through ?	_answer ( NV , _count ( NV , ( _state ( V0 ) , _const ( NV , _riverid ( potomac ) ) , _river ( V0 ) , _traverse ( V0 , V1 ) ) , V2 ) )
what is the area of louisiana ?	_answer ( NV , ( _area ( NV , V1 ) , _const ( V0 , _stateid ( louisiana ) ) ) )
in which state is scotts valley ?	_answer ( NV , ( _loc ( NV , V1 ) , _state ( V1 ) , _const ( V0 , _cityid ( ' scotts valley ' , _ ) ) ) )
how many people live in dallas ?	_answer ( NV , ( _population ( NV , V1 ) , _const ( V0 , _cityid ( dallas , _ ) ) ) )
what is the area of san jose ?	_answer ( NV , ( _area ( NV , V1 ) , _const ( V0 , _cityid ( ' san jose ' , _ ) ) ) )
how many rivers does colorado have ?	_answer ( NV , _count ( NV , ( _river ( V0 ) , _const ( NV , _stateid ( colorado ) ) , _loc ( V1 , V0 ) ) , V2 ) )
what state has the capital scotts valley ?	_answer ( NV , ( _state ( V0 ) , _loc ( NV , V1 ) , _capital ( V0 ) , _const ( V0 , _cityid ( ' scotts valley ' , _ ) ) ) )
give me the cities in iowa ?	_answer ( NV , ( _city ( V0 ) , _loc ( V0 , NV ) , _const ( V0 , _stateid ( iowa ) ) ) )
what can you tell me about the population of washington ?	_answer ( NV , ( _population ( NV , V1 ) , _const ( V0 , _stateid ( washington ) ) ) )
what states have towns named riverside ?	_answer ( NV , ( _state ( V0 ) , _loc ( NV , V1 ) , _const ( V0 , _cityid ( riverside , _ ) ) ) )
population of sacramento ?	_answer ( NV , ( _population ( NV , V1 ) , _const ( V0 , _cityid ( sacramento , _ ) ) ) )
what are the lakes in states bordering wisconsin ?	_answer ( NV , ( _lake ( V0 ) , _loc ( V0 , NV ) , _state ( V0 ) , _next_to ( V0 , NV ) , _const ( V0 , _stateid ( wisconsin ) ) ) )
what are the major cities in the states through which the major river in iowa runs ?	_answer ( NV , ( _major ( V0 ) , _city ( V0 ) , _loc ( V0 , NV ) , _state ( V0 ) , _river ( NV ) , _loc ( V0 , NV ) , _const ( V0 , _stateid ( iowa ) ) , _traverse ( V1 , V2 ) ) )
could you tell me what is the highest point in the state of nevada ?	_answer ( NV , _highest ( V0 , ( _place ( V0 ) , _loc ( V0 , NV ) , _state ( V0 ) , _const ( V0 , _stateid ( nevada ) ) ) ) )
where is the highest point in south carolina ?	_answer ( NV , _highest ( V0 , ( _place ( V0 ) , _loc ( V0 , NV ) , _const ( V0 , _stateid ( ' south carolina ' ) ) ) ) )
what is the population of the major cities in montana ?	_answer ( NV , ( _population ( NV , V1 ) , _major ( V0 ) , _city ( V0 ) , _loc ( V0 , NV ) , _const ( V0 , _stateid ( montana ) ) ) )
can you tell me the capital of north carolina ?	_answer ( NV , ( _capital ( V0 ) , _loc ( V0 , NV ) , _const ( V0 , _stateid ( ' north carolina ' ) ) ) )
what is the longest river that runs through a state that borders arizona ?	_answer ( NV , _longest ( V0 , ( _river ( V0 ) , _traverse ( V0 , NV ) , _state ( V0 ) , _next_to ( V0 , NV ) , _const ( V0 , _stateid ( arizona ) ) ) ) )
which state is montgomery in ?	_answer ( NV , ( _state ( V0 ) , _const ( NV , _cityid ( montgomery , _ ) ) , _loc ( V0 , V1 ) ) )
what are the major cities in the states through which the major river in massachusetts runs ?	_answer ( NV , ( _major ( V0 ) , _city ( V0 ) , _loc ( V0 , NV ) , _state ( V0 ) , _river ( NV ) , _loc ( V0 , NV ) , _const ( V0 , _stateid ( massachusetts ) ) , _traverse ( V1 , V2 ) ) )
how many cities are in mississippi ?	_answer ( NV , _count ( NV , ( _city ( V0 ) , _loc ( V0 , NV ) , _const ( V0 , _stateid ( mississippi ) ) ) , V2 ) )
what are the states that the rio grande river run through ?	_answer ( NV , ( _state ( V0 ) , _const ( NV , _riverid ( ' rio grande ' ) ) , _traverse ( V0 , V1 ) ) )
what states border states which the ohio river runs through ?	_answer ( NV , ( _state ( V0 ) , _next_to ( V0 , NV ) , _state ( V0 ) , _const ( NV , _riverid ( ohio ) ) , _traverse ( V0 , V1 ) ) )
where is the highest point in california ?	_answer ( NV , _highest ( V0 , ( _place ( V0 ) , _loc ( V0 , NV ) , _const ( V0 , _stateid ( california ) ) ) ) )
how many states does the potomac run through ?	_answer ( NV , _count ( NV , ( _state ( V0 ) , _const ( NV , _riverid ( potomac ) ) , _traverse ( V0 , V1 ) ) , V2 ) )
population of new york ?	_answer ( NV , ( _population ( NV , V1 ) , _const ( V0 , _cityid ( ' new york ' , _ ) ) ) )
how many people in salem ?	_answer ( NV , ( _population ( NV , V1 ) , _const ( V0 , _cityid ( salem , _ ) ) ) )
how many states border on the state whose capital is columbus ?	_answer ( NV , _count ( NV , ( _state ( V0 ) , _next_to ( V0 , NV ) , _state ( V0 ) , _loc ( NV , V1 ) , _capital ( V0 ) , _const ( V0 , _cityid ( columbus , _ ) ) ) , V3 ) )
how many citizens in sacramento ?	_answer ( NV , ( _population ( NV , V1 ) , _const ( V0 , _cityid ( sacramento , _ ) ) ) )
what states does the colorado run through ?	_answer ( NV , ( _state ( V0 ) , _const ( NV , _riverid ( colorado ) ) , _river ( V0 ) , _traverse ( V0 , V1 ) ) )
what is the longest river in wisconsin ?	_answer ( NV , _longest ( V0 , ( _river ( V0 ) , _loc ( V0 , NV ) , _const ( V0 , _stateid ( wisconsin ) ) ) ) )
which is the lowest point of the states that the red river runs through ?	_answer ( NV , _lowest ( V0 , ( _place ( V0 ) , _loc ( V0 , NV ) , _state ( V0 ) , _const ( NV , _riverid ( red ) ) , _traverse ( V0 , V1 ) ) ) )
what is the size of vermont ?	_answer ( NV , ( _size ( NV , V1 ) , _const ( V0 , _stateid ( vermont ) ) ) )
what is the population density of new hampshire ?	_answer ( NV , ( _density ( NV , V1 ) , _const ( V0 , _stateid ( ' new hampshire ' ) ) ) )
how many major cities are in states bordering mississippi ?	_answer ( NV , _count ( NV , ( _major ( V0 ) , _city ( V0 ) , _loc ( V0 , NV ) , _state ( V0 ) , _next_to ( V0 , NV ) , _const ( V0 , _stateid ( mississippi ) ) ) , V3 ) )
which state is the city fort wayne located in ?	_answer ( NV , ( _state ( V0 ) , _city ( NV ) , _const ( V0 , _cityid ( ' fort wayne ' , _ ) ) , _loc ( V0 , V1 ) ) )
what are the capital cities of the states which border idaho ?	_answer ( NV , ( _capital ( V0 ) , _city ( V0 ) , _loc ( V0 , NV ) , _state ( V0 ) , _next_to ( V0 , NV ) , _const ( V0 , _stateid ( idaho ) ) ) )
which state has the smallest area that borders maryland ?	_answer ( NV , _smallest ( NV , ( _state ( V1 ) , _area ( V1 , V0 ) , _next_to ( V1 , NV ) , _const ( V0 , _stateid ( maryland ) ) ) ) )
how high is death valley ?	_answer ( NV , ( _elevation ( NV , V1 ) , _const ( V0 , _placeid ( ' death valley ' ) ) ) )
what is the highest elevation in delaware ?	_answer ( NV , _highest ( V0 , ( _place ( V0 ) , _loc ( V0 , NV ) , _const ( V0 , _stateid ( delaware ) ) ) ) )
what is the longest river that does not run through virginia ?	_answer ( NV , _longest ( V0 , ( _river ( V0 ) , \+ ( _traverse ( V0 , NV ) , _const ( V0 , _stateid ( virginia ) ) ) ) ) )
how many major cities are in states bordering mississippi ?	_answer ( NV , _count ( NV , ( _major ( V0 ) , _city ( V0 ) , _loc ( V0 , NV ) , _state ( V0 ) , _next_to ( V0 , NV ) , _const ( V0 , _stateid ( mississippi ) ) ) , V3 ) )
what rivers run through tennessee ?	_answer ( NV , ( _river ( V0 ) , _traverse ( V0 , NV ) , _const ( V0 , _stateid ( tennessee ) ) ) )
what state is denver located in ?	_answer ( NV , ( _state ( V0 ) , _const ( NV , _cityid ( denver , _ ) ) , _loc ( V0 , V1 ) ) )
what cities in delaware have the highest number of citizens ?	_answer ( NV , _largest ( NV , ( _city ( V1 ) , _loc ( V1 , NV ) , _const ( V0 , _stateid ( delaware ) ) , _population ( V2 , V1 ) ) ) )
what is the population of the largest state that borders hawaii ?	_answer ( NV , ( _population ( NV , V1 ) , _largest ( V0 , ( _state ( V0 ) , _next_to ( V0 , NV ) , _const ( V0 , _stateid ( hawaii ) ) ) ) ) )
what is the largest of the state that the red river runs through ?	_answer ( NV , _largest ( V0 , ( _state ( V0 ) , _const ( NV , _riverid ( red ) ) , _traverse ( V0 , V1 ) ) ) )
what states are next to the utah ?	_answer ( NV , ( _state ( V0 ) , _next_to ( V0 , NV ) , _const ( V0 , _stateid ( utah ) ) ) )
what state is rochester in ?	_answer ( NV , ( _state ( V0 ) , _const ( NV , _cityid ( rochester , _ ) ) , _loc ( V0 , V1 ) ) )
what is the smallest city in alabama ?	_answer ( NV , _smallest ( V0 , ( _city ( V0 ) , _loc ( V0 , NV ) , _const ( V0 , _stateid ( alabama ) ) ) ) )
how many major cities are there in illinois ?	_answer ( NV , _count ( NV , ( _major ( V0 ) , _city ( V0 ) , _loc ( V0 , NV ) , _const ( V0 , _stateid ( illinois ) ) ) , V2 ) )
which states adjoin north dakota ?	_answer ( NV , ( _state ( V0 ) , _next_to ( V0 , NV ) , _const ( V0 , _stateid ( ' north dakota ' ) ) ) )
what are the populations of the states through which the rio grande runs ?	_answer ( NV , ( _population ( NV , V1 ) , _state ( V0 ) , _const ( NV , _riverid ( ' rio grande ' ) ) , _river ( V0 ) , _traverse ( V0 , V1 ) ) )
what rivers do not run through west virginia ?	_answer ( NV , ( _river ( V0 ) , \+ ( _traverse ( V0 , NV ) , _const ( V0 , _stateid ( ' west virginia ' ) ) ) ) )
what is the largest state bordering oregon ?	_answer ( NV , _largest ( V0 , ( _state ( V0 ) , _next_to ( V0 , NV ) , _const ( V0 , _stateid ( oregon ) ) ) ) )
how long is ohio river ?	_answer ( NV , ( _len ( NV , V1 ) , _const ( V0 , _riverid ( ohio ) ) ) )
what is the largest city in wyoming by population ?	_answer ( NV , _largest ( NV , ( _city ( V1 ) , _loc ( V1 , NV ) , _const ( V0 , _stateid ( wyoming ) ) , _population ( V2 , V1 ) ) ) )
how many people are there in montana ?	_answer ( NV , ( _population ( NV , V1 ) , _const ( V0 , _stateid ( montana ) ) ) )
what cities are located in north carolina ?	_answer ( NV , ( _city ( V0 ) , _loc ( V0 , NV ) , _const ( V0 , _stateid ( ' north carolina ' ) ) ) )
what is the longest river in alabama ?	_answer ( NV , _longest ( V0 , ( _river ( V0 ) , _loc ( V0 , NV ) , _const ( V0 , _stateid ( alabama ) ) ) ) )
how many states have a city called sacramento ?	_answer ( NV , _count ( NV , ( _state ( V0 ) , _loc ( NV , V1 ) , _const ( V0 , _cityid ( sacramento , _ ) ) ) , V2 ) )
what are the lakes in states bordering wyoming ?	_answer ( NV , ( _lake ( V0 ) , _loc ( V0 , NV ) , _state ( V0 ) , _next_to ( V0 , NV ) , _const ( V0 , _stateid ( wyoming ) ) ) )
how big is tennessee ?	_answer ( NV , ( _size ( NV , V1 ) , _const ( V0 , _stateid ( tennessee ) ) ) )
what is the major cities in ohio ?	_answer ( NV , ( _major ( V0 ) , _city ( V0 ) , _loc ( V0 , NV ) , _const ( V0 , _stateid ( ohio ) ) ) )
how many people live in flint ?	_answer ( NV , ( _population ( NV , V1 ) , _const ( V0 , _cityid ( flint , _ ) ) ) )
how many states border on the state whose capital is houston ?	_answer ( NV , _count ( NV , ( _state ( V0 ) , _next_to ( V0 , NV ) , _state ( V0 ) , _loc ( NV , V1 ) , _capital ( V0 ) , _const ( V0 , _cityid ( houston , _ ) ) ) , V3 ) )
how many people are in the state of north carolina ?	_answer ( NV , ( _population ( NV , V1 ) , _const ( V0 , _stateid ( ' north carolina ' ) ) ) )
through which states does the ohio river flow ?	_answer ( NV , ( _state ( V0 ) , _const ( NV , _riverid ( ohio ) ) , _traverse ( V0 , V1 ) ) )
what state has the city montgomery ?	_answer ( NV , ( _state ( V0 ) , _loc ( NV , V1 ) , _city ( V0 ) , _const ( V0 , _cityid ( montgomery , _ ) ) ) )
what is the density of oklahoma ?	_answer ( NV , ( _density ( NV , V1 ) , _const ( V0 , _stateid ( oklahoma ) ) ) )
what is the population of denver ga ?	_answer ( NV , ( _population ( NV , V1 ) , _const ( V0 , _cityid ( denver , _ ) ) ) )
name the rivers in california ?	_answer ( NV , ( _river ( V0 ) , _loc ( V0 , NV ) , _const ( V0 , _stateid ( california ) ) ) )
how many cities does north dakota have ?	_answer ( NV , _count ( NV , ( _city ( V0 ) , _const ( NV , _stateid ( ' north dakota ' ) ) , _loc ( V1 , V0 ) ) , V2 ) )
of the states washed by the rio grande river which has the lowest point ?	_answer ( NV , _lowest ( NV , ( _state ( V1 ) , _traverse ( NV , V2 ) , _const ( V0 , _riverid ( ' rio grande ' ) ) , _loc ( V1 , V2 ) , _place ( V1 ) ) ) )
what river runs through alabama ?	_answer ( NV , ( _river ( V0 ) , _traverse ( V0 , NV ) , _const ( V0 , _stateid ( alabama ) ) ) )
how many rivers are found in illinois ?	_answer ( NV , _count ( NV , ( _river ( V0 ) , _loc ( V0 , NV ) , _const ( V0 , _stateid ( illinois ) ) ) , V2 ) )
where is the lowest spot in wisconsin ?	_answer ( NV , _lowest ( V0 , ( _place ( V0 ) , _loc ( V0 , NV ) , _const ( V0 , _stateid ( wisconsin ) ) ) ) )
what are the populations of the states through which the rio grande river run ?	_answer ( NV , ( _population ( NV , V1 ) , _state ( V0 ) , _const ( NV , _riverid ( ' rio grande ' ) ) , _river ( V0 ) , _traverse ( V0 , V1 ) ) )
what state has the city san francisco ?	_answer ( NV , ( _state ( V0 ) , _loc ( NV , V1 ) , _city ( V0 ) , _const ( V0 , _cityid ( ' san francisco ' , _ ) ) ) )
what are the populations of the states through which the red river runs ?	_answer ( NV , ( _population ( NV , V1 ) , _state ( V0 ) , _const ( NV , _riverid ( red ) ) , _river ( V0 ) , _traverse ( V0 , V1 ) ) )
how many rivers in delaware ?	_answer ( NV , _count ( NV , ( _river ( V0 ) , _loc ( V0 , NV ) , _const ( V0 , _stateid ( delaware ) ) ) , V2 ) )
what is the population in rochester ?	_answer ( NV , ( _population ( NV , V1 ) , _const ( V0 , _cityid ( rochester , _ ) ) ) )
in which state is scotts valley ?	_answer ( NV , ( _loc ( NV , V1 ) , _state ( V1 ) , _const ( V0 , _cityid ( ' scotts valley ' , _ ) ) ) )
what kentucky city has the largest population ?	_answer ( NV , _largest ( NV , ( _const ( NV , _stateid ( kentucky ) ) , _city ( V2 ) , _loc ( V2 , V0 ) , _population ( V2 , V1 ) ) ) )
which states does the mississippi run through ?	_answer ( NV , ( _state ( V0 ) , _const ( NV , _riverid ( mississippi ) ) , _traverse ( V0 , V1 ) ) )
how many states border indiana ?	_answer ( NV , _count ( NV , ( _state ( V0 ) , _next_to ( V0 , NV ) , _const ( V0 , _stateid ( indiana ) ) ) , V2 ) )
what river flows through delaware ?	_answer ( NV , ( _river ( V0 ) , _traverse ( V0 , NV ) , _const ( V0 , _stateid ( delaware ) ) ) )
what states border states that border states that border states that border idaho ?	_answer ( NV , ( _state ( V0 ) , _next_to ( V0 , NV ) , _state ( V0 ) , _next_to ( V0 , NV ) , _state ( V0 ) , _next_to ( V0 , NV ) , _state ( V0 ) , _next_to ( V0 , NV ) , _const ( V0 , _stateid ( idaho ) ) ) )
how many major cities are there in alaska ?	_answer ( NV , _count ( NV , ( _major ( V0 ) , _city ( V0 ) , _loc ( V0 , NV ) , _const ( V0 , _stateid ( alaska ) ) ) , V2 ) )
how many states border maine ?	_answer ( NV , _count ( NV , ( _state ( V0 ) , _next_to ( V0 , NV ) , _const ( V0 , _stateid ( maine ) ) ) , V2 ) )
which states border states through which the missouri river traverses ?	_answer ( NV , ( _state ( V0 ) , _next_to ( V0 , NV ) , _state ( V0 ) , _const ( NV , _riverid ( missouri ) ) , _traverse ( V0 , V1 ) ) )
which state is the city dover located in ?	_answer ( NV , ( _state ( V0 ) , _city ( NV ) , _const ( V0 , _cityid ( dover , _ ) ) , _loc ( V0 , V1 ) ) )
what state borders utah ?	_answer ( NV , ( _state ( V0 ) , _next_to ( V0 , NV ) , _const ( V0 , _stateid ( utah ) ) ) )
