what states border states that border states that border states that border washington ?	_answer ( NV , ( _state ( V0 ) , _next_to ( V0 , NV ) , _state ( V0 ) , _next_to ( V0 , NV ) , _state ( V0 ) , _next_to ( V0 , NV ) , _state ( V0 ) , _next_to ( V0 , NV ) , _const ( V0 , _stateid ( washington ) ) ) )
what is the highest elevation in idaho ?	_answer ( NV , _highest ( V0 , ( _place ( V0 ) , _loc ( V0 , NV ) , _const ( V0 , _stateid ( idaho ) ) ) ) )
what are the rivers in the state of nebraska ?	_answer ( NV , ( _river ( V0 ) , _loc ( V0 , NV ) , _state ( V0 ) , _const ( V0 , _stateid ( nebraska ) ) ) )
how many citizens in idaho ?	_answer ( NV , ( _population ( NV , V1 ) , _const ( V0 , _stateid ( idaho ) ) ) )
what idaho city has the largest population ?	_answer ( NV , _largest ( NV , ( _const ( NV , _stateid ( idaho ) ) , _city ( V2 ) , _loc ( V2 , V0 ) , _population ( V2 , V1 ) ) ) )
what are the major cities of south carolina ?	_answer ( NV , ( _major ( V0 ) , _city ( V0 ) , _loc ( V0 , NV ) , _const ( V0 , _stateid ( ' south carolina ' ) ) ) )
where is iowa ?	_answer ( NV , ( _loc ( NV , V1 ) , _const ( V0 , _stateid ( iowa ) ) ) )
what is the shortest river in massachusetts ?	_answer ( NV , _shortest ( V0 , ( _river ( V0 ) , _loc ( V0 , NV ) , _const ( V0 , _stateid ( massachusetts ) ) ) ) )
how many states does the red river run through ?	_answer ( NV , _count ( NV , ( _state ( V0 ) , _const ( NV , _riverid ( red ) ) , _traverse ( V0 , V1 ) ) , V2 ) )
what is the highest point in the state with capital riverside ?	_answer ( NV , _highest ( V0 , ( _place ( V0 ) , _loc ( V0 , NV ) , _state ( V0 ) , _loc ( NV , V1 ) , _capital ( V0 ) , _const ( V0 , _cityid ( riverside , _ ) ) ) ) )
what are the major cities of alabama ?	_answer ( NV , ( _major ( V0 ) , _city ( V0 ) , _loc ( V0 , NV ) , _const ( V0 , _stateid ( alabama ) ) ) )
which states have a major city named houston ?	_answer ( NV , ( _state ( V0 ) , _loc ( NV , V1 ) , _major ( V0 ) , _city ( V0 ) , _const ( V0 , _cityid ( houston , _ ) ) ) )
number of citizens in rochester ?	_answer ( NV , ( _population ( NV , V1 ) , _const ( V0 , _cityid ( rochester , _ ) ) ) )
which states border states through which the mississippi river traverses ?	_answer ( NV , ( _state ( V0 ) , _next_to ( V0 , NV ) , _state ( V0 ) , _const ( NV , _riverid ( mississippi ) ) , _traverse ( V0 , V1 ) ) )
what are the lakes in states bordering alaska ?	_answer ( NV , ( _lake ( V0 ) , _loc ( V0 , NV ) , _state ( V0 ) , _next_to ( V0 , NV ) , _const ( V0 , _stateid ( alaska ) ) ) )
how many citizens in new orleans ?	_answer ( NV , ( _population ( NV , V1 ) , _const ( V0 , _cityid ( ' new orleans ' , _ ) ) ) )
what major rivers run through minnesota ?	_answer ( NV , ( _major ( V0 ) , _river ( V0 ) , _traverse ( V0 , NV ) , _const ( V0 , _stateid ( minnesota ) ) ) )
how many major cities are there in south dakota ?	_answer ( NV , _count ( NV , ( _major ( V0 ) , _city ( V0 ) , _loc ( V0 , NV ) , _const ( V0 , _stateid ( ' south dakota ' ) ) ) , V2 ) )
what is the number of neighboring states for florida ?	_answer ( NV , _count ( NV , ( _state ( V0 ) , _next_to ( V0 , NV ) , _const ( V0 , _stateid ( florida ) ) ) , V2 ) )
what states have rivers named rio grande river ?	_answer ( NV , ( _state ( V0 ) , _loc ( NV , V1 ) , _const ( V0 , _riverid ( ' rio grande ' ) ) ) )
what river flows through north dakota ?	_answer ( NV , ( _river ( V0 ) , _traverse ( V0 , NV ) , _const ( V0 , _stateid ( ' north dakota ' ) ) ) )
what are the states that the rio grande run through ?	_answer ( NV , ( _state ( V0 ) , _const ( NV , _riverid ( ' rio grande ' ) ) , _traverse ( V0 , V1 ) ) )
how many states border oregon ?	_answer ( NV , _count ( NV , ( _state ( V0 ) , _next_to ( V0 , NV ) , _const ( V0 , _stateid ( oregon ) ) ) , V2 ) )
what rivers flow through states that minnesota borders ?	_answer ( NV , ( _river ( V0 ) , _traverse ( V0 , NV ) , _state ( V0 ) , _const ( NV , _stateid ( minnesota ) ) , _next_to ( V0 , V1 ) ) )
how many people are in the state of oklahoma ?	_answer ( NV , ( _population ( NV , V1 ) , _const ( V0 , _stateid ( oklahoma ) ) ) )
what is the major cities in arizona ?	_answer ( NV , ( _major ( V0 ) , _city ( V0 ) , _loc ( V0 , NV ) , _const ( V0 , _stateid ( arizona ) ) ) )
can you tell me the capital of wisconsin ?	_answer ( NV , ( _capital ( V0 ) , _loc ( V0 , NV ) , _const ( V0 , _stateid ( wisconsin ) ) ) )
how many major cities are in states bordering new hampshire ?	_answer ( NV , _count ( NV , ( _major ( V0 ) , _city ( V0 ) , _loc ( V0 , NV ) , _state ( V0 ) , _next_to ( V0 , NV ) , _const ( V0 , _stateid ( ' new hampshire ' ) ) ) , V3 ) )
how many major cities are in states bordering oregon ?	_answer ( NV , _count ( NV , ( _major ( V0 ) , _city ( V0 ) , _loc ( V0 , NV ) , _state ( V0 ) , _next_to ( V0 , NV ) , _const ( V0 , _stateid ( oregon ) ) ) , V3 ) )
how long is the potomac ?	_answer ( NV , ( _len ( NV , V1 ) , _const ( V0 , _riverid ( potomac ) ) , _river ( V0 ) ) )
give me the cities in california ?	_answer ( NV , ( _city ( V0 ) , _loc ( V0 , NV ) , _const ( V0 , _stateid ( california ) ) ) )
how long is the mississippi ?	_answer ( NV , ( _len ( NV , V1 ) , _const ( V0 , _riverid ( mississippi ) ) , _river ( V0 ) ) )
what is the population of montgomery ga ?	_answer ( NV , ( _population ( NV , V1 ) , _const ( V0 , _cityid ( montgomery , _ ) ) ) )
what states does the red river run through ?	_answer ( NV , ( _state ( V0 ) , _const ( NV , _riverid ( red ) ) , _traverse ( V0 , V1 ) ) )
what is the largest state that borders indiana ?	_answer ( NV , _largest ( V0 , ( _state ( V0 ) , _next_to ( V0 , NV ) , _const ( V0 , _stateid ( indiana ) ) ) ) )
how many major cities are in kansas ?	_answer ( NV , _count ( NV , ( _major ( V0 ) , _city ( V0 ) , _loc ( V0 , NV ) , _const ( V0 , _stateid ( kansas ) ) ) , V2 ) )
what are the highest points of states surrounding massachusetts ?	_answer ( NV , _highest ( V0 , ( _place ( V0 ) , _loc ( V0 , NV ) , _state ( V0 ) , _next_to ( V0 , NV ) , _const ( V0 , _stateid ( massachusetts ) ) ) ) )
what are the populations of the states through which the rio grande river run ?	_answer ( NV , ( _population ( NV , V1 ) , _state ( V0 ) , _const ( NV , _riverid ( ' rio grande ' ) ) , _river ( V0 ) , _traverse ( V0 , V1 ) ) )
how many people stay in new york ?	_answer ( NV , ( _population ( NV , V1 ) , _const ( V0 , _stateid ( ' new york ' ) ) ) )
what is the capital of the state that borders the state that borders arkansas ?	_answer ( NV , ( _capital ( V0 ) , _loc ( V0 , NV ) , _state ( V0 ) , _next_to ( V0 , NV ) , _state ( V0 ) , _next_to ( V0 , NV ) , _const ( V0 , _stateid ( arkansas ) ) ) )
what states have cities named san diego ?	_answer ( NV , ( _state ( V0 ) , _loc ( NV , V1 ) , _city ( V0 ) , _const ( V0 , _cityid ( ' san diego ' , _ ) ) ) )
how many states have cities named denver ?	_answer ( NV , _count ( NV , ( _state ( V0 ) , _loc ( NV , V1 ) , _city ( V0 ) , _const ( V0 , _cityid ( denver , _ ) ) ) , V2 ) )
what is the highest point in the state with the capital denver ?	_answer ( NV , _highest ( V0 , ( _place ( V0 ) , _loc ( V0 , NV ) , _state ( V0 ) , _loc ( NV , V1 ) , _capital ( V0 ) , _const ( V0 , _cityid ( denver , _ ) ) ) ) )
which state borders montana ?	_answer ( NV , ( _state ( V0 ) , _next_to ( V0 , NV ) , _const ( V0 , _stateid ( montana ) ) ) )
what are the lakes in states bordering south dakota ?	_answer ( NV , ( _lake ( V0 ) , _loc ( V0 , NV ) , _state ( V0 ) , _next_to ( V0 , NV ) , _const ( V0 , _stateid ( ' south dakota ' ) ) ) )
which states adjoin minnesota ?	_answer ( NV , ( _state ( V0 ) , _next_to ( V0 , NV ) , _const ( V0 , _stateid ( minnesota ) ) ) )
how many rivers are called rio grande ?	_answer ( NV , _count ( NV , ( _river ( V0 ) , _const ( V0 , _riverid ( ' rio grande ' ) ) ) , V1 ) )
what mountains are in iowa ?	_answer ( NV , ( _mountain ( V0 ) , _loc ( V0 , NV ) , _const ( V0 , _stateid ( iowa ) ) ) )
which is the lowest point of the states that the colorado runs through ?	_answer ( NV , _lowest ( V0 , ( _place ( V0 ) , _loc ( V0 , NV ) , _state ( V0 ) , _const ( NV , _riverid ( colorado ) ) , _traverse ( V0 , V1 ) ) ) )
which states have points that are higher than the highest point in rhode island ?	_answer ( NV , ( _state ( V0 ) , _place ( NV ) , _loc ( V0 , V1 ) , _higher ( V0 , NV ) , _highest ( V0 , ( _place ( V0 ) , _loc ( V0 , NV ) , _const ( V0 , _stateid ( ' rhode island ' ) ) ) ) ) )
what is the area of the state with the capital seattle ?	_answer ( NV , ( _area ( NV , V1 ) , _state ( V0 ) , _loc ( NV , V1 ) , _capital ( V0 ) , _const ( V0 , _cityid ( seattle , _ ) ) ) )
what rivers do not run through maine ?	_answer ( NV , ( _river ( V0 ) , \+ ( _traverse ( V0 , NV ) , _const ( V0 , _stateid ( maine ) ) ) ) )
which states have points that are higher than the highest point in virginia ?	_answer ( NV , ( _state ( V0 ) , _place ( NV ) , _loc ( V0 , V1 ) , _higher ( V0 , NV ) , _highest ( V0 , ( _place ( V0 ) , _loc ( V0 , NV ) , _const ( V0 , _stateid ( virginia ) ) ) ) ) )
which states border mississippi ?	_answer ( NV , ( _state ( V0 ) , _next_to ( V0 , NV ) , _const ( V0 , _stateid ( mississippi ) ) ) )
what states border states that border states that border states that border mississippi ?	_answer ( NV , ( _state ( V0 ) , _next_to ( V0 , NV ) , _state ( V0 ) , _next_to ( V0 , NV ) , _state ( V0 ) , _next_to ( V0 , NV ) , _state ( V0 ) , _next_to ( V0 , NV ) , _const ( V0 , _stateid ( mississippi ) ) ) )
how high is the highest point of georgia ?	_answer ( NV , ( _elevation ( NV , V1 ) , _highest ( V0 , ( _place ( V0 ) , _loc ( V0 , NV ) , _const ( V0 , _stateid ( georgia ) ) ) ) ) )
how high is the highest point in idaho ?	_answer ( NV , ( _elevation ( NV , V1 ) , _highest ( V0 , ( _place ( V0 ) , _loc ( V0 , NV ) , _const ( V0 , _stateid ( idaho ) ) ) ) ) )
what is the city in california with the largest population ?	_answer ( NV , _largest ( NV , ( _city ( V1 ) , _loc ( V1 , NV ) , _const ( V0 , _stateid ( california ) ) , _population ( V2 , V1 ) ) ) )
where is the lowest spot in utah ?	_answer ( NV , _lowest ( V0 , ( _place ( V0 ) , _loc ( V0 , NV ) , _const ( V0 , _stateid ( utah ) ) ) ) )
what is the city in colorado with the largest population ?	_answer ( NV , _largest ( NV , ( _city ( V1 ) , _loc ( V1 , NV ) , _const ( V0 , _stateid ( colorado ) ) , _population ( V2 , V1 ) ) ) )
how many citizens in san francisco ?	_answer ( NV , ( _population ( NV , V1 ) , _const ( V0 , _cityid ( ' san francisco ' , _ ) ) ) )
show major cities in tennessee ?	_answer ( NV , ( _major ( V0 ) , _city ( V0 ) , _loc ( V0 , NV ) , _const ( V0 , _stateid ( tennessee ) ) ) )
how many states border tennessee and border georgia ?	_answer ( NV , _count ( NV , ( _state ( V0 ) , _next_to ( V0 , NV ) , _const ( V0 , _stateid ( tennessee ) ) , _next_to ( V1 , NV ) , _const ( V0 , _stateid ( georgia ) ) ) , V3 ) )
what are the populations of all the major cities in nevada ?	_answer ( NV , ( _population ( NV , V1 ) , _major ( V0 ) , _city ( V0 ) , _loc ( V0 , NV ) , _const ( V0 , _stateid ( nevada ) ) ) )
how many cities are in georgia ?	_answer ( NV , _count ( NV , ( _city ( V0 ) , _loc ( V0 , NV ) , _const ( V0 , _stateid ( georgia ) ) ) , V2 ) )
what are the names of the major cities in florida ?	_answer ( NV , ( _major ( V0 ) , _city ( V0 ) , _loc ( V0 , NV ) , _const ( V0 , _stateid ( florida ) ) ) )
what is the density of utah ?	_answer ( NV , ( _density ( NV , V1 ) , _const ( V0 , _stateid ( utah ) ) ) )
what georgia city has the largest population ?	_answer ( NV , _largest ( NV , ( _const ( NV , _stateid ( georgia ) ) , _city ( V2 ) , _loc ( V2 , V0 ) , _population ( V2 , V1 ) ) ) )
what rivers flow through ohio ?	_answer ( NV , ( _river ( V0 ) , _traverse ( V0 , NV ) , _const ( V0 , _stateid ( ohio ) ) ) )
name the major lakes in north carolina ?	_answer ( NV , ( _major ( V0 ) , _lake ( V0 ) , _loc ( V0 , NV ) , _const ( V0 , _stateid ( ' north carolina ' ) ) ) )
what is the elevation of guadalupe peak ?	_answer ( NV , ( _elevation ( NV , V1 ) , _const ( V0 , _placeid ( ' guadalupe peak ' ) ) ) )
what are the major cities of illinois ?	_answer ( NV , ( _major ( V0 ) , _city ( V0 ) , _loc ( V0 , NV ) , _const ( V0 , _stateid ( illinois ) ) ) )
show major cities in nevada ?	_answer ( NV , ( _major ( V0 ) , _city ( V0 ) , _loc ( V0 , NV ) , _const ( V0 , _stateid ( nevada ) ) ) )
what is the population of the largest state that borders virginia ?	_answer ( NV , ( _population ( NV , V1 ) , _largest ( V0 , ( _state ( V0 ) , _next_to ( V0 , NV ) , _const ( V0 , _stateid ( virginia ) ) ) ) ) )
which state border alabama ?	_answer ( NV , ( _state ( V0 ) , _next_to ( V0 , NV ) , _const ( V0 , _stateid ( alabama ) ) ) )
how long is the red ?	_answer ( NV , ( _len ( NV , V1 ) , _const ( V0 , _riverid ( red ) ) , _river ( V0 ) ) )
what is the number of neighboring states for illinois ?	_answer ( NV , _count ( NV , ( _state ( V0 ) , _next_to ( V0 , NV ) , _const ( V0 , _stateid ( illinois ) ) ) , V2 ) )
what is the lowest point of new hampshire ?	_answer ( NV , _lowest ( V0 , ( _place ( V0 ) , _loc ( V0 , NV ) , _const ( V0 , _stateid ( ' new hampshire ' ) ) ) ) )
what is the largest city in states that border pennsylvania ?	_answer ( NV , _largest ( V0 , ( _city ( V0 ) , _loc ( V0 , NV ) , _state ( V0 ) , _next_to ( V0 , NV ) , _const ( V0 , _stateid ( pennsylvania ) ) ) ) )
what is the longest river that does not run through nevada ?	_answer ( NV , _longest ( V0 , ( _river ( V0 ) , \+ ( _traverse ( V0 , NV ) , _const ( V0 , _stateid ( nevada ) ) ) ) ) )
of the states washed by the colorado which has the lowest point ?	_answer ( NV , _lowest ( NV , ( _state ( V1 ) , _traverse ( NV , V2 ) , _const ( V0 , _riverid ( colorado ) ) , _loc ( V1 , V2 ) , _place ( V1 ) ) ) )
what are the highest points of states surrounding georgia ?	_answer ( NV , _highest ( V0 , ( _place ( V0 ) , _loc ( V0 , NV ) , _state ( V0 ) , _next_to ( V0 , NV ) , _const ( V0 , _stateid ( georgia ) ) ) ) )
what is the largest city in a state that borders idaho ?	_answer ( NV , _largest ( V0 , ( _city ( V0 ) , _loc ( V0 , NV ) , _state ( V0 ) , _next_to ( V0 , NV ) , _const ( V0 , _stateid ( idaho ) ) ) ) )
what are the rivers of massachusetts ?	_answer ( NV , ( _river ( V0 ) , _loc ( V0 , NV ) , _const ( V0 , _stateid ( massachusetts ) ) ) )
what is the density of florida ?	_answer ( NV , ( _density ( NV , V1 ) , _const ( V0 , _stateid ( florida ) ) ) )
what is the largest state bordering washington ?	_answer ( NV , _largest ( V0 , ( _state ( V0 ) , _next_to ( V0 , NV ) , _const ( V0 , _stateid ( washington ) ) ) ) )
how long is the potomac in miles ?	_answer ( NV , ( _len ( NV , V1 ) , _const ( V0 , _riverid ( potomac ) ) , _river ( V0 ) ) )
what state borders the least states excluding maine and excluding wisconsin ?	_answer ( NV , _fewest ( V0 , NV , ( _state ( V1 ) , _next_to ( V1 , V0 ) , _state ( V0 ) , \+ _const ( V1 , _stateid ( maine ) ) , \+ _const ( V1 , _stateid ( wisconsin ) ) ) ) )
how big is rhode island ?	_answer ( NV , ( _size ( NV , V1 ) , _const ( V0 , _stateid ( ' rhode island ' ) ) ) )
what is the longest river flowing through west virginia ?	_answer ( NV , _longest ( V0 , ( _river ( V0 ) , _traverse ( V0 , NV ) , _const ( V0 , _stateid ( ' west virginia ' ) ) ) ) )
how many states border rhode island ?	_answer ( NV , _count ( NV , ( _state ( V0 ) , _next_to ( V0 , NV ) , _const ( V0 , _stateid ( ' rhode island ' ) ) ) , V2 ) )
how many people live in north carolina ?	_answer ( NV , ( _population ( NV , V1 ) , _const ( V0 , _stateid ( ' north carolina ' ) ) ) )
what are the populations of the states through which the missouri river runs ?	_answer ( NV , ( _population ( NV , V1 ) , _state ( V0 ) , _const ( NV , _riverid ( missouri ) ) , _traverse ( V0 , V1 ) ) )
what is the capital of the state south dakota ?	_answer ( NV , ( _capital ( V0 ) , _loc ( V0 , NV ) , _state ( V0 ) , _const ( V0 , _stateid ( ' south dakota ' ) ) ) )
where is the highest point in south carolina ?	_answer ( NV , _highest ( V0 , ( _place ( V0 ) , _loc ( V0 , NV ) , _const ( V0 , _stateid ( ' south carolina ' ) ) ) ) )
what are the populations of the states through which the rio grande river run ?	_answer ( NV , ( _population ( NV , V1 ) , _state ( V0 ) , _const ( NV , _riverid ( ' rio grande ' ) ) , _river ( V0 ) , _traverse ( V0 , V1 ) ) )
which states have a major city named springfield ?	_answer ( NV , ( _state ( V0 ) , _loc ( NV , V1 ) , _major ( V0 ) , _city ( V0 ) , _const ( V0 , _cityid ( springfield , _ ) ) ) )
what cities in alaska have the highest number of citizens ?	_answer ( NV , _largest ( NV , ( _city ( V1 ) , _loc ( V1 , NV ) , _const ( V0 , _stateid ( alaska ) ) , _population ( V2 , V1 ) ) ) )
which is the lowest point of the states that the ohio river runs through ?	_answer ( NV , _lowest ( V0 , ( _place ( V0 ) , _loc ( V0 , NV ) , _state ( V0 ) , _const ( NV , _riverid ( ohio ) ) , _traverse ( V0 , V1 ) ) ) )
how long is missouri river ?	_answer ( NV , ( _len ( NV , V1 ) , _const ( V0 , _riverid ( missouri ) ) ) )
what are the highest points of states surrounding oklahoma ?	_answer ( NV , _highest ( V0 , ( _place ( V0 ) , _loc ( V0 , NV ) , _state ( V0 ) , _next_to ( V0 , NV ) , _const ( V0 , _stateid ( oklahoma ) ) ) ) )
give me the cities in indiana ?	_answer ( NV , ( _city ( V0 ) , _loc ( V0 , NV ) , _const ( V0 , _stateid ( indiana ) ) ) )
what states are next to michigan ?	_answer ( NV , ( _state ( V0 ) , _next_to ( V0 , NV ) , _const ( V0 , _stateid ( michigan ) ) ) )
how high is the highest point of colorado ?	_answer ( NV , ( _elevation ( NV , V1 ) , _highest ( V0 , ( _place ( V0 ) , _loc ( V0 , NV ) , _const ( V0 , _stateid ( colorado ) ) ) ) ) )
how many people stay in kentucky ?	_answer ( NV , ( _population ( NV , V1 ) , _const ( V0 , _stateid ( kentucky ) ) ) )
how high is mount mckinley ?	_answer ( NV , ( _elevation ( NV , V1 ) , _const ( V0 , _placeid ( ' mount mckinley ' ) ) ) )
what is the shortest river in maryland ?	_answer ( NV , _shortest ( V0 , ( _river ( V0 ) , _loc ( V0 , NV ) , _const ( V0 , _stateid ( maryland ) ) ) ) )
name the major lakes in north carolina ?	_answer ( NV , ( _major ( V0 ) , _lake ( V0 ) , _loc ( V0 , NV ) , _const ( V0 , _stateid ( ' north carolina ' ) ) ) )
how many people live in the capital of delaware ?	_answer ( NV , ( _population ( NV , V1 ) , _capital ( V0 ) , _loc ( V0 , NV ) , _const ( V0 , _stateid ( delaware ) ) ) )
states bordering maine ?	_answer ( NV , ( _state ( V0 ) , _next_to ( V0 , NV ) , _const ( V0 , _stateid ( maine ) ) ) )
which rivers flow through montana ?	_answer ( NV , ( _river ( V0 ) , _traverse ( V0 , NV ) , _const ( V0 , _stateid ( montana ) ) ) )
what is the capital of wisconsin ?	_answer ( NV , ( _capital ( V0 ) , _loc ( V0 , NV ) , _const ( V0 , _stateid ( wisconsin ) ) ) )
what state has the city des moines ?	_answer ( NV , ( _state ( V0 ) , _loc ( NV , V1 ) , _city ( V0 ) , _const ( V0 , _cityid ( ' des moines ' , _ ) ) ) )
how many states have cities or towns named riverside ?	_answer ( NV , _count ( NV , ( _state ( V0 ) , _loc ( NV , V1 ) , _city ( V0 ) , _const ( V0 , _cityid ( riverside , _ ) ) ) , V2 ) )
what states are next to the oregon ?	_answer ( NV , ( _state ( V0 ) , _next_to ( V0 , NV ) , _const ( V0 , _stateid ( oregon ) ) ) )
what is the size of the capital of georgia ?	_answer ( NV , ( _size ( NV , V1 ) , _capital ( V0 ) , _loc ( V0 , NV ) , _const ( V0 , _stateid ( georgia ) ) ) )
what is the biggest river in washington ?	_answer ( NV , _largest ( V0 , ( _river ( V0 ) , _loc ( V0 , NV ) , _const ( V0 , _stateid ( washington ) ) ) ) )
what is the capital of the state west virginia ?	_answer ( NV , ( _capital ( V0 ) , _loc ( V0 , NV ) , _state ( V0 ) , _const ( V0 , _stateid ( ' west virginia ' ) ) ) )
what is the largest city in a state that borders georgia ?	_answer ( NV , _largest ( V0 , ( _city ( V0 ) , _loc ( V0 , NV ) , _state ( V0 ) , _next_to ( V0 , NV ) , _const ( V0 , _stateid ( georgia ) ) ) ) )
what states does the red river run through ?	_answer ( NV , ( _state ( V0 ) , _const ( NV , _riverid ( red ) ) , _traverse ( V0 , V1 ) ) )
how high is the highest point of georgia ?	_answer ( NV , ( _elevation ( NV , V1 ) , _highest ( V0 , ( _place ( V0 ) , _loc ( V0 , NV ) , _const ( V0 , _stateid ( georgia ) ) ) ) ) )
what is the largest city of georgia ?	_answer ( NV , _largest ( V0 , ( _city ( V0 ) , _loc ( V0 , NV ) , _const ( V0 , _stateid ( georgia ) ) ) ) )
what is the most populated state bordering washington ?	_answer ( NV , _largest ( NV , ( _population ( V1 , V0 ) , _state ( V1 ) , _next_to ( V1 , NV ) , _const ( V0 , _stateid ( washington ) ) ) ) )
what is the capital of the state that borders the state that borders nebraska ?	_answer ( NV , ( _capital ( V0 ) , _loc ( V0 , NV ) , _state ( V0 ) , _next_to ( V0 , NV ) , _state ( V0 ) , _next_to ( V0 , NV ) , _const ( V0 , _stateid ( nebraska ) ) ) )
what rivers run through georgia ?	_answer ( NV , ( _river ( V0 ) , _traverse ( V0 , NV ) , _const ( V0 , _stateid ( georgia ) ) ) )
what state that borders virginia has the highest population ?	_answer ( NV , _largest ( NV , ( _state ( V1 ) , _next_to ( V1 , NV ) , _const ( V0 , _stateid ( virginia ) ) , _population ( V2 , V1 ) ) ) )
where is missouri ?	_answer ( NV , ( _loc ( NV , V1 ) , _const ( V0 , _stateid ( missouri ) ) ) )
how long is the colorado ?	_answer ( NV , ( _len ( NV , V1 ) , _const ( V0 , _riverid ( colorado ) ) ) )
what rivers flow through states that new mexico borders ?	_answer ( NV , ( _river ( V0 ) , _traverse ( V0 , NV ) , _state ( V0 ) , _const ( NV , _stateid ( ' new mexico ' ) ) , _next_to ( V0 , V1 ) ) )
name the rivers in iowa ?	_answer ( NV , ( _river ( V0 ) , _loc ( V0 , NV ) , _const ( V0 , _stateid ( iowa ) ) ) )
how many rivers are there in virginia ?	_answer ( NV , _count ( NV , ( _river ( V0 ) , _loc ( V0 , NV ) , _const ( V0 , _stateid ( virginia ) ) ) , V2 ) )
what state which the rio grande runs through has the largest population ?	_answer ( NV , _largest ( NV , ( _state ( V1 ) , _const ( NV , _riverid ( ' rio grande ' ) ) , _traverse ( V0 , V2 ) , _population ( V2 , V1 ) ) ) )
how many major cities are in states bordering rhode island ?	_answer ( NV , _count ( NV , ( _major ( V0 ) , _city ( V0 ) , _loc ( V0 , NV ) , _state ( V0 ) , _next_to ( V0 , NV ) , _const ( V0 , _stateid ( ' rhode island ' ) ) ) , V3 ) )
how long is the mississippi river ?	_answer ( NV , ( _len ( NV , V1 ) , _const ( V0 , _riverid ( mississippi ) ) ) )
what rivers flow through texas ?	_answer ( NV , ( _river ( V0 ) , _traverse ( V0 , NV ) , _const ( V0 , _stateid ( texas ) ) ) )
what is the area of michigan in square kilometers ?	_answer ( NV , ( _area ( NV , V1 ) , _const ( V0 , _stateid ( michigan ) ) ) )
what is the highest mountain in washington ?	_answer ( NV , _highest ( V0 , ( _mountain ( V0 ) , _loc ( V0 , NV ) , _const ( V0 , _stateid ( washington ) ) ) ) )
which states have points higher than the highest point in new mexico ?	_answer ( NV , ( _state ( V0 ) , _loc ( NV , V1 ) , _place ( V0 ) , _higher ( V0 , NV ) , _highest ( V0 , ( _place ( V0 ) , _loc ( V0 , NV ) , _const ( V0 , _stateid ( ' new mexico ' ) ) ) ) ) )
what are the biggest rivers in new hampshire ?	_answer ( NV , _longest ( V0 , ( _river ( V0 ) , _loc ( V0 , NV ) , _const ( V0 , _stateid ( ' new hampshire ' ) ) ) ) )
what is capital of south carolina ?	_answer ( NV , ( _capital ( V0 ) , _loc ( V0 , NV ) , _const ( V0 , _stateid ( ' south carolina ' ) ) ) )
what states are next to nebraska ?	_answer ( NV , ( _state ( V0 ) , _next_to ( V0 , NV ) , _const ( V0 , _stateid ( nebraska ) ) ) )
how many states does montana border ?	_answer ( NV , _count ( NV , ( _state ( V0 ) , _const ( NV , _stateid ( montana ) ) , _next_to ( V0 , V1 ) ) , V2 ) )
what is the area of rochester ?	_answer ( NV , ( _area ( NV , V1 ) , _const ( V0 , _cityid ( rochester , _ ) ) ) )
what state borders colorado ?	_answer ( NV , ( _state ( V0 ) , _next_to ( V0 , NV ) , _const ( V0 , _stateid ( colorado ) ) ) )
where is north carolina ?	_answer ( NV , ( _loc ( NV , V1 ) , _const ( V0 , _stateid ( ' north carolina ' ) ) ) )
which state border tennessee ?	_answer ( NV , ( _state ( V0 ) , _next_to ( V0 , NV ) , _const ( V0 , _stateid ( tennessee ) ) ) )
how many states does the potomac flow through ?	_answer ( NV , _count ( NV , ( _state ( V0 ) , _const ( NV , _riverid ( potomac ) ) , _river ( V0 ) , _traverse ( V0 , V1 ) ) , V2 ) )
what states does the missouri river go through ?	_answer ( NV , ( _state ( V0 ) , _const ( NV , _riverid ( missouri ) ) , _river ( V0 ) , _traverse ( V0 , V1 ) ) )
which states do colorado flow through ?	_answer ( NV , ( _state ( V0 ) , _const ( NV , _riverid ( colorado ) ) , _river ( V0 ) , _traverse ( V0 , V1 ) ) )
what states border states that border new mexico ?	_answer ( NV , ( _state ( V0 ) , _next_to ( V0 , NV ) , _state ( V0 ) , _next_to ( V0 , NV ) , _const ( V0 , _stateid ( ' new mexico ' ) ) ) )
give me the lakes in vermont ?	_answer ( NV , ( _lake ( V0 ) , _loc ( V0 , NV ) , _const ( V0 , _stateid ( vermont ) ) ) )
what is the capital of the state nebraska ?	_answer ( NV , ( _capital ( V0 ) , _loc ( V0 , NV ) , _state ( V0 ) , _const ( V0 , _stateid ( nebraska ) ) ) )
how many people live in the smallest state bordering oklahoma ?	_answer ( NV , ( _population ( NV , V1 ) , _smallest ( V0 , ( _state ( V0 ) , _next_to ( V0 , NV ) , _const ( V0 , _stateid ( oklahoma ) ) ) ) ) )
how many states have a city called springfield ?	_answer ( NV , _count ( NV , ( _state ( V0 ) , _loc ( NV , V1 ) , _const ( V0 , _cityid ( springfield , _ ) ) ) , V2 ) )
what is the largest city in hawaii by population ?	_answer ( NV , _largest ( NV , ( _city ( V1 ) , _loc ( V1 , NV ) , _const ( V0 , _stateid ( hawaii ) ) , _population ( V2 , V1 ) ) ) )
