what rivers run through the states that border the state with the capital dover ?	_answer ( NV , ( _river ( V0 ) , _traverse ( V0 , NV ) , _state ( V0 ) , _next_to ( V0 , NV ) , _state ( V0 ) , _loc ( NV , V1 ) , _capital ( V0 ) , _const ( V0 , _cityid ( dover , _ ) ) ) )
how many people stay in wisconsin ?	_answer ( NV , ( _population ( NV , V1 ) , _const ( V0 , _stateid ( wisconsin ) ) ) )
what is the biggest river in hawaii ?	_answer ( NV , _largest ( V0 , ( _river ( V0 ) , _loc ( V0 , NV ) , _const ( V0 , _stateid ( hawaii ) ) ) ) )
what is the largest city in utah ?	_answer ( NV , _largest ( V0 , ( _city ( V0 ) , _loc ( V0 , NV ) , _const ( V0 , _stateid ( utah ) ) ) ) )
what is the smallest state that borders delaware ?	_answer ( NV , _smallest ( V0 , ( _state ( V0 ) , _next_to ( V0 , NV ) , _const ( V0 , _stateid ( delaware ) ) ) ) )
what is the population density in the state with capital seattle ?	_answer ( NV , ( _density ( NV , V1 ) , _state ( V0 ) , _loc ( NV , V1 ) , _capital ( V0 ) , _const ( V0 , _cityid ( seattle , _ ) ) ) )
which states do mississippi river flow through ?	_answer ( NV , ( _state ( V0 ) , _const ( NV , _riverid ( mississippi ) ) , _river ( V0 ) , _traverse ( V0 , V1 ) ) )
how long is ohio river ?	_answer ( NV , ( _len ( NV , V1 ) , _const ( V0 , _riverid ( ohio ) ) ) )
how many inhabitants does austin have ?	_answer ( NV , ( _population ( NV , V1 ) , _const ( V0 , _cityid ( austin , _ ) ) ) )
what is the number of neighboring states for rhode island ?	_answer ( NV , _count ( NV , ( _state ( V0 ) , _next_to ( V0 , NV ) , _const ( V0 , _stateid ( ' rhode island ' ) ) ) , V2 ) )
what is the longest river that does not run through georgia ?	_answer ( NV , _longest ( V0 , ( _river ( V0 ) , \+ ( _traverse ( V0 , NV ) , _const ( V0 , _stateid ( georgia ) ) ) ) ) )
what iowa city has the largest population ?	_answer ( NV , _largest ( NV , ( _const ( NV , _stateid ( iowa ) ) , _city ( V2 ) , _loc ( V2 , V0 ) , _population ( V2 , V1 ) ) ) )
what is the height of mount whitney ?	_answer ( NV , ( _elevation ( NV , V1 ) , _const ( V0 , _placeid ( ' mount whitney ' ) ) ) )
what states have cities named dallas ?	_answer ( NV , ( _state ( V0 ) , _loc ( NV , V1 ) , _city ( V0 ) , _const ( V0 , _cityid ( dallas , _ ) ) ) )
which states does not border montana ?	_answer ( NV , ( _state ( V0 ) , \+ ( _next_to ( V0 , NV ) , _const ( V0 , _stateid ( montana ) ) ) ) )
where is the lowest spot in arizona ?	_answer ( NV , _lowest ( V0 , ( _place ( V0 ) , _loc ( V0 , NV ) , _const ( V0 , _stateid ( arizona ) ) ) ) )
where is mount mckinley ?	_answer ( NV , ( _loc ( NV , V1 ) , _const ( V0 , _placeid ( ' mount mckinley ' ) ) ) )
what is the highest point in the state with the capital san jose ?	_answer ( NV , _highest ( V0 , ( _place ( V0 ) , _loc ( V0 , NV ) , _state ( V0 ) , _loc ( NV , V1 ) , _capital ( V0 ) , _const ( V0 , _cityid ( ' san jose ' , _ ) ) ) ) )
what is the population in houston ?	_answer ( NV , ( _population ( NV , V1 ) , _const ( V0 , _cityid ( houston , _ ) ) ) )
what are the cities in georgia ?	_answer ( NV , ( _city ( V0 ) , _loc ( V0 , NV ) , _const ( V0 , _stateid ( georgia ) ) ) )
what states high point are higher than that of wisconsin ?	_answer ( NV , ( _state ( V0 ) , _high_point ( V0 , NV ) , _higher ( V0 , NV ) , _high_point ( NV , V1 ) , _const ( V0 , _stateid ( wisconsin ) ) ) )
what state is columbus located in ?	_answer ( NV , ( _state ( V0 ) , _const ( NV , _cityid ( columbus , _ ) ) , _loc ( V0 , V1 ) ) )
what can you tell me about the population of hawaii ?	_answer ( NV , ( _population ( NV , V1 ) , _const ( V0 , _stateid ( hawaii ) ) ) )
what rivers do not run through rhode island ?	_answer ( NV , ( _river ( V0 ) , \+ ( _traverse ( V0 , NV ) , _const ( V0 , _stateid ( ' rhode island ' ) ) ) ) )
which states border states through which the rio grande river traverses ?	_answer ( NV , ( _state ( V0 ) , _next_to ( V0 , NV ) , _state ( V0 ) , _const ( NV , _riverid ( ' rio grande ' ) ) , _traverse ( V0 , V1 ) ) )
what is the largest state bordering massachusetts ?	_answer ( NV , _largest ( V0 , ( _state ( V0 ) , _next_to ( V0 , NV ) , _const ( V0 , _stateid ( massachusetts ) ) ) ) )
what are the capitals of the states that border oregon ?	_answer ( NV , ( _capital ( V0 ) , _loc ( V0 , NV ) , _state ( V0 ) , _next_to ( V0 , NV ) , _const ( V0 , _stateid ( oregon ) ) ) )
what is the area of illinois in square kilometers ?	_answer ( NV , ( _area ( NV , V1 ) , _const ( V0 , _stateid ( illinois ) ) ) )
what are the populations of states through which the ohio river run ?	_answer ( NV , ( _population ( NV , V1 ) , _state ( V0 ) , _const ( NV , _riverid ( ohio ) ) , _river ( V0 ) , _traverse ( V0 , V1 ) ) )
what west virginia city has the largest population ?	_answer ( NV , _largest ( NV , ( _const ( NV , _stateid ( ' west virginia ' ) ) , _city ( V2 ) , _loc ( V2 , V0 ) , _population ( V2 , V1 ) ) ) )
what is the highest point in the state with the capital boulder ?	_answer ( NV , _highest ( V0 , ( _place ( V0 ) , _loc ( V0 , NV ) , _state ( V0 ) , _loc ( NV , V1 ) , _capital ( V0 ) , _const ( V0 , _cityid ( boulder , _ ) ) ) ) )
what is the largest state that borders illinois ?	_answer ( NV , _largest ( V0 , ( _state ( V0 ) , _next_to ( V0 , NV ) , _const ( V0 , _stateid ( illinois ) ) ) ) )
what is the lowest point in iowa ?	_answer ( NV , _lowest ( V0 , ( _place ( V0 ) , _loc ( V0 , NV ) , _const ( V0 , _stateid ( iowa ) ) ) ) )
what is the elevation of mount whitney ?	_answer ( NV , ( _elevation ( NV , V1 ) , _const ( V0 , _placeid ( ' mount whitney ' ) ) ) )
what cities are located in illinois ?	_answer ( NV , ( _city ( V0 ) , _loc ( V0 , NV ) , _const ( V0 , _stateid ( illinois ) ) ) )
how many major rivers cross florida ?	_answer ( NV , _count ( NV , ( _major ( V0 ) , _river ( V0 ) , _traverse ( V0 , NV ) , _const ( V0 , _stateid ( florida ) ) ) , V2 ) )
what states have a city named scotts valley ?	_answer ( NV , ( _state ( V0 ) , _loc ( NV , V1 ) , _const ( V0 , _cityid ( ' scotts valley ' , _ ) ) ) )
what is the total population of the states that border new york ?	_answer ( NV , _sum ( NV , ( _state ( V0 ) , _next_to ( NV , V1 ) , _const ( V0 , _stateid ( ' new york ' ) ) ) , _population ( V1 ) , V2 ) )
what is capital of arizona ?	_answer ( NV , ( _capital ( V0 ) , _loc ( V0 , NV ) , _const ( V0 , _stateid ( arizona ) ) ) )
what is the river that cross over nevada ?	_answer ( NV , ( _river ( V0 ) , _traverse ( V0 , NV ) , _const ( V0 , _stateid ( nevada ) ) ) )
what is the river that cross over maine ?	_answer ( NV , ( _river ( V0 ) , _traverse ( V0 , NV ) , _const ( V0 , _stateid ( maine ) ) ) )
what is the lowest point in the state of south dakota ?	_answer ( NV , _lowest ( V0 , ( _place ( V0 ) , _loc ( V0 , NV ) , _state ( V0 ) , _const ( V0 , _stateid ( ' south dakota ' ) ) ) ) )
states bordering maine ?	_answer ( NV , ( _state ( V0 ) , _next_to ( V0 , NV ) , _const ( V0 , _stateid ( maine ) ) ) )
columbus is the capital of which state ?	_answer ( NV , ( _const ( NV , _cityid ( columbus , _ ) ) , _capital ( V0 ) , _loc ( V0 , V1 ) , _state ( V1 ) ) )
how high is mount mckinley ?	_answer ( NV , ( _elevation ( NV , V1 ) , _const ( V0 , _placeid ( ' mount mckinley ' ) ) ) )
what state borders the least states excluding arkansas and excluding hawaii ?	_answer ( NV , _fewest ( V0 , NV , ( _state ( V1 ) , _next_to ( V1 , V0 ) , _state ( V0 ) , \+ _const ( V1 , _stateid ( arkansas ) ) , \+ _const ( V1 , _stateid ( hawaii ) ) ) ) )
what are the populations of all the major cities in oregon ?	_answer ( NV , ( _population ( NV , V1 ) , _major ( V0 ) , _city ( V0 ) , _loc ( V0 , NV ) , _const ( V0 , _stateid ( oregon ) ) ) )
how large is the largest city in rhode island ?	_answer ( NV , ( _size ( NV , V1 ) , _largest ( V0 , ( _city ( V0 ) , _loc ( V0 , NV ) , _const ( V0 , _stateid ( ' rhode island ' ) ) ) ) ) )
which state is the largest city in idaho in ?	_answer ( NV , ( _state ( V0 ) , _largest ( NV , ( _city ( V0 ) , _loc ( V0 , NV ) , _const ( V0 , _stateid ( idaho ) ) ) ) , _loc ( V1 , V2 ) ) )
what are major rivers in new york ?	_answer ( NV , ( _major ( V0 ) , _river ( V0 ) , _loc ( V0 , NV ) , _const ( V0 , _stateid ( ' new york ' ) ) ) )
what state is dallas the capital of ?	_answer ( NV , ( _state ( V0 ) , _const ( NV , _cityid ( dallas , _ ) ) , _capital ( V0 ) , _loc ( V0 , V1 ) ) )
how many rivers in idaho are longer than the mississippi river ?	_answer ( NV , _count ( NV , ( _river ( V0 ) , _loc ( V0 , NV ) , _const ( V0 , _stateid ( idaho ) ) , _longer ( V1 , NV ) , _const ( V0 , _riverid ( mississippi ) ) ) , V3 ) )
what is the most populous city in georgia ?	_answer ( NV , _largest ( NV , ( _population ( V1 , V0 ) , _city ( V1 ) , _loc ( V1 , NV ) , _const ( V0 , _stateid ( georgia ) ) ) ) )
what is the population density of minnesota ?	_answer ( NV , ( _density ( NV , V1 ) , _const ( V0 , _stateid ( minnesota ) ) ) )
what are the capital cities of the states which border maine ?	_answer ( NV , ( _capital ( V0 ) , _city ( V0 ) , _loc ( V0 , NV ) , _state ( V0 ) , _next_to ( V0 , NV ) , _const ( V0 , _stateid ( maine ) ) ) )
how many people stay in wyoming ?	_answer ( NV , ( _population ( NV , V1 ) , _const ( V0 , _stateid ( wyoming ) ) ) )
what is the area of the state with the capital kalamazoo ?	_answer ( NV , ( _area ( NV , V1 ) , _state ( V0 ) , _loc ( NV , V1 ) , _capital ( V0 ) , _const ( V0 , _cityid ( kalamazoo , _ ) ) ) )
how many states does louisiana border ?	_answer ( NV , _count ( NV , ( _state ( V0 ) , _const ( NV , _stateid ( louisiana ) ) , _next_to ( V0 , V1 ) ) , V2 ) )
what is the area of iowa in square kilometers ?	_answer ( NV , ( _area ( NV , V1 ) , _const ( V0 , _stateid ( iowa ) ) ) )
what are the populations of the states through which the potomac runs ?	_answer ( NV , ( _population ( NV , V1 ) , _state ( V0 ) , _const ( NV , _riverid ( potomac ) ) , _traverse ( V0 , V1 ) ) )
what is the capital of mississippi ?	_answer ( NV , ( _capital ( V0 ) , _loc ( V0 , NV ) , _const ( V0 , _stateid ( mississippi ) ) ) )
how many states border the rio grande ?	_answer ( NV , _count ( NV , ( _state ( V0 ) , _next_to ( V0 , NV ) , _const ( V0 , _riverid ( ' rio grande ' ) ) , _river ( V0 ) ) , V2 ) )
what states have cities named baton rouge ?	_answer ( NV , ( _state ( V0 ) , _loc ( NV , V1 ) , _city ( V0 ) , _const ( V0 , _cityid ( ' baton rouge ' , _ ) ) ) )
what are the major cities in the states through which the major river in south dakota runs ?	_answer ( NV , ( _major ( V0 ) , _city ( V0 ) , _loc ( V0 , NV ) , _state ( V0 ) , _river ( NV ) , _loc ( V0 , NV ) , _const ( V0 , _stateid ( ' south dakota ' ) ) , _traverse ( V1 , V2 ) ) )
through which states does the mississippi river flow ?	_answer ( NV , ( _state ( V0 ) , _const ( NV , _riverid ( mississippi ) ) , _traverse ( V0 , V1 ) ) )
what is the longest river that runs through a state that borders michigan ?	_answer ( NV , _longest ( V0 , ( _river ( V0 ) , _traverse ( V0 , NV ) , _state ( V0 ) , _next_to ( V0 , NV ) , _const ( V0 , _stateid ( michigan ) ) ) ) )
what are the rivers of maryland ?	_answer ( NV , ( _river ( V0 ) , _loc ( V0 , NV ) , _const ( V0 , _stateid ( maryland ) ) ) )
how large is the largest city in oregon ?	_answer ( NV , ( _size ( NV , V1 ) , _largest ( V0 , ( _city ( V0 ) , _loc ( V0 , NV ) , _const ( V0 , _stateid ( oregon ) ) ) ) ) )
what are the cities in ohio ?	_answer ( NV , ( _city ( V0 ) , _loc ( V0 , NV ) , _const ( V0 , _stateid ( ohio ) ) ) )
what are the cities in alabama ?	_answer ( NV , ( _city ( V0 ) , _loc ( V0 , NV ) , _const ( V0 , _stateid ( alabama ) ) ) )
what states neighbor indiana ?	_answer ( NV , ( _state ( V0 ) , _next_to ( V0 , NV ) , _const ( V0 , _stateid ( indiana ) ) ) )
what is the population of the major cities in new mexico ?	_answer ( NV , ( _population ( NV , V1 ) , _major ( V0 ) , _city ( V0 ) , _loc ( V0 , NV ) , _const ( V0 , _stateid ( ' new mexico ' ) ) ) )
what rivers run through nebraska ?	_answer ( NV , ( _river ( V0 ) , _traverse ( V0 , NV ) , _const ( V0 , _stateid ( nebraska ) ) ) )
how many people are there in south dakota ?	_answer ( NV , ( _population ( NV , V1 ) , _const ( V0 , _stateid ( ' south dakota ' ) ) ) )
name the major lakes in wisconsin ?	_answer ( NV , ( _major ( V0 ) , _lake ( V0 ) , _loc ( V0 , NV ) , _const ( V0 , _stateid ( wisconsin ) ) ) )
what is the height of guadalupe peak ?	_answer ( NV , ( _elevation ( NV , V1 ) , _const ( V0 , _placeid ( ' guadalupe peak ' ) ) ) )
how many states have a city named riverside ?	_answer ( NV , _count ( NV , ( _state ( V0 ) , _loc ( NV , V1 ) , _const ( V0 , _cityid ( riverside , _ ) ) ) , V2 ) )
which rivers run through states bordering missouri ?	_answer ( NV , ( _river ( V0 ) , _traverse ( V0 , NV ) , _state ( V0 ) , _next_to ( V0 , NV ) , _const ( V0 , _stateid ( missouri ) ) ) )
which states does the ohio river pass through ?	_answer ( NV , ( _state ( V0 ) , _const ( NV , _riverid ( ohio ) ) , _traverse ( V0 , V1 ) ) )
how many rivers do not traverse the state with the capital new york ?	_answer ( NV , _count ( NV , ( _river ( V0 ) , \+ ( _traverse ( V0 , NV ) , _state ( V0 ) , _loc ( NV , V1 ) , _capital ( V0 ) , _const ( V0 , _cityid ( ' new york ' , _ ) ) ) ) , V3 ) )
give me the cities which are in nevada ?	_answer ( NV , ( _city ( V0 ) , _loc ( V0 , NV ) , _const ( V0 , _stateid ( nevada ) ) ) )
what river runs through oregon ?	_answer ( NV , ( _river ( V0 ) , _traverse ( V0 , NV ) , _const ( V0 , _stateid ( oregon ) ) ) )
how many people live in alaska ?	_answer ( NV , ( _population ( NV , V1 ) , _const ( V0 , _stateid ( alaska ) ) ) )
where is guadalupe peak located ?	_answer ( NV , ( _loc ( NV , V1 ) , _const ( V0 , _placeid ( ' guadalupe peak ' ) ) ) )
what is the elevation of mount mckinley ?	_answer ( NV , ( _elevation ( NV , V1 ) , _const ( V0 , _placeid ( ' mount mckinley ' ) ) ) )
what is the area of san francisco ?	_answer ( NV , ( _area ( NV , V1 ) , _const ( V0 , _cityid ( ' san francisco ' , _ ) ) ) )
what is the capital of ohio ?	_answer ( NV , ( _capital ( V0 ) , _loc ( V0 , NV ) , _const ( V0 , _stateid ( ohio ) ) ) )
how many major cities are in states bordering oregon ?	_answer ( NV , _count ( NV , ( _major ( V0 ) , _city ( V0 ) , _loc ( V0 , NV ) , _state ( V0 ) , _next_to ( V0 , NV ) , _const ( V0 , _stateid ( oregon ) ) ) , V3 ) )
what states border pennsylvania ?	_answer ( NV , ( _state ( V0 ) , _next_to ( V0 , NV ) , _const ( V0 , _stateid ( pennsylvania ) ) ) )
where is the highest point in new mexico ?	_answer ( NV , _highest ( V0 , ( _place ( V0 ) , _loc ( V0 , NV ) , _const ( V0 , _stateid ( ' new mexico ' ) ) ) ) )
which rivers run through states bordering arizona ?	_answer ( NV , ( _river ( V0 ) , _traverse ( V0 , NV ) , _state ( V0 ) , _next_to ( V0 , NV ) , _const ( V0 , _stateid ( arizona ) ) ) )
what states have cities named indianapolis ?	_answer ( NV , ( _state ( V0 ) , _loc ( NV , V1 ) , _city ( V0 ) , _const ( V0 , _cityid ( indianapolis , _ ) ) ) )
how high is the highest point of georgia ?	_answer ( NV , ( _elevation ( NV , V1 ) , _highest ( V0 , ( _place ( V0 ) , _loc ( V0 , NV ) , _const ( V0 , _stateid ( georgia ) ) ) ) ) )
how many people stay in new mexico ?	_answer ( NV , ( _population ( NV , V1 ) , _const ( V0 , _stateid ( ' new mexico ' ) ) ) )
what is the population of the largest state that borders iowa ?	_answer ( NV , ( _population ( NV , V1 ) , _largest ( V0 , ( _state ( V0 ) , _next_to ( V0 , NV ) , _const ( V0 , _stateid ( iowa ) ) ) ) ) )
how many big cities are in delaware ?	_answer ( NV , _count ( NV , ( _major ( V0 ) , _city ( V0 ) , _loc ( V0 , NV ) , _const ( V0 , _stateid ( delaware ) ) ) , V2 ) )
what is the population density in the state with capital rochester ?	_answer ( NV , ( _density ( NV , V1 ) , _state ( V0 ) , _loc ( NV , V1 ) , _capital ( V0 ) , _const ( V0 , _cityid ( rochester , _ ) ) ) )
name the major lakes in indiana ?	_answer ( NV , ( _major ( V0 ) , _lake ( V0 ) , _loc ( V0 , NV ) , _const ( V0 , _stateid ( indiana ) ) ) )
where is kalamazoo ?	_answer ( NV , ( _loc ( NV , V1 ) , _const ( V0 , _cityid ( kalamazoo , _ ) ) ) )
what are the high points of states surrounding new york ?	_answer ( NV , ( _high_point ( NV , V1 ) , _loc ( V1 , V0 ) , _state ( V0 ) , _next_to ( V0 , NV ) , _const ( V0 , _stateid ( ' new york ' ) ) ) )
which capitals are in the states that border alabama ?	_answer ( NV , ( _capital ( V0 ) , _loc ( V0 , NV ) , _state ( V0 ) , _next_to ( V0 , NV ) , _const ( V0 , _stateid ( alabama ) ) ) )
what rivers do not run through new york ?	_answer ( NV , ( _river ( V0 ) , \+ ( _traverse ( V0 , NV ) , _const ( V0 , _stateid ( ' new york ' ) ) ) ) )
what state borders rhode island ?	_answer ( NV , ( _state ( V0 ) , _next_to ( V0 , NV ) , _const ( V0 , _stateid ( ' rhode island ' ) ) ) )
what is the biggest river in kentucky ?	_answer ( NV , _largest ( V0 , ( _river ( V0 ) , _loc ( V0 , NV ) , _const ( V0 , _stateid ( kentucky ) ) ) ) )
what are the major cities in new york ?	_answer ( NV , ( _major ( V0 ) , _city ( V0 ) , _loc ( V0 , NV ) , _const ( V0 , _stateid ( ' new york ' ) ) ) )
which state borders vermont ?	_answer ( NV , ( _state ( V0 ) , _next_to ( V0 , NV ) , _const ( V0 , _stateid ( vermont ) ) ) )
how many cities named sacramento are there in the usa ?	_answer ( NV , _count ( NV , ( _city ( V0 ) , _const ( V0 , _cityid ( sacramento , _ ) ) , _loc ( V0 , NV ) , _const ( V0 , _countryid ( usa ) ) ) , V2 ) )
what states border states which the red river runs through ?	_answer ( NV , ( _state ( V0 ) , _next_to ( V0 , NV ) , _state ( V0 ) , _const ( NV , _riverid ( red ) ) , _traverse ( V0 , V1 ) ) )
what cities in iowa ?	_answer ( NV , ( _city ( V0 ) , _loc ( V0 , NV ) , _const ( V0 , _stateid ( iowa ) ) ) )
of the states washed by the rio grande river which has the lowest point ?	_answer ( NV , _lowest ( NV , ( _state ( V1 ) , _traverse ( NV , V2 ) , _const ( V0 , _riverid ( ' rio grande ' ) ) , _loc ( V1 , V2 ) , _place ( V1 ) ) ) )
through which states does the rio grande river run ?	_answer ( NV , ( _state ( V0 ) , _const ( NV , _riverid ( ' rio grande ' ) ) , _traverse ( V0 , V1 ) ) )
which states does the red pass through ?	_answer ( NV , ( _state ( V0 ) , _const ( NV , _riverid ( red ) ) , _traverse ( V0 , V1 ) ) )
what are the populations of states through which the red river run ?	_answer ( NV , ( _population ( NV , V1 ) , _state ( V0 ) , _const ( NV , _riverid ( red ) ) , _traverse ( V0 , V1 ) ) )
what rivers do not run through arizona ?	_answer ( NV , ( _river ( V0 ) , \+ ( _traverse ( V0 , NV ) , _const ( V0 , _stateid ( arizona ) ) ) ) )
what rivers flow through virginia ?	_answer ( NV , ( _river ( V0 ) , _traverse ( V0 , NV ) , _const ( V0 , _stateid ( virginia ) ) ) )
what is the highest point in the state with capital rochester ?	_answer ( NV , _highest ( V0 , ( _place ( V0 ) , _loc ( V0 , NV ) , _state ( V0 ) , _loc ( NV , V1 ) , _capital ( V0 ) , _const ( V0 , _cityid ( rochester , _ ) ) ) ) )
how many major cities are in iowa ?	_answer ( NV , _count ( NV , ( _major ( V0 ) , _city ( V0 ) , _loc ( V0 , NV ) , _const ( V0 , _stateid ( iowa ) ) ) , V2 ) )
what is the biggest river in nevada ?	_answer ( NV , _largest ( V0 , ( _river ( V0 ) , _loc ( V0 , NV ) , _const ( V0 , _stateid ( nevada ) ) ) ) )
how many cities are in south carolina ?	_answer ( NV , _count ( NV , ( _city ( V0 ) , _loc ( V0 , NV ) , _const ( V0 , _stateid ( ' south carolina ' ) ) ) , V2 ) )
what is the largest state bordering colorado ?	_answer ( NV , _largest ( V0 , ( _state ( V0 ) , _next_to ( V0 , NV ) , _const ( V0 , _stateid ( colorado ) ) ) ) )
what is the largest state traversed by the red ?	_answer ( NV , _largest ( V0 , ( _state ( V0 ) , _traverse ( NV , V1 ) , _const ( V0 , _riverid ( red ) ) ) ) )
can you tell me the capital of south dakota ?	_answer ( NV , ( _capital ( V0 ) , _loc ( V0 , NV ) , _const ( V0 , _stateid ( ' south dakota ' ) ) ) )
what is the longest river flowing through indiana ?	_answer ( NV , _longest ( V0 , ( _river ( V0 ) , _traverse ( V0 , NV ) , _const ( V0 , _stateid ( indiana ) ) ) ) )
what state is chicago the capital of ?	_answer ( NV , ( _state ( V0 ) , _const ( NV , _cityid ( chicago , _ ) ) , _capital ( V0 ) , _loc ( V0 , V1 ) ) )
how long is ohio river ?	_answer ( NV , ( _len ( NV , V1 ) , _const ( V0 , _riverid ( ohio ) ) ) )
how many rivers run through the states bordering maryland ?	_answer ( NV , _count ( NV , ( _river ( V0 ) , _traverse ( V0 , NV ) , _state ( V0 ) , _next_to ( V0 , NV ) , _const ( V0 , _stateid ( maryland ) ) ) , V3 ) )
what cities in vermont ?	_answer ( NV , ( _city ( V0 ) , _loc ( V0 , NV ) , _const ( V0 , _stateid ( vermont ) ) ) )
what states have cities named rochester ?	_answer ( NV , ( _state ( V0 ) , _loc ( NV , V1 ) , _city ( V0 ) , _const ( V0 , _cityid ( rochester , _ ) ) ) )
name the major lakes in alaska ?	_answer ( NV , ( _major ( V0 ) , _lake ( V0 ) , _loc ( V0 , NV ) , _const ( V0 , _stateid ( alaska ) ) ) )
which state has the smallest area that borders hawaii ?	_answer ( NV , _smallest ( NV , ( _state ( V1 ) , _area ( V1 , V0 ) , _next_to ( V1 , NV ) , _const ( V0 , _stateid ( hawaii ) ) ) ) )
which states adjoin kansas ?	_answer ( NV , ( _state ( V0 ) , _next_to ( V0 , NV ) , _const ( V0 , _stateid ( kansas ) ) ) )
what are the highest points of states surrounding kentucky ?	_answer ( NV , _highest ( V0 , ( _place ( V0 ) , _loc ( V0 , NV ) , _state ( V0 ) , _next_to ( V0 , NV ) , _const ( V0 , _stateid ( kentucky ) ) ) ) )
what vermont city has the largest population ?	_answer ( NV , _largest ( NV , ( _const ( NV , _stateid ( vermont ) ) , _city ( V2 ) , _loc ( V2 , V0 ) , _population ( V2 , V1 ) ) ) )
what is the shortest river in kentucky ?	_answer ( NV , _shortest ( V0 , ( _river ( V0 ) , _loc ( V0 , NV ) , _const ( V0 , _stateid ( kentucky ) ) ) ) )
what is the longest river in alabama ?	_answer ( NV , _longest ( V0 , ( _river ( V0 ) , _loc ( V0 , NV ) , _const ( V0 , _stateid ( alabama ) ) ) ) )
what is the lowest point of alaska ?	_answer ( NV , _lowest ( V0 , ( _place ( V0 ) , _loc ( V0 , NV ) , _const ( V0 , _stateid ( alaska ) ) ) ) )
what are the populations of all the major cities in texas ?	_answer ( NV , ( _population ( NV , V1 ) , _major ( V0 ) , _city ( V0 ) , _loc ( V0 , NV ) , _const ( V0 , _stateid ( texas ) ) ) )
number of citizens in austin ?	_answer ( NV , ( _population ( NV , V1 ) , _const ( V0 , _cityid ( austin , _ ) ) ) )
austin is the capital of which state ?	_answer ( NV , ( _const ( NV , _cityid ( austin , _ ) ) , _capital ( V0 ) , _loc ( V0 , V1 ) , _state ( V1 ) ) )
what are the capitals of the states that border indiana ?	_answer ( NV , ( _capital ( V0 ) , _loc ( V0 , NV ) , _state ( V0 ) , _next_to ( V0 , NV ) , _const ( V0 , _stateid ( indiana ) ) ) )
how many big cities are in kansas ?	_answer ( NV , _count ( NV , ( _major ( V0 ) , _city ( V0 ) , _loc ( V0 , NV ) , _const ( V0 , _stateid ( kansas ) ) ) , V2 ) )
how many cities does south dakota have ?	_answer ( NV , _count ( NV , ( _city ( V0 ) , _const ( NV , _stateid ( ' south dakota ' ) ) , _loc ( V1 , V0 ) ) , V2 ) )
how high is mount mckinley ?	_answer ( NV , ( _elevation ( NV , V1 ) , _const ( V0 , _placeid ( ' mount mckinley ' ) ) ) )
what state that borders michigan is the largest ?	_answer ( NV , _largest ( V0 , ( _state ( V0 ) , _next_to ( V0 , NV ) , _const ( V0 , _stateid ( michigan ) ) ) ) )
how many states does the mississippi river flow through ?	_answer ( NV , _count ( NV , ( _state ( V0 ) , _const ( NV , _riverid ( mississippi ) ) , _river ( V0 ) , _traverse ( V0 , V1 ) ) , V2 ) )
what states high point are higher than that of kansas ?	_answer ( NV , ( _state ( V0 ) , _high_point ( V0 , NV ) , _higher ( V0 , NV ) , _high_point ( NV , V1 ) , _const ( V0 , _stateid ( kansas ) ) ) )
what states are next to colorado ?	_answer ( NV , ( _state ( V0 ) , _next_to ( V0 , NV ) , _const ( V0 , _stateid ( colorado ) ) ) )
scotts valley is the capital of which state ?	_answer ( NV , ( _const ( NV , _cityid ( ' scotts valley ' , _ ) ) , _capital ( V0 ) , _loc ( V0 , V1 ) , _state ( V1 ) ) )
what is the size of south dakota ?	_answer ( NV , ( _size ( NV , V1 ) , _const ( V0 , _stateid ( ' south dakota ' ) ) ) )
what rivers flow through minnesota ?	_answer ( NV , ( _river ( V0 ) , _traverse ( V0 , NV ) , _const ( V0 , _stateid ( minnesota ) ) ) )
give me the lakes in iowa ?	_answer ( NV , ( _lake ( V0 ) , _loc ( V0 , NV ) , _const ( V0 , _stateid ( iowa ) ) ) )
what are the populations of all the major cities in georgia ?	_answer ( NV , ( _population ( NV , V1 ) , _major ( V0 ) , _city ( V0 ) , _loc ( V0 , NV ) , _const ( V0 , _stateid ( georgia ) ) ) )
what is the major cities in georgia ?	_answer ( NV , ( _major ( V0 ) , _city ( V0 ) , _loc ( V0 , NV ) , _const ( V0 , _stateid ( georgia ) ) ) )
what are the major cities in kentucky ?	_answer ( NV , ( _major ( V0 ) , _city ( V0 ) , _loc ( V0 , NV ) , _const ( V0 , _stateid ( kentucky ) ) ) )
what states border states that the rio grande runs through ?	_answer ( NV , ( _state ( V0 ) , _next_to ( V0 , NV ) , _state ( V0 ) , _const ( NV , _riverid ( ' rio grande ' ) ) , _traverse ( V0 , V1 ) ) )
what is the largest of the state that the missouri river runs through ?	_answer ( NV , _largest ( V0 , ( _state ( V0 ) , _const ( NV , _riverid ( missouri ) ) , _traverse ( V0 , V1 ) ) ) )
what is the population of new hampshire ?	_answer ( NV , ( _population ( NV , V1 ) , _const ( V0 , _stateid ( ' new hampshire ' ) ) ) )
how many states have a city called riverside ?	_answer ( NV , _count ( NV , ( _state ( V0 ) , _loc ( NV , V1 ) , _const ( V0 , _cityid ( riverside , _ ) ) ) , V2 ) )
how many rivers in kansas are longer than the rio grande ?	_answer ( NV , _count ( NV , ( _river ( V0 ) , _loc ( V0 , NV ) , _const ( V0 , _stateid ( kansas ) ) , _longer ( V1 , NV ) , _const ( V0 , _riverid ( ' rio grande ' ) ) ) , V3 ) )
