what is the shortest river in montana ?	_answer ( NV , _shortest ( V0 , ( _river ( V0 ) , _loc ( V0 , NV ) , _const ( V0 , _stateid ( montana ) ) ) ) )
how long is the missouri river ?	_answer ( NV , ( _len ( NV , V1 ) , _const ( V0 , _riverid ( missouri ) ) ) )
how many people live in the capital of missouri ?	_answer ( NV , ( _population ( NV , V1 ) , _capital ( V0 ) , _loc ( V0 , NV ) , _const ( V0 , _stateid ( missouri ) ) ) )
what are the names of the major cities in new hampshire ?	_answer ( NV , ( _major ( V0 ) , _city ( V0 ) , _loc ( V0 , NV ) , _const ( V0 , _stateid ( ' new hampshire ' ) ) ) )
how many people live in the capital of iowa ?	_answer ( NV , ( _population ( NV , V1 ) , _capital ( V0 ) , _loc ( V0 , NV ) , _const ( V0 , _stateid ( iowa ) ) ) )
how many rivers are found in florida ?	_answer ( NV , _count ( NV , ( _river ( V0 ) , _loc ( V0 , NV ) , _const ( V0 , _stateid ( florida ) ) ) , V2 ) )
what states are next to the north carolina ?	_answer ( NV , ( _state ( V0 ) , _next_to ( V0 , NV ) , _const ( V0 , _stateid ( ' north carolina ' ) ) ) )
what is the largest city in states that border massachusetts ?	_answer ( NV , _largest ( V0 , ( _city ( V0 ) , _loc ( V0 , NV ) , _state ( V0 ) , _next_to ( V0 , NV ) , _const ( V0 , _stateid ( massachusetts ) ) ) ) )
which states have points higher than the highest point in wyoming ?	_answer ( NV , ( _state ( V0 ) , _loc ( NV , V1 ) , _place ( V0 ) , _higher ( V0 , NV ) , _highest ( V0 , ( _place ( V0 ) , _loc ( V0 , NV ) , _const ( V0 , _stateid ( wyoming ) ) ) ) ) )
what are the highest points of states surrounding arkansas ?	_answer ( NV , _highest ( V0 , ( _place ( V0 ) , _loc ( V0 , NV ) , _state ( V0 ) , _next_to ( V0 , NV ) , _const ( V0 , _stateid ( arkansas ) ) ) ) )
baton rouge is the capital of which state ?	_answer ( NV , ( _const ( NV , _cityid ( ' baton rouge ' , _ ) ) , _capital ( V0 ) , _loc ( V0 , V1 ) , _state ( V1 ) ) )
how many inhabitants does rochester have ?	_answer ( NV , ( _population ( NV , V1 ) , _const ( V0 , _cityid ( rochester , _ ) ) ) )
what are the lakes in states bordering virginia ?	_answer ( NV , ( _lake ( V0 ) , _loc ( V0 , NV ) , _state ( V0 ) , _next_to ( V0 , NV ) , _const ( V0 , _stateid ( virginia ) ) ) )
which states have points that are higher than the highest point in north dakota ?	_answer ( NV , ( _state ( V0 ) , _place ( NV ) , _loc ( V0 , V1 ) , _higher ( V0 , NV ) , _highest ( V0 , ( _place ( V0 ) , _loc ( V0 , NV ) , _const ( V0 , _stateid ( ' north dakota ' ) ) ) ) ) )
what are the populations of the states through which the red runs ?	_answer ( NV , ( _population ( NV , V1 ) , _state ( V0 ) , _const ( NV , _riverid ( red ) ) , _traverse ( V0 , V1 ) ) )
how many rivers in colorado ?	_answer ( NV , _count ( NV , ( _river ( V0 ) , _loc ( V0 , NV ) , _const ( V0 , _stateid ( colorado ) ) ) , V2 ) )
states bordering minnesota ?	_answer ( NV , ( _state ( V0 ) , _next_to ( V0 , NV ) , _const ( V0 , _stateid ( minnesota ) ) ) )
which states border states through which the rio grande river traverses ?	_answer ( NV , ( _state ( V0 ) , _next_to ( V0 , NV ) , _state ( V0 ) , _const ( NV , _riverid ( ' rio grande ' ) ) , _traverse ( V0 , V1 ) ) )
what are the major cities of maryland ?	_answer ( NV , ( _major ( V0 ) , _city ( V0 ) , _loc ( V0 , NV ) , _const ( V0 , _stateid ( maryland ) ) ) )
in what state is guadalupe peak ?	_answer ( NV , ( _loc ( NV , V1 ) , _state ( V1 ) , _const ( V0 , _placeid ( ' guadalupe peak ' ) ) ) )
what are the major cities of south dakota ?	_answer ( NV , ( _major ( V0 ) , _city ( V0 ) , _loc ( V0 , NV ) , _const ( V0 , _stateid ( ' south dakota ' ) ) ) )
how large is the largest city in texas ?	_answer ( NV , ( _size ( NV , V1 ) , _largest ( V0 , ( _city ( V0 ) , _loc ( V0 , NV ) , _const ( V0 , _stateid ( texas ) ) ) ) ) )
how many states have a city named columbus ?	_answer ( NV , _count ( NV , ( _state ( V0 ) , _loc ( NV , V1 ) , _const ( V0 , _cityid ( columbus , _ ) ) ) , V2 ) )
number of citizens in sacramento ?	_answer ( NV , ( _population ( NV , V1 ) , _const ( V0 , _cityid ( sacramento , _ ) ) ) )
what is the highest point in the state with the capital montgomery ?	_answer ( NV , _highest ( V0 , ( _place ( V0 ) , _loc ( V0 , NV ) , _state ( V0 ) , _loc ( NV , V1 ) , _capital ( V0 ) , _const ( V0 , _cityid ( montgomery , _ ) ) ) ) )
what is the area of the state with the capital flint ?	_answer ( NV , ( _area ( NV , V1 ) , _state ( V0 ) , _loc ( NV , V1 ) , _capital ( V0 ) , _const ( V0 , _cityid ( flint , _ ) ) ) )
what can you tell me about the population of georgia ?	_answer ( NV , ( _population ( NV , V1 ) , _const ( V0 , _stateid ( georgia ) ) ) )
give me the lakes in mississippi ?	_answer ( NV , ( _lake ( V0 ) , _loc ( V0 , NV ) , _const ( V0 , _stateid ( mississippi ) ) ) )
which states does not border virginia ?	_answer ( NV , ( _state ( V0 ) , \+ ( _next_to ( V0 , NV ) , _const ( V0 , _stateid ( virginia ) ) ) ) )
which rivers are in washington ?	_answer ( NV , ( _river ( V0 ) , _loc ( V0 , NV ) , _const ( V0 , _stateid ( washington ) ) ) )
population of seattle ?	_answer ( NV , ( _population ( NV , V1 ) , _const ( V0 , _cityid ( seattle , _ ) ) ) )
what is capital of louisiana ?	_answer ( NV , ( _capital ( V0 ) , _loc ( V0 , NV ) , _const ( V0 , _stateid ( louisiana ) ) ) )
which states border states through which the potomac traverses ?	_answer ( NV , ( _state ( V0 ) , _next_to ( V0 , NV ) , _state ( V0 ) , _const ( NV , _riverid ( potomac ) ) , _traverse ( V0 , V1 ) ) )
what state is montgomery in ?	_answer ( NV , ( _state ( V0 ) , _const ( NV , _cityid ( montgomery , _ ) ) , _loc ( V0 , V1 ) ) )
what is the density of oregon ?	_answer ( NV , ( _density ( NV , V1 ) , _const ( V0 , _stateid ( oregon ) ) ) )
how many people live in south carolina ?	_answer ( NV , ( _population ( NV , V1 ) , _const ( V0 , _stateid ( ' south carolina ' ) ) ) )
what is the size of tennessee ?	_answer ( NV , ( _size ( NV , V1 ) , _const ( V0 , _stateid ( tennessee ) ) ) )
what is the height of the highest mountain in indiana ?	_answer ( NV , ( _elevation ( NV , V1 ) , _highest ( V0 , ( _mountain ( V0 ) , _loc ( V0 , NV ) , _const ( V0 , _stateid ( indiana ) ) ) ) ) )
what cities in ohio have the highest number of citizens ?	_answer ( NV , _largest ( NV , ( _city ( V1 ) , _loc ( V1 , NV ) , _const ( V0 , _stateid ( ohio ) ) , _population ( V2 , V1 ) ) ) )
what states in the united states have a city of scotts valley ?	_answer ( NV , ( _state ( V0 ) , _loc ( V0 , NV ) , _const ( V0 , _countryid ( usa ) ) , _loc ( NV , V2 ) , _const ( V0 , _cityid ( ' scotts valley ' , _ ) ) ) )
what is the lowest elevation in louisiana ?	_answer ( NV , _lowest ( V0 , ( _place ( V0 ) , _loc ( V0 , NV ) , _const ( V0 , _stateid ( louisiana ) ) ) ) )
what are the major cities of illinois ?	_answer ( NV , ( _major ( V0 ) , _city ( V0 ) , _loc ( V0 , NV ) , _const ( V0 , _stateid ( illinois ) ) ) )
what is the lowest point in the state of missouri ?	_answer ( NV , _lowest ( V0 , ( _place ( V0 ) , _loc ( V0 , NV ) , _state ( V0 ) , _const ( V0 , _stateid ( missouri ) ) ) ) )
what states border states that border states that border hawaii ?	_answer ( NV , ( _state ( V0 ) , _next_to ( V0 , NV ) , _state ( V0 ) , _next_to ( V0 , NV ) , _state ( V0 ) , _next_to ( V0 , NV ) , _const ( V0 , _stateid ( hawaii ) ) ) )
what states border states which the missouri river runs through ?	_answer ( NV , ( _state ( V0 ) , _next_to ( V0 , NV ) , _state ( V0 ) , _const ( NV , _riverid ( missouri ) ) , _traverse ( V0 , V1 ) ) )
what river runs through utah ?	_answer ( NV , ( _river ( V0 ) , _traverse ( V0 , NV ) , _const ( V0 , _stateid ( utah ) ) ) )
what is the smallest city in california ?	_answer ( NV , _smallest ( V0 , ( _city ( V0 ) , _loc ( V0 , NV ) , _const ( V0 , _stateid ( california ) ) ) ) )
what is the population density of alaska ?	_answer ( NV , ( _density ( NV , V1 ) , _const ( V0 , _stateid ( alaska ) ) ) )
what major rivers run through indiana ?	_answer ( NV , ( _major ( V0 ) , _river ( V0 ) , _traverse ( V0 , NV ) , _const ( V0 , _stateid ( indiana ) ) ) )
could you tell me what is the highest point in the state of virginia ?	_answer ( NV , _highest ( V0 , ( _place ( V0 ) , _loc ( V0 , NV ) , _state ( V0 ) , _const ( V0 , _stateid ( virginia ) ) ) ) )
what are the states that the red river run through ?	_answer ( NV , ( _state ( V0 ) , _const ( NV , _riverid ( red ) ) , _traverse ( V0 , V1 ) ) )
could you tell me what is the highest point in the state of north dakota ?	_answer ( NV , _highest ( V0 , ( _place ( V0 ) , _loc ( V0 , NV ) , _state ( V0 ) , _const ( V0 , _stateid ( ' north dakota ' ) ) ) ) )
what is the population of the capital of the largest state through which the potomac runs ?	_answer ( NV , ( _population ( NV , V1 ) , _capital ( V0 ) , _loc ( V0 , NV ) , _largest ( V0 , ( _state ( V0 ) , _const ( NV , _riverid ( potomac ) ) , _traverse ( V0 , V1 ) ) ) ) )
what river flows through iowa ?	_answer ( NV , ( _river ( V0 ) , _traverse ( V0 , NV ) , _const ( V0 , _stateid ( iowa ) ) ) )
how many citizens in indianapolis ?	_answer ( NV , ( _population ( NV , V1 ) , _const ( V0 , _cityid ( indianapolis , _ ) ) ) )
what is the highest point in oregon ?	_answer ( NV , _highest ( V0 , ( _place ( V0 ) , _loc ( V0 , NV ) , _const ( V0 , _stateid ( oregon ) ) ) ) )
what are the populations of states through which the ohio river run ?	_answer ( NV , ( _population ( NV , V1 ) , _state ( V0 ) , _const ( NV , _riverid ( ohio ) ) , _river ( V0 ) , _traverse ( V0 , V1 ) ) )
what is the capital of the state that borders the state that borders north dakota ?	_answer ( NV , ( _capital ( V0 ) , _loc ( V0 , NV ) , _state ( V0 ) , _next_to ( V0 , NV ) , _state ( V0 ) , _next_to ( V0 , NV ) , _const ( V0 , _stateid ( ' north dakota ' ) ) ) )
where is kentucky ?	_answer ( NV , ( _loc ( NV , V1 ) , _const ( V0 , _stateid ( kentucky ) ) ) )
how many states does the ohio river run through ?	_answer ( NV , _count ( NV , ( _state ( V0 ) , _const ( NV , _riverid ( ohio ) ) , _traverse ( V0 , V1 ) ) , V2 ) )
what is the size of south dakota ?	_answer ( NV , ( _size ( NV , V1 ) , _const ( V0 , _stateid ( ' south dakota ' ) ) ) )
people in rochester ?	_answer ( NV , ( _population ( NV , V1 ) , _const ( V0 , _cityid ( rochester , _ ) ) ) )
what rivers do not run through washington ?	_answer ( NV , ( _river ( V0 ) , \+ ( _traverse ( V0 , NV ) , _const ( V0 , _stateid ( washington ) ) ) ) )
what is the major cities in utah ?	_answer ( NV , ( _major ( V0 ) , _city ( V0 ) , _loc ( V0 , NV ) , _const ( V0 , _stateid ( utah ) ) ) )
what is the largest state traversed by the colorado river ?	_answer ( NV , _largest ( V0 , ( _state ( V0 ) , _traverse ( NV , V1 ) , _const ( V0 , _riverid ( colorado ) ) ) ) )
how many people live in fort wayne ?	_answer ( NV , ( _population ( NV , V1 ) , _const ( V0 , _cityid ( ' fort wayne ' , _ ) ) ) )
what is the capital of the north dakota state ?	_answer ( NV , ( _capital ( V0 ) , _loc ( V0 , NV ) , _const ( V0 , _stateid ( ' north dakota ' ) ) , _state ( V0 ) ) )
through which states does the colorado river run ?	_answer ( NV , ( _state ( V0 ) , _const ( NV , _riverid ( colorado ) ) , _traverse ( V0 , V1 ) ) )
what is the largest of the state that the mississippi river runs through ?	_answer ( NV , _largest ( V0 , ( _state ( V0 ) , _const ( NV , _riverid ( mississippi ) ) , _traverse ( V0 , V1 ) ) ) )
name all the rivers in michigan ?	_answer ( NV , ( _river ( V0 ) , _loc ( V0 , NV ) , _const ( V0 , _stateid ( michigan ) ) ) )
what states border states that border states that border states that border kansas ?	_answer ( NV , ( _state ( V0 ) , _next_to ( V0 , NV ) , _state ( V0 ) , _next_to ( V0 , NV ) , _state ( V0 ) , _next_to ( V0 , NV ) , _state ( V0 ) , _next_to ( V0 , NV ) , _const ( V0 , _stateid ( kansas ) ) ) )
how many people are there in michigan ?	_answer ( NV , ( _population ( NV , V1 ) , _const ( V0 , _stateid ( michigan ) ) ) )
show major cities in oklahoma ?	_answer ( NV , ( _major ( V0 ) , _city ( V0 ) , _loc ( V0 , NV ) , _const ( V0 , _stateid ( oklahoma ) ) ) )
what arkansas city has the largest population ?	_answer ( NV , _largest ( NV , ( _const ( NV , _stateid ( arkansas ) ) , _city ( V2 ) , _loc ( V2 , V0 ) , _population ( V2 , V1 ) ) ) )
how many states does the mississippi flow through ?	_answer ( NV , _count ( NV , ( _state ( V0 ) , _const ( NV , _riverid ( mississippi ) ) , _river ( V0 ) , _traverse ( V0 , V1 ) ) , V2 ) )
what are the capitals of the states that border ohio ?	_answer ( NV , ( _capital ( V0 ) , _loc ( V0 , NV ) , _state ( V0 ) , _next_to ( V0 , NV ) , _const ( V0 , _stateid ( ohio ) ) ) )
what states border michigan ?	_answer ( NV , ( _state ( V0 ) , _next_to ( V0 , NV ) , _const ( V0 , _stateid ( michigan ) ) ) )
what is the highest mountain in iowa ?	_answer ( NV , _highest ( V0 , ( _mountain ( V0 ) , _loc ( V0 , NV ) , _const ( V0 , _stateid ( iowa ) ) ) ) )
what is the population of columbus ga ?	_answer ( NV , ( _population ( NV , V1 ) , _const ( V0 , _cityid ( columbus , _ ) ) ) )
what is the city in new mexico with the largest population ?	_answer ( NV , _largest ( NV , ( _city ( V1 ) , _loc ( V1 , NV ) , _const ( V0 , _stateid ( ' new mexico ' ) ) , _population ( V2 , V1 ) ) ) )
how many states does washington border ?	_answer ( NV , _count ( NV , ( _state ( V0 ) , _const ( NV , _stateid ( washington ) ) , _next_to ( V0 , V1 ) ) , V2 ) )
what are the populations of the states through which the missouri river run ?	_answer ( NV , ( _population ( NV , V1 ) , _state ( V0 ) , _const ( NV , _riverid ( missouri ) ) , _traverse ( V0 , V1 ) ) )
where is the lowest spot in washington ?	_answer ( NV , _lowest ( V0 , ( _place ( V0 ) , _loc ( V0 , NV ) , _const ( V0 , _stateid ( washington ) ) ) ) )
which is the lowest point of the states that the colorado river runs through ?	_answer ( NV , _lowest ( V0 , ( _place ( V0 ) , _loc ( V0 , NV ) , _state ( V0 ) , _const ( NV , _riverid ( colorado ) ) , _traverse ( V0 , V1 ) ) ) )
what are the populations of the states through which the red run ?	_answer ( NV , ( _population ( NV , V1 ) , _state ( V0 ) , _const ( NV , _riverid ( red ) ) , _traverse ( V0 , V1 ) ) )
what is the size of new mexico ?	_answer ( NV , ( _size ( NV , V1 ) , _const ( V0 , _stateid ( ' new mexico ' ) ) ) )
what is the largest of the state that the mississippi river runs through ?	_answer ( NV , _largest ( V0 , ( _state ( V0 ) , _const ( NV , _riverid ( mississippi ) ) , _traverse ( V0 , V1 ) ) ) )
what are the rivers in the state of oklahoma ?	_answer ( NV , ( _river ( V0 ) , _loc ( V0 , NV ) , _state ( V0 ) , _const ( V0 , _stateid ( oklahoma ) ) ) )
what are the cities in colorado ?	_answer ( NV , ( _city ( V0 ) , _loc ( V0 , NV ) , _const ( V0 , _stateid ( colorado ) ) ) )
which state border north dakota ?	_answer ( NV , ( _state ( V0 ) , _next_to ( V0 , NV ) , _const ( V0 , _stateid ( ' north dakota ' ) ) ) )
what states does the colorado river run through ?	_answer ( NV , ( _state ( V0 ) , _const ( NV , _riverid ( colorado ) ) , _traverse ( V0 , V1 ) ) )
what is the area of west virginia in square kilometers ?	_answer ( NV , ( _area ( NV , V1 ) , _const ( V0 , _stateid ( ' west virginia ' ) ) ) )
what are the major cities of missouri ?	_answer ( NV , ( _major ( V0 ) , _city ( V0 ) , _loc ( V0 , NV ) , _const ( V0 , _stateid ( missouri ) ) ) )
what are the lakes in states bordering ohio ?	_answer ( NV , ( _lake ( V0 ) , _loc ( V0 , NV ) , _state ( V0 ) , _next_to ( V0 , NV ) , _const ( V0 , _stateid ( ohio ) ) ) )
what are the biggest rivers in florida ?	_answer ( NV , _longest ( V0 , ( _river ( V0 ) , _loc ( V0 , NV ) , _const ( V0 , _stateid ( florida ) ) ) ) )
how many rivers run through vermont ?	_answer ( NV , _count ( NV , ( _river ( V0 ) , _traverse ( V0 , NV ) , _const ( V0 , _stateid ( vermont ) ) ) , V2 ) )
where is north dakota ?	_answer ( NV , ( _loc ( NV , V1 ) , _const ( V0 , _stateid ( ' north dakota ' ) ) ) )
what is the area of the state with the capital springfield ?	_answer ( NV , ( _area ( NV , V1 ) , _state ( V0 ) , _loc ( NV , V1 ) , _capital ( V0 ) , _const ( V0 , _cityid ( springfield , _ ) ) ) )
how many states border idaho ?	_answer ( NV , _count ( NV , ( _state ( V0 ) , _next_to ( V0 , NV ) , _const ( V0 , _stateid ( idaho ) ) ) , V2 ) )
what is the average population per square km in ohio ?	_answer ( NV , ( _density ( NV , V1 ) , _const ( V0 , _stateid ( ohio ) ) ) )
could you tell me what is the highest point in the state of arkansas ?	_answer ( NV , _highest ( V0 , ( _place ( V0 ) , _loc ( V0 , NV ) , _state ( V0 ) , _const ( V0 , _stateid ( arkansas ) ) ) ) )
what is the lowest point in the state of west virginia ?	_answer ( NV , _lowest ( V0 , ( _place ( V0 ) , _loc ( V0 , NV ) , _state ( V0 ) , _const ( V0 , _stateid ( ' west virginia ' ) ) ) ) )
how big is iowa ?	_answer ( NV , ( _size ( NV , V1 ) , _const ( V0 , _stateid ( iowa ) ) ) )
what are the biggest rivers in virginia ?	_answer ( NV , _longest ( V0 , ( _river ( V0 ) , _loc ( V0 , NV ) , _const ( V0 , _stateid ( virginia ) ) ) ) )
what states border states that border states that border new hampshire ?	_answer ( NV , ( _state ( V0 ) , _next_to ( V0 , NV ) , _state ( V0 ) , _next_to ( V0 , NV ) , _state ( V0 ) , _next_to ( V0 , NV ) , _const ( V0 , _stateid ( ' new hampshire ' ) ) ) )
what state has the capital scotts valley ?	_answer ( NV , ( _state ( V0 ) , _loc ( NV , V1 ) , _capital ( V0 ) , _const ( V0 , _cityid ( ' scotts valley ' , _ ) ) ) )
through which states does the potomac run ?	_answer ( NV , ( _state ( V0 ) , _const ( NV , _riverid ( potomac ) ) , _traverse ( V0 , V1 ) ) )
what major rivers run through colorado ?	_answer ( NV , ( _major ( V0 ) , _river ( V0 ) , _traverse ( V0 , NV ) , _const ( V0 , _stateid ( colorado ) ) ) )
what is the most populous city in south dakota ?	_answer ( NV , _largest ( NV , ( _population ( V1 , V0 ) , _city ( V1 ) , _loc ( V1 , NV ) , _const ( V0 , _stateid ( ' south dakota ' ) ) ) ) )
how many cities does minnesota have ?	_answer ( NV , _count ( NV , ( _city ( V0 ) , _const ( NV , _stateid ( minnesota ) ) , _loc ( V1 , V0 ) ) , V2 ) )
how many citizens live in hawaii ?	_answer ( NV , ( _population ( NV , V1 ) , _const ( V0 , _stateid ( hawaii ) ) ) )
people in austin ?	_answer ( NV , ( _population ( NV , V1 ) , _const ( V0 , _cityid ( austin , _ ) ) ) )
what states border states that border arizona ?	_answer ( NV , ( _state ( V0 ) , _next_to ( V0 , NV ) , _state ( V0 ) , _next_to ( V0 , NV ) , _const ( V0 , _stateid ( arizona ) ) ) )
what states border states that border missouri ?	_answer ( NV , ( _state ( V0 ) , _next_to ( V0 , NV ) , _state ( V0 ) , _next_to ( V0 , NV ) , _const ( V0 , _stateid ( missouri ) ) ) )
name the major lakes in illinois ?	_answer ( NV , ( _major ( V0 ) , _lake ( V0 ) , _loc ( V0 , NV ) , _const ( V0 , _stateid ( illinois ) ) ) )
what is the height of the highest mountain in vermont ?	_answer ( NV , ( _elevation ( NV , V1 ) , _highest ( V0 , ( _mountain ( V0 ) , _loc ( V0 , NV ) , _const ( V0 , _stateid ( vermont ) ) ) ) ) )
how many states have cities or towns named riverside ?	_answer ( NV , _count ( NV , ( _state ( V0 ) , _loc ( NV , V1 ) , _city ( V0 ) , _const ( V0 , _cityid ( riverside , _ ) ) ) , V2 ) )
which state has the smallest area that borders south dakota ?	_answer ( NV , _smallest ( NV , ( _state ( V1 ) , _area ( V1 , V0 ) , _next_to ( V1 , NV ) , _const ( V0 , _stateid ( ' south dakota ' ) ) ) ) )
what states border states that border states that border kentucky ?	_answer ( NV , ( _state ( V0 ) , _next_to ( V0 , NV ) , _state ( V0 ) , _next_to ( V0 , NV ) , _state ( V0 ) , _next_to ( V0 , NV ) , _const ( V0 , _stateid ( kentucky ) ) ) )
what state has the capital fort wayne ?	_answer ( NV , ( _state ( V0 ) , _loc ( NV , V1 ) , _capital ( V0 ) , _const ( V0 , _cityid ( ' fort wayne ' , _ ) ) ) )
what can you tell me about the population of ohio ?	_answer ( NV , ( _population ( NV , V1 ) , _const ( V0 , _stateid ( ohio ) ) ) )
what states border nebraska ?	_answer ( NV , ( _state ( V0 ) , _next_to ( V0 , NV ) , _const ( V0 , _stateid ( nebraska ) ) ) )
what is the longest river in virginia ?	_answer ( NV , _longest ( V0 , ( _river ( V0 ) , _loc ( V0 , NV ) , _const ( V0 , _stateid ( virginia ) ) ) ) )
how many people in atlanta ?	_answer ( NV , ( _population ( NV , V1 ) , _const ( V0 , _cityid ( atlanta , _ ) ) ) )
how many citizens in austin ?	_answer ( NV , ( _population ( NV , V1 ) , _const ( V0 , _cityid ( austin , _ ) ) ) )
what is the capital of the new york state ?	_answer ( NV , ( _capital ( V0 ) , _loc ( V0 , NV ) , _const ( V0 , _stateid ( ' new york ' ) ) , _state ( V0 ) ) )
what is the size of the capital of virginia ?	_answer ( NV , ( _size ( NV , V1 ) , _capital ( V0 ) , _loc ( V0 , NV ) , _const ( V0 , _stateid ( virginia ) ) ) )
could you tell me what is the highest point in the state of indiana ?	_answer ( NV , _highest ( V0 , ( _place ( V0 ) , _loc ( V0 , NV ) , _state ( V0 ) , _const ( V0 , _stateid ( indiana ) ) ) ) )
what is the largest city in states that border oregon ?	_answer ( NV , _largest ( V0 , ( _city ( V0 ) , _loc ( V0 , NV ) , _state ( V0 ) , _next_to ( V0 , NV ) , _const ( V0 , _stateid ( oregon ) ) ) ) )
what states border states that border states that border states that border indiana ?	_answer ( NV , ( _state ( V0 ) , _next_to ( V0 , NV ) , _state ( V0 ) , _next_to ( V0 , NV ) , _state ( V0 ) , _next_to ( V0 , NV ) , _state ( V0 ) , _next_to ( V0 , NV ) , _const ( V0 , _stateid ( indiana ) ) ) )
what is the largest state that borders delaware ?	_answer ( NV , _largest ( V0 , ( _state ( V0 ) , _next_to ( V0 , NV ) , _const ( V0 , _stateid ( delaware ) ) ) ) )
what is the area of sacramento ?	_answer ( NV , ( _area ( NV , V1 ) , _const ( V0 , _cityid ( sacramento , _ ) ) ) )
how many rivers do not traverse the state with the capital pittsburgh ?	_answer ( NV , _count ( NV , ( _river ( V0 ) , \+ ( _traverse ( V0 , NV ) , _state ( V0 ) , _loc ( NV , V1 ) , _capital ( V0 ) , _const ( V0 , _cityid ( pittsburgh , _ ) ) ) ) , V3 ) )
what are the cities in arizona ?	_answer ( NV , ( _city ( V0 ) , _loc ( V0 , NV ) , _const ( V0 , _stateid ( arizona ) ) ) )
what rivers are in wisconsin ?	_answer ( NV , ( _river ( V0 ) , _loc ( V0 , NV ) , _const ( V0 , _stateid ( wisconsin ) ) ) )
how many states border indiana and border arkansas ?	_answer ( NV , _count ( NV , ( _state ( V0 ) , _next_to ( V0 , NV ) , _const ( V0 , _stateid ( indiana ) ) , _next_to ( V1 , NV ) , _const ( V0 , _stateid ( arkansas ) ) ) , V3 ) )
what is the total population of the states that border alabama ?	_answer ( NV , _sum ( NV , ( _state ( V0 ) , _next_to ( NV , V1 ) , _const ( V0 , _stateid ( alabama ) ) ) , _population ( V1 ) , V2 ) )
what is the longest river that runs through a state that borders louisiana ?	_answer ( NV , _longest ( V0 , ( _river ( V0 ) , _traverse ( V0 , NV ) , _state ( V0 ) , _next_to ( V0 , NV ) , _const ( V0 , _stateid ( louisiana ) ) ) ) )
how many major cities are in arkansas ?	_answer ( NV , _count ( NV , ( _major ( V0 ) , _city ( V0 ) , _loc ( V0 , NV ) , _const ( V0 , _stateid ( arkansas ) ) ) , V2 ) )
what is the number of neighboring states for south carolina ?	_answer ( NV , _count ( NV , ( _state ( V0 ) , _next_to ( V0 , NV ) , _const ( V0 , _stateid ( ' south carolina ' ) ) ) , V2 ) )
which state is the largest city in wyoming in ?	_answer ( NV , ( _state ( V0 ) , _largest ( NV , ( _city ( V0 ) , _loc ( V0 , NV ) , _const ( V0 , _stateid ( wyoming ) ) ) ) , _loc ( V1 , V2 ) ) )
how many states does oregon border ?	_answer ( NV , _count ( NV , ( _state ( V0 ) , _const ( NV , _stateid ( oregon ) ) , _next_to ( V0 , V1 ) ) , V2 ) )
what can you tell me about the population of ohio ?	_answer ( NV , ( _population ( NV , V1 ) , _const ( V0 , _stateid ( ohio ) ) ) )
how many states border the rio grande river ?	_answer ( NV , _count ( NV , ( _state ( V0 ) , _next_to ( V0 , NV ) , _const ( V0 , _riverid ( ' rio grande ' ) ) , _river ( V0 ) ) , V2 ) )
what is the capital of the state that borders the state that borders hawaii ?	_answer ( NV , ( _capital ( V0 ) , _loc ( V0 , NV ) , _state ( V0 ) , _next_to ( V0 , NV ) , _state ( V0 ) , _next_to ( V0 , NV ) , _const ( V0 , _stateid ( hawaii ) ) ) )
what is the density of georgia ?	_answer ( NV , ( _density ( NV , V1 ) , _const ( V0 , _stateid ( georgia ) ) ) )
what cities in nebraska ?	_answer ( NV , ( _city ( V0 ) , _loc ( V0 , NV ) , _const ( V0 , _stateid ( nebraska ) ) ) )
rochester is the capital of which state ?	_answer ( NV , ( _const ( NV , _cityid ( rochester , _ ) ) , _capital ( V0 ) , _loc ( V0 , V1 ) , _state ( V1 ) ) )
in which state is new york ?	_answer ( NV , ( _loc ( NV , V1 ) , _state ( V1 ) , _const ( V0 , _cityid ( ' new york ' , _ ) ) ) )
what is the average population per square km in massachusetts ?	_answer ( NV , ( _density ( NV , V1 ) , _const ( V0 , _stateid ( massachusetts ) ) ) )
which states border indiana ?	_answer ( NV , ( _state ( V0 ) , _next_to ( V0 , NV ) , _const ( V0 , _stateid ( indiana ) ) ) )
which state is the largest city in new hampshire in ?	_answer ( NV , ( _state ( V0 ) , _largest ( NV , ( _city ( V0 ) , _loc ( V0 , NV ) , _const ( V0 , _stateid ( ' new hampshire ' ) ) ) ) , _loc ( V1 , V2 ) ) )
how many people are there in ohio ?	_answer ( NV , ( _population ( NV , V1 ) , _const ( V0 , _stateid ( ohio ) ) ) )
what states have rivers named rio grande ?	_answer ( NV , ( _state ( V0 ) , _loc ( NV , V1 ) , _const ( V0 , _riverid ( ' rio grande ' ) ) ) )
how long is mississippi ?	_answer ( NV , ( _len ( NV , V1 ) , _const ( V0 , _riverid ( mississippi ) ) ) )
how long is the rio grande ?	_answer ( NV , ( _len ( NV , V1 ) , _const ( V0 , _riverid ( ' rio grande ' ) ) , _river ( V0 ) ) )
